Requirement already satisfied: pip in /usr/local/lib/python3.10/dist-packages (25.2)
WARNING: Running pip as the 'root' user can result in broken permissions and conflicting behaviour with the system package manager, possibly rendering your system unusable. It is recommended to use a virtual environment instead: https://pip.pypa.io/warnings/venv. Use the --root-user-action option if you know what you are doing and want to suppress this warning.
Processing /app
  Installing build dependencies: started
  Installing build dependencies: finished with status 'done'
  Getting requirements to build wheel: started
  Getting requirements to build wheel: finished with status 'done'
  Preparing metadata (pyproject.toml): started
  Preparing metadata (pyproject.toml): finished with status 'done'
Requirement already satisfied: requests>=2.26.0 in /usr/local/lib/python3.10/dist-packages (from docker==0.1.0) (2.32.5)
Requirement already satisfied: urllib3>=1.26.0 in /usr/local/lib/python3.10/dist-packages (from docker==0.1.0) (2.5.0)
Requirement already satisfied: paramiko>=2.4.3 in /usr/local/lib/python3.10/dist-packages (from docker==0.1.0) (4.0.0)
Requirement already satisfied: coverage==7.2.7 in /usr/local/lib/python3.10/dist-packages (from docker==0.1.0) (7.2.7)
Requirement already satisfied: pytest-cov==4.1.0 in /usr/local/lib/python3.10/dist-packages (from docker==0.1.0) (4.1.0)
Requirement already satisfied: pytest-timeout==2.1.0 in /usr/local/lib/python3.10/dist-packages (from docker==0.1.0) (2.1.0)
Requirement already satisfied: pytest==7.4.2 in /usr/local/lib/python3.10/dist-packages (from docker==0.1.0) (7.4.2)
Requirement already satisfied: ruff==0.1.8 in /usr/local/lib/python3.10/dist-packages (from docker==0.1.0) (0.1.8)
Requirement already satisfied: iniconfig in /usr/local/lib/python3.10/dist-packages (from pytest==7.4.2->docker==0.1.0) (2.1.0)
Requirement already satisfied: packaging in /usr/local/lib/python3.10/dist-packages (from pytest==7.4.2->docker==0.1.0) (25.0)
Requirement already satisfied: pluggy<2.0,>=0.12 in /usr/local/lib/python3.10/dist-packages (from pytest==7.4.2->docker==0.1.0) (1.6.0)
Requirement already satisfied: exceptiongroup>=1.0.0rc8 in /usr/local/lib/python3.10/dist-packages (from pytest==7.4.2->docker==0.1.0) (1.3.0)
Requirement already satisfied: tomli>=1.0.0 in /usr/local/lib/python3.10/dist-packages (from pytest==7.4.2->docker==0.1.0) (2.2.1)
Requirement already satisfied: typing-extensions>=4.6.0 in /usr/local/lib/python3.10/dist-packages (from exceptiongroup>=1.0.0rc8->pytest==7.4.2->docker==0.1.0) (4.15.0)
Requirement already satisfied: bcrypt>=3.2 in /usr/local/lib/python3.10/dist-packages (from paramiko>=2.4.3->docker==0.1.0) (4.3.0)
Requirement already satisfied: cryptography>=3.3 in /usr/local/lib/python3.10/dist-packages (from paramiko>=2.4.3->docker==0.1.0) (45.0.7)
Requirement already satisfied: invoke>=2.0 in /usr/local/lib/python3.10/dist-packages (from paramiko>=2.4.3->docker==0.1.0) (2.2.0)
Requirement already satisfied: pynacl>=1.5 in /usr/local/lib/python3.10/dist-packages (from paramiko>=2.4.3->docker==0.1.0) (1.5.0)
Requirement already satisfied: cffi>=1.14 in /usr/local/lib/python3.10/dist-packages (from cryptography>=3.3->paramiko>=2.4.3->docker==0.1.0) (1.17.1)
Requirement already satisfied: pycparser in /usr/local/lib/python3.10/dist-packages (from cffi>=1.14->cryptography>=3.3->paramiko>=2.4.3->docker==0.1.0) (2.22)
Requirement already satisfied: charset_normalizer<4,>=2 in /usr/local/lib/python3.10/dist-packages (from requests>=2.26.0->docker==0.1.0) (3.4.3)
Requirement already satisfied: idna<4,>=2.5 in /usr/local/lib/python3.10/dist-packages (from requests>=2.26.0->docker==0.1.0) (3.10)
Requirement already satisfied: certifi>=2017.4.17 in /usr/local/lib/python3.10/dist-packages (from requests>=2.26.0->docker==0.1.0) (2025.8.3)
Building wheels for collected packages: docker
  Building wheel for docker (pyproject.toml): started
  Building wheel for docker (pyproject.toml): finished with status 'done'
  Created wheel for docker: filename=docker-0.1.0-py3-none-any.whl size=147928 sha256=6c89eef70a415e6ab4f33cb23affd4aa235f609e9774d31fd9797071edefd773
  Stored in directory: /tmp/pip-ephem-wheel-cache-w_pa7kme/wheels/9b/2c/d1/15e20a2b97f37ccf65a87ba1049c73a9076d0bf0fbaf814e83
Successfully built docker
Installing collected packages: docker
  Attempting uninstall: docker
    Found existing installation: docker 0.1.0
    Uninstalling docker-0.1.0:
      Successfully uninstalled docker-0.1.0
Successfully installed docker-0.1.0
WARNING: Running pip as the 'root' user can result in broken permissions and conflicting behaviour with the system package manager, possibly rendering your system unusable. It is recommended to use a virtual environment instead: https://pip.pypa.io/warnings/venv. Use the --root-user-action option if you know what you are doing and want to suppress this warning.
Requirement already satisfied: build in /usr/local/lib/python3.10/dist-packages (1.3.0)
Requirement already satisfied: packaging>=19.1 in /usr/local/lib/python3.10/dist-packages (from build) (25.0)
Requirement already satisfied: pyproject_hooks in /usr/local/lib/python3.10/dist-packages (from build) (1.2.0)
Requirement already satisfied: tomli>=1.1.0 in /usr/local/lib/python3.10/dist-packages (from build) (2.2.1)
WARNING: Running pip as the 'root' user can result in broken permissions and conflicting behaviour with the system package manager, possibly rendering your system unusable. It is recommended to use a virtual environment instead: https://pip.pypa.io/warnings/venv. Use the --root-user-action option if you know what you are doing and want to suppress this warning.
* Creating isolated environment: venv+pip...
* Installing packages in isolated environment:
  - hatch-vcs
  - hatchling
* Getting build dependencies for sdist...
* Building sdist...
* Building wheel from sdist
* Creating isolated environment: venv+pip...
* Installing packages in isolated environment:
  - hatch-vcs
  - hatchling
* Getting build dependencies for wheel...
* Building wheel...
Successfully built docker-0.1.0.tar.gz and docker-0.1.0-py3-none-any.whl
/app/run.sh: line 14: docker: command not found
============================= test session starts ==============================
platform linux -- Python 3.10.12, pytest-7.4.2, pluggy-1.6.0 -- /usr/bin/python3
cachedir: .pytest_cache
rootdir: /app
configfile: pytest.ini
plugins: cov-4.1.0, timeout-2.1.0
collecting ... collected 626 items

tests/unit/api_build_test.py::BuildTest::test_build_container PASSED     [  0%]
tests/unit/api_build_test.py::BuildTest::test_build_container_custom_context PASSED [  0%]
tests/unit/api_build_test.py::BuildTest::test_build_container_custom_context_gzip PASSED [  0%]
tests/unit/api_build_test.py::BuildTest::test_build_container_invalid_container_limits PASSED [  0%]
tests/unit/api_build_test.py::BuildTest::test_build_container_pull PASSED [  0%]
tests/unit/api_build_test.py::BuildTest::test_build_container_with_container_limits PASSED [  0%]
tests/unit/api_build_test.py::BuildTest::test_build_container_with_named_dockerfile PASSED [  1%]
tests/unit/api_build_test.py::BuildTest::test_build_remote_with_registry_auth PASSED [  1%]
tests/unit/api_build_test.py::BuildTest::test_build_with_invalid_tag PASSED [  1%]
tests/unit/api_build_test.py::BuildTest::test_process_dockerfile PASSED  [  1%]
tests/unit/api_build_test.py::BuildTest::test_process_dockerfile_win_longpath_prefix SKIPPED [  1%]
tests/unit/api_build_test.py::BuildTest::test_set_auth_headers_with_dict_and_auth_configs PASSED [  1%]
tests/unit/api_build_test.py::BuildTest::test_set_auth_headers_with_dict_and_no_auth_configs PASSED [  2%]
tests/unit/api_build_test.py::BuildTest::test_set_auth_headers_with_empty_dict_and_auth_configs PASSED [  2%]
tests/unit/api_container_test.py::StartContainerTest::test_start_container PASSED [  2%]
tests/unit/api_container_test.py::StartContainerTest::test_start_container_none PASSED [  2%]
tests/unit/api_container_test.py::StartContainerTest::test_start_container_privileged PASSED [  2%]
tests/unit/api_container_test.py::StartContainerTest::test_start_container_regression_573 PASSED [  2%]
tests/unit/api_container_test.py::StartContainerTest::test_start_container_with_binds_ro PASSED [  3%]
tests/unit/api_container_test.py::StartContainerTest::test_start_container_with_binds_rw PASSED [  3%]
tests/unit/api_container_test.py::StartContainerTest::test_start_container_with_dict_instead_of_id PASSED [  3%]
tests/unit/api_container_test.py::StartContainerTest::test_start_container_with_links PASSED [  3%]
tests/unit/api_container_test.py::StartContainerTest::test_start_container_with_links_as_list_of_tuples PASSED [  3%]
tests/unit/api_container_test.py::StartContainerTest::test_start_container_with_lxc_conf PASSED [  3%]
tests/unit/api_container_test.py::StartContainerTest::test_start_container_with_lxc_conf_compat PASSED [  3%]
tests/unit/api_container_test.py::StartContainerTest::test_start_container_with_multiple_links PASSED [  4%]
tests/unit/api_container_test.py::StartContainerTest::test_start_container_with_port_binds PASSED [  4%]
tests/unit/api_container_test.py::CreateContainerTest::test_create_container PASSED [  4%]
tests/unit/api_container_test.py::CreateContainerTest::test_create_container_privileged PASSED [  4%]
tests/unit/api_container_test.py::CreateContainerTest::test_create_container_with_added_capabilities PASSED [  4%]
tests/unit/api_container_test.py::CreateContainerTest::test_create_container_with_aliases PASSED [  4%]
tests/unit/api_container_test.py::CreateContainerTest::test_create_container_with_binds PASSED [  5%]
tests/unit/api_container_test.py::CreateContainerTest::test_create_container_with_binds_list PASSED [  5%]
tests/unit/api_container_test.py::CreateContainerTest::test_create_container_with_binds_mode PASSED [  5%]
tests/unit/api_container_test.py::CreateContainerTest::test_create_container_with_binds_mode_and_ro_error PASSED [  5%]
tests/unit/api_container_test.py::CreateContainerTest::test_create_container_with_binds_ro PASSED [  5%]
tests/unit/api_container_test.py::CreateContainerTest::test_create_container_with_binds_rw PASSED [  5%]
tests/unit/api_container_test.py::CreateContainerTest::test_create_container_with_cgroup_parent PASSED [  6%]
tests/unit/api_container_test.py::CreateContainerTest::test_create_container_with_cgroupns PASSED [  6%]
tests/unit/api_container_test.py::CreateContainerTest::test_create_container_with_device_requests PASSED [  6%]
tests/unit/api_container_test.py::CreateContainerTest::test_create_container_with_devices PASSED [  6%]
tests/unit/api_container_test.py::CreateContainerTest::test_create_container_with_dropped_capabilities PASSED [  6%]
tests/unit/api_container_test.py::CreateContainerTest::test_create_container_with_entrypoint PASSED [  6%]
tests/unit/api_container_test.py::CreateContainerTest::test_create_container_with_host_config_cpu_shares PASSED [  7%]
tests/unit/api_container_test.py::CreateContainerTest::test_create_container_with_host_config_cpus PASSED [  7%]
tests/unit/api_container_test.py::CreateContainerTest::test_create_container_with_host_config_cpuset PASSED [  7%]
tests/unit/api_container_test.py::CreateContainerTest::test_create_container_with_host_config_cpuset_mems PASSED [  7%]
tests/unit/api_container_test.py::CreateContainerTest::test_create_container_with_labels_dict PASSED [  7%]
tests/unit/api_container_test.py::CreateContainerTest::test_create_container_with_labels_list PASSED [  7%]
tests/unit/api_container_test.py::CreateContainerTest::test_create_container_with_links PASSED [  7%]
tests/unit/api_container_test.py::CreateContainerTest::test_create_container_with_links_as_list_of_tuples PASSED [  8%]
tests/unit/api_container_test.py::CreateContainerTest::test_create_container_with_lxc_conf PASSED [  8%]
tests/unit/api_container_test.py::CreateContainerTest::test_create_container_with_lxc_conf_compat PASSED [  8%]
tests/unit/api_container_test.py::CreateContainerTest::test_create_container_with_mac_address PASSED [  8%]
tests/unit/api_container_test.py::CreateContainerTest::test_create_container_with_mem_limit_as_int PASSED [  8%]
tests/unit/api_container_test.py::CreateContainerTest::test_create_container_with_mem_limit_as_string PASSED [  8%]
tests/unit/api_container_test.py::CreateContainerTest::test_create_container_with_mem_limit_as_string_with_g_unit PASSED [  9%]
tests/unit/api_container_test.py::CreateContainerTest::test_create_container_with_mem_limit_as_string_with_k_unit PASSED [  9%]
tests/unit/api_container_test.py::CreateContainerTest::test_create_container_with_mem_limit_as_string_with_m_unit PASSED [  9%]
tests/unit/api_container_test.py::CreateContainerTest::test_create_container_with_mem_limit_as_string_with_wrong_value PASSED [  9%]
tests/unit/api_container_test.py::CreateContainerTest::test_create_container_with_multiple_links PASSED [  9%]
tests/unit/api_container_test.py::CreateContainerTest::test_create_container_with_named_volume PASSED [  9%]
tests/unit/api_container_test.py::CreateContainerTest::test_create_container_with_platform PASSED [ 10%]
tests/unit/api_container_test.py::CreateContainerTest::test_create_container_with_port_binds PASSED [ 10%]
tests/unit/api_container_test.py::CreateContainerTest::test_create_container_with_ports PASSED [ 10%]
tests/unit/api_container_test.py::CreateContainerTest::test_create_container_with_restart_policy PASSED [ 10%]
tests/unit/api_container_test.py::CreateContainerTest::test_create_container_with_stdin_open PASSED [ 10%]
tests/unit/api_container_test.py::CreateContainerTest::test_create_container_with_stop_signal PASSED [ 10%]
tests/unit/api_container_test.py::CreateContainerTest::test_create_container_with_sysctl PASSED [ 11%]
tests/unit/api_container_test.py::CreateContainerTest::test_create_container_with_tmpfs_dict PASSED [ 11%]
tests/unit/api_container_test.py::CreateContainerTest::test_create_container_with_tmpfs_list PASSED [ 11%]
tests/unit/api_container_test.py::CreateContainerTest::test_create_container_with_unicode_envvars PASSED [ 11%]
tests/unit/api_container_test.py::CreateContainerTest::test_create_container_with_volume_string PASSED [ 11%]
tests/unit/api_container_test.py::CreateContainerTest::test_create_container_with_working_dir PASSED [ 11%]
tests/unit/api_container_test.py::CreateContainerTest::test_create_named_container PASSED [ 11%]
tests/unit/api_container_test.py::ContainerTest::test_container_stats PASSED [ 12%]
tests/unit/api_container_test.py::ContainerTest::test_container_stats_with_one_shot PASSED [ 12%]
tests/unit/api_container_test.py::ContainerTest::test_container_stats_without_streaming PASSED [ 12%]
tests/unit/api_container_test.py::ContainerTest::test_container_top PASSED [ 12%]
tests/unit/api_container_test.py::ContainerTest::test_container_top_with_psargs PASSED [ 12%]
tests/unit/api_container_test.py::ContainerTest::test_container_update PASSED [ 12%]
tests/unit/api_container_test.py::ContainerTest::test_diff PASSED        [ 13%]
tests/unit/api_container_test.py::ContainerTest::test_diff_with_dict_instead_of_id PASSED [ 13%]
tests/unit/api_container_test.py::ContainerTest::test_export PASSED      [ 13%]
tests/unit/api_container_test.py::ContainerTest::test_export_with_dict_instead_of_id PASSED [ 13%]
tests/unit/api_container_test.py::ContainerTest::test_inspect_container PASSED [ 13%]
tests/unit/api_container_test.py::ContainerTest::test_inspect_container_undefined_id PASSED [ 13%]
tests/unit/api_container_test.py::ContainerTest::test_kill_container PASSED [ 14%]
tests/unit/api_container_test.py::ContainerTest::test_kill_container_with_dict_instead_of_id PASSED [ 14%]
tests/unit/api_container_test.py::ContainerTest::test_kill_container_with_signal PASSED [ 14%]
tests/unit/api_container_test.py::ContainerTest::test_list_containers PASSED [ 14%]
tests/unit/api_container_test.py::ContainerTest::test_log_following PASSED [ 14%]
tests/unit/api_container_test.py::ContainerTest::test_log_following_backwards PASSED [ 14%]
tests/unit/api_container_test.py::ContainerTest::test_log_since PASSED   [ 15%]
tests/unit/api_container_test.py::ContainerTest::test_log_since_with_datetime PASSED [ 15%]
tests/unit/api_container_test.py::ContainerTest::test_log_since_with_float PASSED [ 15%]
tests/unit/api_container_test.py::ContainerTest::test_log_since_with_invalid_value_raises_error PASSED [ 15%]
tests/unit/api_container_test.py::ContainerTest::test_log_streaming PASSED [ 15%]
tests/unit/api_container_test.py::ContainerTest::test_log_streaming_and_following PASSED [ 15%]
tests/unit/api_container_test.py::ContainerTest::test_log_tail PASSED    [ 15%]
tests/unit/api_container_test.py::ContainerTest::test_log_tty PASSED     [ 16%]
tests/unit/api_container_test.py::ContainerTest::test_logs PASSED        [ 16%]
tests/unit/api_container_test.py::ContainerTest::test_logs_with_dict_instead_of_id PASSED [ 16%]
tests/unit/api_container_test.py::ContainerTest::test_pause_container PASSED [ 16%]
tests/unit/api_container_test.py::ContainerTest::test_port PASSED        [ 16%]
tests/unit/api_container_test.py::ContainerTest::test_remove_container PASSED [ 16%]
tests/unit/api_container_test.py::ContainerTest::test_remove_container_with_dict_instead_of_id PASSED [ 17%]
tests/unit/api_container_test.py::ContainerTest::test_rename_container PASSED [ 17%]
tests/unit/api_container_test.py::ContainerTest::test_resize_container PASSED [ 17%]
tests/unit/api_container_test.py::ContainerTest::test_restart_container PASSED [ 17%]
tests/unit/api_container_test.py::ContainerTest::test_restart_container_with_dict_instead_of_id PASSED [ 17%]
tests/unit/api_container_test.py::ContainerTest::test_stop_container PASSED [ 17%]
tests/unit/api_container_test.py::ContainerTest::test_stop_container_with_dict_instead_of_id PASSED [ 18%]
tests/unit/api_container_test.py::ContainerTest::test_unpause_container PASSED [ 18%]
tests/unit/api_container_test.py::ContainerTest::test_wait PASSED        [ 18%]
tests/unit/api_container_test.py::ContainerTest::test_wait_with_dict_instead_of_id PASSED [ 18%]
tests/unit/api_exec_test.py::ExecTest::test_exec_create PASSED           [ 18%]
tests/unit/api_exec_test.py::ExecTest::test_exec_inspect PASSED          [ 18%]
tests/unit/api_exec_test.py::ExecTest::test_exec_resize PASSED           [ 19%]
tests/unit/api_exec_test.py::ExecTest::test_exec_start PASSED            [ 19%]
tests/unit/api_exec_test.py::ExecTest::test_exec_start_detached PASSED   [ 19%]
tests/unit/api_image_test.py::ImageTest::test_commit PASSED              [ 19%]
tests/unit/api_image_test.py::ImageTest::test_get_image PASSED           [ 19%]
tests/unit/api_image_test.py::ImageTest::test_image_history PASSED       [ 19%]
tests/unit/api_image_test.py::ImageTest::test_image_ids PASSED           [ 19%]
tests/unit/api_image_test.py::ImageTest::test_image_viz PASSED           [ 20%]
tests/unit/api_image_test.py::ImageTest::test_images PASSED              [ 20%]
tests/unit/api_image_test.py::ImageTest::test_images_filters PASSED      [ 20%]
tests/unit/api_image_test.py::ImageTest::test_images_name PASSED         [ 20%]
tests/unit/api_image_test.py::ImageTest::test_images_quiet PASSED        [ 20%]
tests/unit/api_image_test.py::ImageTest::test_import_image PASSED        [ 20%]
tests/unit/api_image_test.py::ImageTest::test_import_image_from_bytes PASSED [ 21%]
tests/unit/api_image_test.py::ImageTest::test_import_image_from_image PASSED [ 21%]
tests/unit/api_image_test.py::ImageTest::test_inspect_image PASSED       [ 21%]
tests/unit/api_image_test.py::ImageTest::test_inspect_image_undefined_id PASSED [ 21%]
tests/unit/api_image_test.py::ImageTest::test_load_image PASSED          [ 21%]
tests/unit/api_image_test.py::ImageTest::test_load_image_quiet PASSED    [ 21%]
tests/unit/api_image_test.py::ImageTest::test_pull PASSED                [ 22%]
tests/unit/api_image_test.py::ImageTest::test_pull_stream PASSED         [ 22%]
tests/unit/api_image_test.py::ImageTest::test_push_image PASSED          [ 22%]
tests/unit/api_image_test.py::ImageTest::test_push_image_stream PASSED   [ 22%]
tests/unit/api_image_test.py::ImageTest::test_push_image_with_auth PASSED [ 22%]
tests/unit/api_image_test.py::ImageTest::test_push_image_with_tag PASSED [ 22%]
tests/unit/api_image_test.py::ImageTest::test_remove_image PASSED        [ 23%]
tests/unit/api_image_test.py::ImageTest::test_tag_image PASSED           [ 23%]
tests/unit/api_image_test.py::ImageTest::test_tag_image_force PASSED     [ 23%]
tests/unit/api_image_test.py::ImageTest::test_tag_image_tag PASSED       [ 23%]
tests/unit/api_network_test.py::NetworkTest::test_connect_container_to_network PASSED [ 23%]
tests/unit/api_network_test.py::NetworkTest::test_create_network PASSED  [ 23%]
tests/unit/api_network_test.py::NetworkTest::test_disconnect_container_from_network PASSED [ 23%]
tests/unit/api_network_test.py::NetworkTest::test_inspect_network PASSED [ 24%]
tests/unit/api_network_test.py::NetworkTest::test_list_networks PASSED   [ 24%]
tests/unit/api_network_test.py::NetworkTest::test_remove_network PASSED  [ 24%]
tests/unit/api_test.py::DockerApiTest::test_auto_retrieve_server_version PASSED [ 24%]
tests/unit/api_test.py::DockerApiTest::test_create_host_config_secopt PASSED [ 24%]
tests/unit/api_test.py::DockerApiTest::test_ctor PASSED                  [ 24%]
tests/unit/api_test.py::DockerApiTest::test_events PASSED                [ 25%]
tests/unit/api_test.py::DockerApiTest::test_events_with_filters PASSED   [ 25%]
tests/unit/api_test.py::DockerApiTest::test_events_with_since_until PASSED [ 25%]
tests/unit/api_test.py::DockerApiTest::test_info PASSED                  [ 25%]
tests/unit/api_test.py::DockerApiTest::test_login PASSED                 [ 25%]
tests/unit/api_test.py::DockerApiTest::test_remove_link PASSED           [ 25%]
tests/unit/api_test.py::DockerApiTest::test_retrieve_server_version PASSED [ 26%]
tests/unit/api_test.py::DockerApiTest::test_search PASSED                [ 26%]
tests/unit/api_test.py::DockerApiTest::test_stream_helper_decoding PASSED [ 26%]
tests/unit/api_test.py::DockerApiTest::test_url_compatibility_http PASSED [ 26%]
tests/unit/api_test.py::DockerApiTest::test_url_compatibility_http_unix_triple_slash PASSED [ 26%]
tests/unit/api_test.py::DockerApiTest::test_url_compatibility_tcp PASSED [ 26%]
tests/unit/api_test.py::DockerApiTest::test_url_compatibility_unix PASSED [ 26%]
tests/unit/api_test.py::DockerApiTest::test_url_compatibility_unix_triple_slash PASSED [ 27%]
tests/unit/api_test.py::DockerApiTest::test_url_invalid_resource PASSED  [ 27%]
tests/unit/api_test.py::DockerApiTest::test_url_no_resource PASSED       [ 27%]
tests/unit/api_test.py::DockerApiTest::test_url_unversioned_api PASSED   [ 27%]
tests/unit/api_test.py::DockerApiTest::test_url_valid_resource PASSED    [ 27%]
tests/unit/api_test.py::DockerApiTest::test_version PASSED               [ 27%]
tests/unit/api_test.py::DockerApiTest::test_version_no_api_version PASSED [ 28%]
tests/unit/api_test.py::UnixSocketStreamTest::test_early_stream_response PASSED [ 28%]
tests/unit/api_test.py::TCPSocketStreamTest::test_read_from_socket_no_stream_no_tty PASSED [ 28%]
tests/unit/api_test.py::TCPSocketStreamTest::test_read_from_socket_no_stream_no_tty_demux PASSED [ 28%]
tests/unit/api_test.py::TCPSocketStreamTest::test_read_from_socket_no_stream_tty PASSED [ 28%]
tests/unit/api_test.py::TCPSocketStreamTest::test_read_from_socket_no_stream_tty_demux PASSED [ 28%]
tests/unit/api_test.py::TCPSocketStreamTest::test_read_from_socket_no_tty PASSED [ 29%]
tests/unit/api_test.py::TCPSocketStreamTest::test_read_from_socket_no_tty_demux PASSED [ 29%]
tests/unit/api_test.py::TCPSocketStreamTest::test_read_from_socket_tty PASSED [ 29%]
tests/unit/api_test.py::TCPSocketStreamTest::test_read_from_socket_tty_demux PASSED [ 29%]
tests/unit/api_test.py::UserAgentTest::test_custom_user_agent PASSED     [ 29%]
tests/unit/api_test.py::UserAgentTest::test_default_user_agent PASSED    [ 29%]
tests/unit/api_test.py::DisableSocketTest::test_disable_socket_timeout PASSED [ 30%]
tests/unit/api_test.py::DisableSocketTest::test_disable_socket_timeout2 PASSED [ 30%]
tests/unit/api_test.py::DisableSocketTest::test_disable_socket_timout_non_blocking PASSED [ 30%]
tests/unit/api_volume_test.py::VolumeTest::test_create_volume PASSED     [ 30%]
tests/unit/api_volume_test.py::VolumeTest::test_create_volume_invalid_opts_type PASSED [ 30%]
tests/unit/api_volume_test.py::VolumeTest::test_create_volume_with_driver PASSED [ 30%]
tests/unit/api_volume_test.py::VolumeTest::test_create_volume_with_invalid_labels PASSED [ 30%]
tests/unit/api_volume_test.py::VolumeTest::test_create_volume_with_labels PASSED [ 31%]
tests/unit/api_volume_test.py::VolumeTest::test_create_volume_with_no_specified_name PASSED [ 31%]
tests/unit/api_volume_test.py::VolumeTest::test_inspect_volume PASSED    [ 31%]
tests/unit/api_volume_test.py::VolumeTest::test_list_volumes PASSED      [ 31%]
tests/unit/api_volume_test.py::VolumeTest::test_list_volumes_and_filters PASSED [ 31%]
tests/unit/api_volume_test.py::VolumeTest::test_remove_volume PASSED     [ 31%]
tests/unit/auth_test.py::RegressionTest::test_803_urlsafe_encode PASSED  [ 32%]
tests/unit/auth_test.py::ResolveRepositoryNameTest::test_explicit_hub_index_library_image PASSED [ 32%]
tests/unit/auth_test.py::ResolveRepositoryNameTest::test_explicit_legacy_hub_index_library_image PASSED [ 32%]
tests/unit/auth_test.py::ResolveRepositoryNameTest::test_invalid_index_name PASSED [ 32%]
tests/unit/auth_test.py::ResolveRepositoryNameTest::test_resolve_repository_name_dotted_hub_library_image PASSED [ 32%]
tests/unit/auth_test.py::ResolveRepositoryNameTest::test_resolve_repository_name_hub_image PASSED [ 32%]
tests/unit/auth_test.py::ResolveRepositoryNameTest::test_resolve_repository_name_hub_library_image PASSED [ 33%]
tests/unit/auth_test.py::ResolveRepositoryNameTest::test_resolve_repository_name_localhost PASSED [ 33%]
tests/unit/auth_test.py::ResolveRepositoryNameTest::test_resolve_repository_name_localhost_with_username PASSED [ 33%]
tests/unit/auth_test.py::ResolveRepositoryNameTest::test_resolve_repository_name_no_dots_but_port PASSED [ 33%]
tests/unit/auth_test.py::ResolveRepositoryNameTest::test_resolve_repository_name_no_dots_but_port_and_username PASSED [ 33%]
tests/unit/auth_test.py::ResolveRepositoryNameTest::test_resolve_repository_name_private_registry PASSED [ 33%]
tests/unit/auth_test.py::ResolveRepositoryNameTest::test_resolve_repository_name_private_registry_with_port PASSED [ 34%]
tests/unit/auth_test.py::ResolveRepositoryNameTest::test_resolve_repository_name_private_registry_with_username PASSED [ 34%]
tests/unit/auth_test.py::ResolveAuthTest::test_resolve_auth_with_empty_credstore_and_auth_dict PASSED [ 34%]
tests/unit/auth_test.py::ResolveAuthTest::test_resolve_authconfig_default_explicit_none PASSED [ 34%]
tests/unit/auth_test.py::ResolveAuthTest::test_resolve_authconfig_default_registry PASSED [ 34%]
tests/unit/auth_test.py::ResolveAuthTest::test_resolve_authconfig_fully_explicit PASSED [ 34%]
tests/unit/auth_test.py::ResolveAuthTest::test_resolve_authconfig_hostname_only PASSED [ 34%]
tests/unit/auth_test.py::ResolveAuthTest::test_resolve_authconfig_legacy_config PASSED [ 35%]
tests/unit/auth_test.py::ResolveAuthTest::test_resolve_authconfig_no_match PASSED [ 35%]
tests/unit/auth_test.py::ResolveAuthTest::test_resolve_authconfig_no_path PASSED [ 35%]
tests/unit/auth_test.py::ResolveAuthTest::test_resolve_authconfig_no_path_trailing_slash PASSED [ 35%]
tests/unit/auth_test.py::ResolveAuthTest::test_resolve_authconfig_no_path_wrong_insecure_proto PASSED [ 35%]
tests/unit/auth_test.py::ResolveAuthTest::test_resolve_authconfig_no_path_wrong_secure_proto PASSED [ 35%]
tests/unit/auth_test.py::ResolveAuthTest::test_resolve_authconfig_no_protocol PASSED [ 36%]
tests/unit/auth_test.py::ResolveAuthTest::test_resolve_authconfig_path_wrong_proto PASSED [ 36%]
tests/unit/auth_test.py::ResolveAuthTest::test_resolve_registry_and_auth_explicit_hub PASSED [ 36%]
tests/unit/auth_test.py::ResolveAuthTest::test_resolve_registry_and_auth_explicit_legacy_hub PASSED [ 36%]
tests/unit/auth_test.py::ResolveAuthTest::test_resolve_registry_and_auth_hub_image PASSED [ 36%]
tests/unit/auth_test.py::ResolveAuthTest::test_resolve_registry_and_auth_library_image PASSED [ 36%]
tests/unit/auth_test.py::ResolveAuthTest::test_resolve_registry_and_auth_private_registry PASSED [ 37%]
tests/unit/auth_test.py::ResolveAuthTest::test_resolve_registry_and_auth_unauthenticated_registry PASSED [ 37%]
tests/unit/auth_test.py::LoadConfigTest::test_load_config_custom_config_env PASSED [ 37%]
tests/unit/auth_test.py::LoadConfigTest::test_load_config_custom_config_env_utf8 PASSED [ 37%]
tests/unit/auth_test.py::LoadConfigTest::test_load_config_custom_config_env_with_auths PASSED [ 37%]
tests/unit/auth_test.py::LoadConfigTest::test_load_config_identity_token PASSED [ 37%]
tests/unit/auth_test.py::LoadConfigTest::test_load_config_invalid_auth_dict PASSED [ 38%]
tests/unit/auth_test.py::LoadConfigTest::test_load_config_no_file PASSED [ 38%]
tests/unit/auth_test.py::LoadConfigTest::test_load_config_unknown_keys PASSED [ 38%]
tests/unit/auth_test.py::LoadConfigTest::test_load_config_with_random_name PASSED [ 38%]
tests/unit/auth_test.py::LoadConfigTest::test_load_json_config PASSED    [ 38%]
tests/unit/auth_test.py::LoadConfigTest::test_load_legacy_config PASSED  [ 38%]
tests/unit/auth_test.py::LoadConfigTest::test_load_modern_json_config PASSED [ 38%]
tests/unit/auth_test.py::CredstoreTest::test_get_all_credentials_3_sources PASSED [ 39%]
tests/unit/auth_test.py::CredstoreTest::test_get_all_credentials_credstore_only PASSED [ 39%]
tests/unit/auth_test.py::CredstoreTest::test_get_all_credentials_credstore_overrides_auth_entry PASSED [ 39%]
tests/unit/auth_test.py::CredstoreTest::test_get_all_credentials_helpers_override_default PASSED [ 39%]
tests/unit/auth_test.py::CredstoreTest::test_get_all_credentials_with_auths_entries PASSED [ 39%]
tests/unit/auth_test.py::CredstoreTest::test_get_all_credentials_with_credhelpers_only PASSED [ 39%]
tests/unit/auth_test.py::CredstoreTest::test_get_all_credentials_with_empty_auths_entry PASSED [ 40%]
tests/unit/auth_test.py::CredstoreTest::test_get_all_credentials_with_empty_credhelper PASSED [ 40%]
tests/unit/auth_test.py::CredstoreTest::test_get_credential_store PASSED [ 40%]
tests/unit/auth_test.py::CredstoreTest::test_get_credential_store_default_index PASSED [ 40%]
tests/unit/auth_test.py::CredstoreTest::test_get_credential_store_no_default PASSED [ 40%]
tests/unit/auth_test.py::CredstoreTest::test_get_credential_store_with_plain_dict PASSED [ 40%]
tests/unit/client_test.py::ClientTest::test_call_api_client_method PASSED [ 41%]
tests/unit/client_test.py::ClientTest::test_call_containers PASSED       [ 41%]
tests/unit/client_test.py::ClientTest::test_default_pool_size_unix PASSED [ 41%]
tests/unit/client_test.py::ClientTest::test_default_pool_size_win SKIPPED [ 41%]
tests/unit/client_test.py::ClientTest::test_events PASSED                [ 41%]
tests/unit/client_test.py::ClientTest::test_info PASSED                  [ 41%]
tests/unit/client_test.py::ClientTest::test_ping PASSED                  [ 42%]
tests/unit/client_test.py::ClientTest::test_pool_size_unix PASSED        [ 42%]
tests/unit/client_test.py::ClientTest::test_pool_size_win SKIPPED (N...) [ 42%]
tests/unit/client_test.py::ClientTest::test_version PASSED               [ 42%]
tests/unit/client_test.py::FromEnvTest::test_default_pool_size_from_env_unix PASSED [ 42%]
tests/unit/client_test.py::FromEnvTest::test_default_pool_size_from_env_win SKIPPED [ 42%]
tests/unit/client_test.py::FromEnvTest::test_from_env PASSED             [ 42%]
tests/unit/client_test.py::FromEnvTest::test_from_env_with_version PASSED [ 43%]
tests/unit/client_test.py::FromEnvTest::test_from_env_without_timeout_uses_default PASSED [ 43%]
tests/unit/client_test.py::FromEnvTest::test_from_env_without_version_uses_default PASSED [ 43%]
tests/unit/client_test.py::FromEnvTest::test_pool_size_from_env_unix PASSED [ 43%]
tests/unit/client_test.py::FromEnvTest::test_pool_size_from_env_win SKIPPED [ 43%]
tests/unit/context_test.py::BaseContextTest::test_context_inspect_without_params PASSED [ 43%]
tests/unit/context_test.py::BaseContextTest::test_default_in_context_list PASSED [ 44%]
tests/unit/context_test.py::BaseContextTest::test_fail_on_default_context_create PASSED [ 44%]
tests/unit/context_test.py::BaseContextTest::test_get_current_context PASSED [ 44%]
tests/unit/context_test.py::BaseContextTest::test_https_host PASSED      [ 44%]
tests/unit/context_test.py::BaseContextTest::test_url_compatibility_on_linux PASSED [ 44%]
tests/unit/context_test.py::BaseContextTest::test_url_compatibility_on_windows SKIPPED [ 44%]
tests/unit/dockertypes_test.py::HostConfigTest::test_create_host_config_invalid_cpu_cfs_types PASSED [ 45%]
tests/unit/dockertypes_test.py::HostConfigTest::test_create_host_config_invalid_cpu_count_types PASSED [ 45%]
tests/unit/dockertypes_test.py::HostConfigTest::test_create_host_config_invalid_cpu_percent_types PASSED [ 45%]
tests/unit/dockertypes_test.py::HostConfigTest::test_create_host_config_invalid_mem_swappiness PASSED [ 45%]
tests/unit/dockertypes_test.py::HostConfigTest::test_create_host_config_invalid_nano_cpus_types PASSED [ 45%]
tests/unit/dockertypes_test.py::HostConfigTest::test_create_host_config_no_options_newer_api_version PASSED [ 45%]
tests/unit/dockertypes_test.py::HostConfigTest::test_create_host_config_pid_mode PASSED [ 46%]
tests/unit/dockertypes_test.py::HostConfigTest::test_create_host_config_with_blkio_constraints PASSED [ 46%]
tests/unit/dockertypes_test.py::HostConfigTest::test_create_host_config_with_cpu_count PASSED [ 46%]
tests/unit/dockertypes_test.py::HostConfigTest::test_create_host_config_with_cpu_percent PASSED [ 46%]
tests/unit/dockertypes_test.py::HostConfigTest::test_create_host_config_with_cpu_period PASSED [ 46%]
tests/unit/dockertypes_test.py::HostConfigTest::test_create_host_config_with_cpu_quota PASSED [ 46%]
tests/unit/dockertypes_test.py::HostConfigTest::test_create_host_config_with_cpu_rt_period PASSED [ 46%]
tests/unit/dockertypes_test.py::HostConfigTest::test_create_host_config_with_cpu_rt_period_types PASSED [ 47%]
tests/unit/dockertypes_test.py::HostConfigTest::test_create_host_config_with_cpu_rt_runtime PASSED [ 47%]
tests/unit/dockertypes_test.py::HostConfigTest::test_create_host_config_with_dns_opt PASSED [ 47%]
tests/unit/dockertypes_test.py::HostConfigTest::test_create_host_config_with_isolation PASSED [ 47%]
tests/unit/dockertypes_test.py::HostConfigTest::test_create_host_config_with_kernel_memory PASSED [ 47%]
tests/unit/dockertypes_test.py::HostConfigTest::test_create_host_config_with_mem_reservation PASSED [ 47%]
tests/unit/dockertypes_test.py::HostConfigTest::test_create_host_config_with_nano_cpus PASSED [ 48%]
tests/unit/dockertypes_test.py::HostConfigTest::test_create_host_config_with_oom_kill_disable PASSED [ 48%]
tests/unit/dockertypes_test.py::HostConfigTest::test_create_host_config_with_oom_score_adj PASSED [ 48%]
tests/unit/dockertypes_test.py::HostConfigTest::test_create_host_config_with_pids_limit PASSED [ 48%]
tests/unit/dockertypes_test.py::HostConfigTest::test_create_host_config_with_shm_size PASSED [ 48%]
tests/unit/dockertypes_test.py::HostConfigTest::test_create_host_config_with_shm_size_in_mb PASSED [ 48%]
tests/unit/dockertypes_test.py::HostConfigTest::test_create_host_config_with_userns_mode PASSED [ 49%]
tests/unit/dockertypes_test.py::HostConfigTest::test_create_host_config_with_uts PASSED [ 49%]
tests/unit/dockertypes_test.py::HostConfigTest::test_create_host_config_with_volume_driver PASSED [ 49%]
tests/unit/dockertypes_test.py::HostConfigTest::test_ctrate_host_config_with_cpu_rt_runtime_types PASSED [ 49%]
tests/unit/dockertypes_test.py::ContainerSpecTest::test_parse_mounts PASSED [ 49%]
tests/unit/dockertypes_test.py::UlimitTest::test_create_host_config_dict_ulimit PASSED [ 49%]
tests/unit/dockertypes_test.py::UlimitTest::test_create_host_config_dict_ulimit_capitals PASSED [ 50%]
tests/unit/dockertypes_test.py::UlimitTest::test_create_host_config_obj_ulimit PASSED [ 50%]
tests/unit/dockertypes_test.py::UlimitTest::test_ulimit_invalid_type PASSED [ 50%]
tests/unit/dockertypes_test.py::LogConfigTest::test_create_host_config_dict_logconfig PASSED [ 50%]
tests/unit/dockertypes_test.py::LogConfigTest::test_create_host_config_obj_logconfig PASSED [ 50%]
tests/unit/dockertypes_test.py::LogConfigTest::test_logconfig_invalid_config_type PASSED [ 50%]
tests/unit/dockertypes_test.py::EndpointConfigTest::test_create_endpoint_config_with_aliases PASSED [ 50%]
tests/unit/dockertypes_test.py::IPAMConfigTest::test_create_ipam_config PASSED [ 51%]
tests/unit/dockertypes_test.py::ServiceModeTest::test_global_job_replicas_simple PASSED [ 51%]
tests/unit/dockertypes_test.py::ServiceModeTest::test_global_job_simple PASSED [ 51%]
tests/unit/dockertypes_test.py::ServiceModeTest::test_global_replicas_error PASSED [ 51%]
tests/unit/dockertypes_test.py::ServiceModeTest::test_global_simple PASSED [ 51%]
tests/unit/dockertypes_test.py::ServiceModeTest::test_invalid_mode PASSED [ 51%]
tests/unit/dockertypes_test.py::ServiceModeTest::test_replicated_job_simple PASSED [ 52%]
tests/unit/dockertypes_test.py::ServiceModeTest::test_replicated_replicas PASSED [ 52%]
tests/unit/dockertypes_test.py::ServiceModeTest::test_replicated_replicas_0 PASSED [ 52%]
tests/unit/dockertypes_test.py::ServiceModeTest::test_replicated_simple PASSED [ 52%]
tests/unit/dockertypes_test.py::MountTest::test_parse_mount_bind PASSED  [ 52%]
tests/unit/dockertypes_test.py::MountTest::test_parse_mount_bind_windows XFAIL [ 52%]
tests/unit/dockertypes_test.py::MountTest::test_parse_mount_named_volume PASSED [ 53%]
tests/unit/dockertypes_test.py::MountTest::test_parse_mount_string_invalid PASSED [ 53%]
tests/unit/dockertypes_test.py::MountTest::test_parse_mount_string_no_source PASSED [ 53%]
tests/unit/dockertypes_test.py::MountTest::test_parse_mount_string_ro PASSED [ 53%]
tests/unit/dockertypes_test.py::MountTest::test_parse_mount_string_rw PASSED [ 53%]
tests/unit/dockertypes_test.py::MountTest::test_parse_mount_string_short_form PASSED [ 53%]
tests/unit/dockertypes_test.py::ServicePortsTest::test_convert_service_ports_invalid PASSED [ 53%]
tests/unit/dockertypes_test.py::ServicePortsTest::test_convert_service_ports_multiple PASSED [ 54%]
tests/unit/dockertypes_test.py::ServicePortsTest::test_convert_service_ports_no_protocol_and_mode PASSED [ 54%]
tests/unit/dockertypes_test.py::ServicePortsTest::test_convert_service_ports_simple PASSED [ 54%]
tests/unit/dockertypes_test.py::ServicePortsTest::test_convert_service_ports_with_protocol PASSED [ 54%]
tests/unit/dockertypes_test.py::ServicePortsTest::test_convert_service_ports_with_protocol_and_mode PASSED [ 54%]
tests/unit/errors_test.py::APIErrorTest::test_api_error_is_caught_by_dockerexception PASSED [ 54%]
tests/unit/errors_test.py::APIErrorTest::test_create_error_from_exception PASSED [ 55%]
tests/unit/errors_test.py::APIErrorTest::test_is_client_error_400 PASSED [ 55%]
tests/unit/errors_test.py::APIErrorTest::test_is_client_error_500 PASSED [ 55%]
tests/unit/errors_test.py::APIErrorTest::test_is_error_300 PASSED        [ 55%]
tests/unit/errors_test.py::APIErrorTest::test_is_error_400 PASSED        [ 55%]
tests/unit/errors_test.py::APIErrorTest::test_is_error_500 PASSED        [ 55%]
tests/unit/errors_test.py::APIErrorTest::test_is_server_error_200 PASSED [ 56%]
tests/unit/errors_test.py::APIErrorTest::test_is_server_error_300 PASSED [ 56%]
tests/unit/errors_test.py::APIErrorTest::test_is_server_error_400 PASSED [ 56%]
tests/unit/errors_test.py::APIErrorTest::test_is_server_error_500 PASSED [ 56%]
tests/unit/errors_test.py::APIErrorTest::test_status_code_200 PASSED     [ 56%]
tests/unit/errors_test.py::APIErrorTest::test_status_code_400 PASSED     [ 56%]
tests/unit/errors_test.py::APIErrorTest::test_status_code_500 PASSED     [ 57%]
tests/unit/errors_test.py::ContainerErrorTest::test_container_with_stderr PASSED [ 57%]
tests/unit/errors_test.py::ContainerErrorTest::test_container_without_stderr PASSED [ 57%]
tests/unit/errors_test.py::CreateUnexpectedKwargsErrorTest::test_create_unexpected_kwargs_error_multiple PASSED [ 57%]
tests/unit/errors_test.py::CreateUnexpectedKwargsErrorTest::test_create_unexpected_kwargs_error_single PASSED [ 57%]
tests/unit/models_configs_test.py::CreateConfigsTest::test_create_config PASSED [ 57%]
tests/unit/models_containers_test.py::ContainerCollectionTest::test_create PASSED [ 57%]
tests/unit/models_containers_test.py::ContainerCollectionTest::test_create_container_args PASSED [ 58%]
tests/unit/models_containers_test.py::ContainerCollectionTest::test_create_networking_config PASSED [ 58%]
tests/unit/models_containers_test.py::ContainerCollectionTest::test_create_networking_config_only_undeclared_network PASSED [ 58%]
tests/unit/models_containers_test.py::ContainerCollectionTest::test_create_networking_config_with_network_mode PASSED [ 58%]
tests/unit/models_containers_test.py::ContainerCollectionTest::test_create_networking_config_with_undeclared_network PASSED [ 58%]
tests/unit/models_containers_test.py::ContainerCollectionTest::test_create_networking_config_without_network PASSED [ 58%]
tests/unit/models_containers_test.py::ContainerCollectionTest::test_create_with_image_object PASSED [ 59%]
tests/unit/models_containers_test.py::ContainerCollectionTest::test_get PASSED [ 59%]
tests/unit/models_containers_test.py::ContainerCollectionTest::test_list PASSED [ 59%]
tests/unit/models_containers_test.py::ContainerCollectionTest::test_list_ignore_removed PASSED [ 59%]
tests/unit/models_containers_test.py::ContainerCollectionTest::test_run PASSED [ 59%]
tests/unit/models_containers_test.py::ContainerCollectionTest::test_run_detach PASSED [ 59%]
tests/unit/models_containers_test.py::ContainerCollectionTest::test_run_networking_config PASSED [ 60%]
tests/unit/models_containers_test.py::ContainerCollectionTest::test_run_networking_config_only_undeclared_network PASSED [ 60%]
tests/unit/models_containers_test.py::ContainerCollectionTest::test_run_networking_config_with_network_mode PASSED [ 60%]
tests/unit/models_containers_test.py::ContainerCollectionTest::test_run_networking_config_with_undeclared_network PASSED [ 60%]
tests/unit/models_containers_test.py::ContainerCollectionTest::test_run_networking_config_without_network PASSED [ 60%]
tests/unit/models_containers_test.py::ContainerCollectionTest::test_run_platform PASSED [ 60%]
tests/unit/models_containers_test.py::ContainerCollectionTest::test_run_pull PASSED [ 61%]
tests/unit/models_containers_test.py::ContainerCollectionTest::test_run_remove PASSED [ 61%]
tests/unit/models_containers_test.py::ContainerCollectionTest::test_run_with_error PASSED [ 61%]
tests/unit/models_containers_test.py::ContainerCollectionTest::test_run_with_image_object PASSED [ 61%]
tests/unit/models_containers_test.py::ContainerTest::test_attach PASSED  [ 61%]
tests/unit/models_containers_test.py::ContainerTest::test_commit PASSED  [ 61%]
tests/unit/models_containers_test.py::ContainerTest::test_diff PASSED    [ 61%]
tests/unit/models_containers_test.py::ContainerTest::test_exec_run PASSED [ 62%]
tests/unit/models_containers_test.py::ContainerTest::test_exec_run_failure PASSED [ 62%]
tests/unit/models_containers_test.py::ContainerTest::test_export PASSED  [ 62%]
tests/unit/models_containers_test.py::ContainerTest::test_get_archive PASSED [ 62%]
tests/unit/models_containers_test.py::ContainerTest::test_image PASSED   [ 62%]
tests/unit/models_containers_test.py::ContainerTest::test_kill PASSED    [ 62%]
tests/unit/models_containers_test.py::ContainerTest::test_labels PASSED  [ 63%]
tests/unit/models_containers_test.py::ContainerTest::test_logs PASSED    [ 63%]
tests/unit/models_containers_test.py::ContainerTest::test_name PASSED    [ 63%]
tests/unit/models_containers_test.py::ContainerTest::test_pause PASSED   [ 63%]
tests/unit/models_containers_test.py::ContainerTest::test_put_archive PASSED [ 63%]
tests/unit/models_containers_test.py::ContainerTest::test_remove PASSED  [ 63%]
tests/unit/models_containers_test.py::ContainerTest::test_rename PASSED  [ 64%]
tests/unit/models_containers_test.py::ContainerTest::test_resize PASSED  [ 64%]
tests/unit/models_containers_test.py::ContainerTest::test_restart PASSED [ 64%]
tests/unit/models_containers_test.py::ContainerTest::test_short_id PASSED [ 64%]
tests/unit/models_containers_test.py::ContainerTest::test_start PASSED   [ 64%]
tests/unit/models_containers_test.py::ContainerTest::test_stats PASSED   [ 64%]
tests/unit/models_containers_test.py::ContainerTest::test_status PASSED  [ 65%]
tests/unit/models_containers_test.py::ContainerTest::test_stop PASSED    [ 65%]
tests/unit/models_containers_test.py::ContainerTest::test_top PASSED     [ 65%]
tests/unit/models_containers_test.py::ContainerTest::test_unpause PASSED [ 65%]
tests/unit/models_containers_test.py::ContainerTest::test_update PASSED  [ 65%]
tests/unit/models_containers_test.py::ContainerTest::test_wait PASSED    [ 65%]
tests/unit/models_images_test.py::ImageCollectionTest::test_build PASSED [ 65%]
tests/unit/models_images_test.py::ImageCollectionTest::test_get PASSED   [ 66%]
tests/unit/models_images_test.py::ImageCollectionTest::test_labels PASSED [ 66%]
tests/unit/models_images_test.py::ImageCollectionTest::test_list PASSED  [ 66%]
tests/unit/models_images_test.py::ImageCollectionTest::test_load PASSED  [ 66%]
tests/unit/models_images_test.py::ImageCollectionTest::test_pull PASSED  [ 66%]
tests/unit/models_images_test.py::ImageCollectionTest::test_pull_multiple PASSED [ 66%]
tests/unit/models_images_test.py::ImageCollectionTest::test_pull_tag_precedence PASSED [ 67%]
tests/unit/models_images_test.py::ImageCollectionTest::test_pull_with_stream_param PASSED [ 67%]
tests/unit/models_images_test.py::ImageCollectionTest::test_push PASSED  [ 67%]
tests/unit/models_images_test.py::ImageCollectionTest::test_remove PASSED [ 67%]
tests/unit/models_images_test.py::ImageCollectionTest::test_search PASSED [ 67%]
tests/unit/models_images_test.py::ImageCollectionTest::test_search_limit PASSED [ 67%]
tests/unit/models_images_test.py::ImageTest::test_history PASSED         [ 68%]
tests/unit/models_images_test.py::ImageTest::test_remove PASSED          [ 68%]
tests/unit/models_images_test.py::ImageTest::test_save PASSED            [ 68%]
tests/unit/models_images_test.py::ImageTest::test_short_id PASSED        [ 68%]
tests/unit/models_images_test.py::ImageTest::test_tag PASSED             [ 68%]
tests/unit/models_images_test.py::ImageTest::test_tags PASSED            [ 68%]
tests/unit/models_networks_test.py::NetworkCollectionTest::test_create PASSED [ 69%]
tests/unit/models_networks_test.py::NetworkCollectionTest::test_get PASSED [ 69%]
tests/unit/models_networks_test.py::NetworkCollectionTest::test_list PASSED [ 69%]
tests/unit/models_networks_test.py::NetworkTest::test_connect PASSED     [ 69%]
tests/unit/models_networks_test.py::NetworkTest::test_disconnect PASSED  [ 69%]
tests/unit/models_networks_test.py::NetworkTest::test_remove PASSED      [ 69%]
tests/unit/models_resources_test.py::ModelTest::test_hash PASSED         [ 69%]
tests/unit/models_resources_test.py::ModelTest::test_reload PASSED       [ 70%]
tests/unit/models_secrets_test.py::CreateServiceTest::test_secrets_repr PASSED [ 70%]
tests/unit/models_services_test.py::CreateServiceKwargsTest::test_get_create_service_kwargs PASSED [ 70%]
tests/unit/sshadapter_test.py::SSHAdapterTest::test_ssh_hostname_prefix_trim PASSED [ 70%]
tests/unit/sshadapter_test.py::SSHAdapterTest::test_ssh_parse_hostname_and_port PASSED [ 70%]
tests/unit/sshadapter_test.py::SSHAdapterTest::test_ssh_parse_hostname_only PASSED [ 70%]
tests/unit/sshadapter_test.py::SSHAdapterTest::test_ssh_parse_url PASSED [ 71%]
tests/unit/sshadapter_test.py::SSHAdapterTest::test_ssh_parse_user_and_hostname PASSED [ 71%]
tests/unit/swarm_test.py::SwarmTest::test_join_swarm PASSED              [ 71%]
tests/unit/swarm_test.py::SwarmTest::test_join_swarm_no_listen_address_takes_default PASSED [ 71%]
tests/unit/swarm_test.py::SwarmTest::test_node_update PASSED             [ 71%]
tests/unit/types_containers_test.py::test_uid_0_is_not_elided PASSED     [ 71%]
tests/unit/utils_build_test.py::ExcludePathsTest::test_directory PASSED  [ 72%]
tests/unit/utils_build_test.py::ExcludePathsTest::test_directory_with_single_exception PASSED [ 72%]
tests/unit/utils_build_test.py::ExcludePathsTest::test_directory_with_subdir_exception PASSED [ 72%]
tests/unit/utils_build_test.py::ExcludePathsTest::test_directory_with_subdir_exception_win32_pathsep SKIPPED [ 72%]
tests/unit/utils_build_test.py::ExcludePathsTest::test_directory_with_trailing_slash PASSED [ 72%]
tests/unit/utils_build_test.py::ExcludePathsTest::test_directory_with_wildcard_exception PASSED [ 72%]
tests/unit/utils_build_test.py::ExcludePathsTest::test_double_wildcard PASSED [ 73%]
tests/unit/utils_build_test.py::ExcludePathsTest::test_double_wildcard_with_exception PASSED [ 73%]
tests/unit/utils_build_test.py::ExcludePathsTest::test_exclude_custom_dockerfile PASSED [ 73%]
tests/unit/utils_build_test.py::ExcludePathsTest::test_exclude_dockerfile_child PASSED [ 73%]
tests/unit/utils_build_test.py::ExcludePathsTest::test_exclude_dockerfile_dockerignore PASSED [ 73%]
tests/unit/utils_build_test.py::ExcludePathsTest::test_exclude_include_absolute_path PASSED [ 73%]
tests/unit/utils_build_test.py::ExcludePathsTest::test_include_wildcard PASSED [ 73%]
tests/unit/utils_build_test.py::ExcludePathsTest::test_last_line_precedence PASSED [ 74%]
tests/unit/utils_build_test.py::ExcludePathsTest::test_no_dupes PASSED   [ 74%]
tests/unit/utils_build_test.py::ExcludePathsTest::test_no_excludes PASSED [ 74%]
tests/unit/utils_build_test.py::ExcludePathsTest::test_parent_directory PASSED [ 74%]
tests/unit/utils_build_test.py::ExcludePathsTest::test_question_mark PASSED [ 74%]
tests/unit/utils_build_test.py::ExcludePathsTest::test_single_and_double_wildcard PASSED [ 74%]
tests/unit/utils_build_test.py::ExcludePathsTest::test_single_filename PASSED [ 75%]
tests/unit/utils_build_test.py::ExcludePathsTest::test_single_filename_leading_dot_slash PASSED [ 75%]
tests/unit/utils_build_test.py::ExcludePathsTest::test_single_filename_trailing_slash PASSED [ 75%]
tests/unit/utils_build_test.py::ExcludePathsTest::test_single_subdir_single_filename PASSED [ 75%]
tests/unit/utils_build_test.py::ExcludePathsTest::test_single_subdir_single_filename_leading_slash PASSED [ 75%]
tests/unit/utils_build_test.py::ExcludePathsTest::test_single_subdir_wildcard_filename PASSED [ 75%]
tests/unit/utils_build_test.py::ExcludePathsTest::test_single_subdir_with_path_traversal PASSED [ 76%]
tests/unit/utils_build_test.py::ExcludePathsTest::test_subdirectory PASSED [ 76%]
tests/unit/utils_build_test.py::ExcludePathsTest::test_subdirectory_win32_pathsep SKIPPED [ 76%]
tests/unit/utils_build_test.py::ExcludePathsTest::test_trailing_double_wildcard PASSED [ 76%]
tests/unit/utils_build_test.py::ExcludePathsTest::test_wildcard_exclude PASSED [ 76%]
tests/unit/utils_build_test.py::ExcludePathsTest::test_wildcard_filename_end PASSED [ 76%]
tests/unit/utils_build_test.py::ExcludePathsTest::test_wildcard_filename_start PASSED [ 76%]
tests/unit/utils_build_test.py::ExcludePathsTest::test_wildcard_subdir_single_filename PASSED [ 77%]
tests/unit/utils_build_test.py::ExcludePathsTest::test_wildcard_subdir_wildcard_filename PASSED [ 77%]
tests/unit/utils_build_test.py::ExcludePathsTest::test_wildcard_with_exception PASSED [ 77%]
tests/unit/utils_build_test.py::ExcludePathsTest::test_wildcard_with_wildcard_exception PASSED [ 77%]
tests/unit/utils_build_test.py::TarTest::test_tar_directory_link PASSED  [ 77%]
tests/unit/utils_build_test.py::TarTest::test_tar_socket_file PASSED     [ 77%]
tests/unit/utils_build_test.py::TarTest::test_tar_with_broken_symlinks PASSED [ 78%]
tests/unit/utils_build_test.py::TarTest::test_tar_with_directory_symlinks PASSED [ 78%]
tests/unit/utils_build_test.py::TarTest::test_tar_with_empty_directory PASSED [ 78%]
tests/unit/utils_build_test.py::TarTest::test_tar_with_excludes PASSED   [ 78%]
tests/unit/utils_build_test.py::TarTest::test_tar_with_file_symlinks PASSED [ 78%]
tests/unit/utils_build_test.py::TarTest::test_tar_with_inaccessible_file SKIPPED [ 78%]
tests/unit/utils_build_test.py::test_match_tag[test_com-True] PASSED     [ 79%]
tests/unit/utils_build_test.py::test_match_tag[test.com:tag-True] PASSED [ 79%]
tests/unit/utils_build_test.py::test_match_tag[test.com:5000-True] PASSED [ 79%]
tests/unit/utils_build_test.py::test_match_tag[test.com/repo:tag-True] PASSED [ 79%]
tests/unit/utils_build_test.py::test_match_tag[test:5000/repo-True0] PASSED [ 79%]
tests/unit/utils_build_test.py::test_match_tag[test:5000/repo:tag-True] PASSED [ 79%]
tests/unit/utils_build_test.py::test_match_tag[test:5000/repo-True1] PASSED [ 80%]
tests/unit/utils_build_test.py::test_match_tag[-False] PASSED            [ 80%]
tests/unit/utils_build_test.py::test_match_tag[:justtag-False] PASSED    [ 80%]
tests/unit/utils_build_test.py::test_match_tag[Uppercase:tag-False] PASSED [ 80%]
tests/unit/utils_build_test.py::test_match_tag[test:5000/Uppercase/lowercase:tag-False] PASSED [ 80%]
tests/unit/utils_build_test.py::test_match_tag[lowercase:Uppercase-True] PASSED [ 80%]
tests/unit/utils_build_test.py::test_match_tag[a/a/a/a/a/a/a/a/a/a/a/a/a/a/a/a/a/a/a/a/a/a/a/a/a/a/a/a/a/a/a/a/a/a/a/a/a/a/a/a/a/a/a/a/a/a/a/a/a/a/a/a/a/a/a/a/a/a/a/a/a/a/a/a/a/a/a/a/a/a/a/a/a/a/a/a/a/a/a/a/a/a/a/a/a/a/a/a/a/a/a/a/a/a/a/a/a/a/a/a/a/a/a/a/a/a/a/a/a/a/a/a/a/a/a/a/a/a/a/a/a/a/a/a/a/a/a/a/a:tag-False] XFAIL [ 80%]
tests/unit/utils_build_test.py::test_match_tag[a/a/a/a/a/a/a/a/a/a/a/a/a/a/a/a/a/a/a/a/a/a/a/a/a/a/a/a/a/a/a/a/a/a/a/a/a/a/a/a/a/a/a/a/a/a/a/a/a/a/a/a/a/a/a/a/a/a/a/a/a/a/a/a/a/a/a/a/a/a/a/a/a/a/a/a/a/a/a/a/a/a/a/a/a/a/a/a/a/a/a/a/a/a/a/a/a/a/a/a/a/a/a/a/a/a/a/a/a/a/a/a/a/a/a/a/a/a/a/a/a/a/a/a/a/a/a/a:tag-puts-this-over-max-True] PASSED [ 81%]
tests/unit/utils_build_test.py::test_match_tag[aa/asdf$$^/aa-False] PASSED [ 81%]
tests/unit/utils_build_test.py::test_match_tag[sub-dom1.foo.com/bar/baz/quux-True] PASSED [ 81%]
tests/unit/utils_build_test.py::test_match_tag[sub-dom1.foo.com/bar/baz/quux:some-long-tag-True] PASSED [ 81%]
tests/unit/utils_build_test.py::test_match_tag[b.gcr.io/test.example.com/my-app:test.example.com-True] PASSED [ 81%]
tests/unit/utils_build_test.py::test_match_tag[xn--n3h.com/myimage:xn--n3h.com-True] PASSED [ 81%]
tests/unit/utils_build_test.py::test_match_tag[foo_bar.com:8080-True] PASSED [ 82%]
tests/unit/utils_build_test.py::test_match_tag[foo/foo_bar.com:8080-True] PASSED [ 82%]
tests/unit/utils_build_test.py::test_match_tag[192.168.1.1-True] PASSED  [ 82%]
tests/unit/utils_build_test.py::test_match_tag[192.168.1.1:tag-True] PASSED [ 82%]
tests/unit/utils_build_test.py::test_match_tag[192.168.1.1:5000-True] PASSED [ 82%]
tests/unit/utils_build_test.py::test_match_tag[192.168.1.1/repo-True] PASSED [ 82%]
tests/unit/utils_build_test.py::test_match_tag[192.168.1.1:5000/repo-True] PASSED [ 83%]
tests/unit/utils_build_test.py::test_match_tag[192.168.1.1:5000/repo:5050-True] PASSED [ 83%]
tests/unit/utils_build_test.py::test_match_tag[[2001:db8::1]-False] XPASS [ 83%]
tests/unit/utils_build_test.py::test_match_tag[[2001:db8::1]:5000-False] PASSED [ 83%]
tests/unit/utils_build_test.py::test_match_tag[[2001:db8::1]/repo-True] XFAIL [ 83%]
tests/unit/utils_build_test.py::test_match_tag[[2001:db8:1:2:3:4:5:6]/repo:tag-True] XFAIL [ 83%]
tests/unit/utils_build_test.py::test_match_tag[[2001:db8::1]:5000/repo-True] XFAIL [ 84%]
tests/unit/utils_build_test.py::test_match_tag[[2001:db8::1]:5000/repo:tag-True] XFAIL [ 84%]
tests/unit/utils_build_test.py::test_match_tag[[2001:db8::]:5000/repo-True] XFAIL [ 84%]
tests/unit/utils_build_test.py::test_match_tag[[::1]:5000/repo-True] XFAIL [ 84%]
tests/unit/utils_build_test.py::test_match_tag[[fe80::1%eth0]:5000/repo-False] PASSED [ 84%]
tests/unit/utils_build_test.py::test_match_tag[[fe80::1%@invalidzone]:5000/repo-False] PASSED [ 84%]
tests/unit/utils_config_test.py::FindConfigFileTest::test_find_config_fallback PASSED [ 84%]
tests/unit/utils_config_test.py::FindConfigFileTest::test_find_config_from_environment PASSED [ 85%]
tests/unit/utils_config_test.py::FindConfigFileTest::test_find_config_from_explicit_path PASSED [ 85%]
tests/unit/utils_config_test.py::FindConfigFileTest::test_find_config_from_home_legacy_name PASSED [ 85%]
tests/unit/utils_config_test.py::FindConfigFileTest::test_find_config_from_home_posix PASSED [ 85%]
tests/unit/utils_config_test.py::FindConfigFileTest::test_find_config_from_home_windows SKIPPED [ 85%]
tests/unit/utils_config_test.py::LoadConfigTest::test_load_config_custom_headers PASSED [ 85%]
tests/unit/utils_config_test.py::LoadConfigTest::test_load_config_detach_keys PASSED [ 86%]
tests/unit/utils_config_test.py::LoadConfigTest::test_load_config_from_env PASSED [ 86%]
tests/unit/utils_config_test.py::LoadConfigTest::test_load_config_no_file PASSED [ 86%]
tests/unit/utils_json_stream_test.py::TestJsonSplitter::test_json_splitter_no_object PASSED [ 86%]
tests/unit/utils_json_stream_test.py::TestJsonSplitter::test_json_splitter_with_object PASSED [ 86%]
tests/unit/utils_json_stream_test.py::TestJsonSplitter::test_json_splitter_leading_whitespace PASSED [ 86%]
tests/unit/utils_json_stream_test.py::TestStreamAsText::test_stream_with_non_utf_unicode_character PASSED [ 87%]
tests/unit/utils_json_stream_test.py::TestStreamAsText::test_stream_with_utf_character PASSED [ 87%]
tests/unit/utils_json_stream_test.py::TestJsonStream::test_with_falsy_entries PASSED [ 87%]
tests/unit/utils_json_stream_test.py::TestJsonStream::test_with_leading_whitespace PASSED [ 87%]
tests/unit/utils_proxy_test.py::ProxyConfigTest::test_environment PASSED [ 87%]
tests/unit/utils_proxy_test.py::ProxyConfigTest::test_from_dict PASSED   [ 87%]
tests/unit/utils_proxy_test.py::ProxyConfigTest::test_inject_proxy_environment PASSED [ 88%]
tests/unit/utils_proxy_test.py::ProxyConfigTest::test_new PASSED         [ 88%]
tests/unit/utils_proxy_test.py::ProxyConfigTest::test_truthiness PASSED  [ 88%]
tests/unit/utils_test.py::DecoratorsTest::test_update_headers PASSED     [ 88%]
tests/unit/utils_test.py::KwargsFromEnvTest::test_kwargs_from_env_alternate_env PASSED [ 88%]
tests/unit/utils_test.py::KwargsFromEnvTest::test_kwargs_from_env_empty PASSED [ 88%]
tests/unit/utils_test.py::KwargsFromEnvTest::test_kwargs_from_env_no_cert_path PASSED [ 88%]
tests/unit/utils_test.py::KwargsFromEnvTest::test_kwargs_from_env_tls PASSED [ 89%]
tests/unit/utils_test.py::KwargsFromEnvTest::test_kwargs_from_env_tls_verify_false PASSED [ 89%]
tests/unit/utils_test.py::KwargsFromEnvTest::test_kwargs_from_env_tls_verify_false_no_cert PASSED [ 89%]
tests/unit/utils_test.py::ConverVolumeBindsTest::test_convert_volume_binds_compact PASSED [ 89%]
tests/unit/utils_test.py::ConverVolumeBindsTest::test_convert_volume_binds_complete PASSED [ 89%]
tests/unit/utils_test.py::ConverVolumeBindsTest::test_convert_volume_binds_empty PASSED [ 89%]
tests/unit/utils_test.py::ConverVolumeBindsTest::test_convert_volume_binds_list PASSED [ 90%]
tests/unit/utils_test.py::ConverVolumeBindsTest::test_convert_volume_binds_no_mode PASSED [ 90%]
tests/unit/utils_test.py::ConverVolumeBindsTest::test_convert_volume_binds_unicode_bytes_input PASSED [ 90%]
tests/unit/utils_test.py::ConverVolumeBindsTest::test_convert_volume_binds_unicode_unicode_input PASSED [ 90%]
tests/unit/utils_test.py::ParseEnvFileTest::test_parse_env_file_commented_line PASSED [ 90%]
tests/unit/utils_test.py::ParseEnvFileTest::test_parse_env_file_invalid_line PASSED [ 90%]
tests/unit/utils_test.py::ParseEnvFileTest::test_parse_env_file_newline PASSED [ 91%]
tests/unit/utils_test.py::ParseEnvFileTest::test_parse_env_file_proper PASSED [ 91%]
tests/unit/utils_test.py::ParseEnvFileTest::test_parse_env_file_with_equals_character PASSED [ 91%]
tests/unit/utils_test.py::ParseHostTest::test_parse_host PASSED          [ 91%]
tests/unit/utils_test.py::ParseHostTest::test_parse_host_empty_value PASSED [ 91%]
tests/unit/utils_test.py::ParseHostTest::test_parse_host_tls PASSED      [ 91%]
tests/unit/utils_test.py::ParseHostTest::test_parse_host_tls_tcp_proto PASSED [ 92%]
tests/unit/utils_test.py::ParseHostTest::test_parse_host_trailing_slash PASSED [ 92%]
tests/unit/utils_test.py::ParseRepositoryTagTest::test_index_image_no_tag PASSED [ 92%]
tests/unit/utils_test.py::ParseRepositoryTagTest::test_index_image_sha PASSED [ 92%]
tests/unit/utils_test.py::ParseRepositoryTagTest::test_index_image_tag PASSED [ 92%]
tests/unit/utils_test.py::ParseRepositoryTagTest::test_index_user_image_no_tag PASSED [ 92%]
tests/unit/utils_test.py::ParseRepositoryTagTest::test_index_user_image_tag PASSED [ 92%]
tests/unit/utils_test.py::ParseRepositoryTagTest::test_private_reg_image_no_tag PASSED [ 93%]
tests/unit/utils_test.py::ParseRepositoryTagTest::test_private_reg_image_sha PASSED [ 93%]
tests/unit/utils_test.py::ParseRepositoryTagTest::test_private_reg_image_tag PASSED [ 93%]
tests/unit/utils_test.py::ParseDeviceTest::test_dict PASSED              [ 93%]
tests/unit/utils_test.py::ParseDeviceTest::test_full_string_definition PASSED [ 93%]
tests/unit/utils_test.py::ParseDeviceTest::test_hybrid_list PASSED       [ 93%]
tests/unit/utils_test.py::ParseDeviceTest::test_partial_string_definition PASSED [ 94%]
tests/unit/utils_test.py::ParseDeviceTest::test_permissionless_string_definition PASSED [ 94%]
tests/unit/utils_test.py::ParseBytesTest::test_parse_bytes_float PASSED  [ 94%]
tests/unit/utils_test.py::ParseBytesTest::test_parse_bytes_invalid PASSED [ 94%]
tests/unit/utils_test.py::ParseBytesTest::test_parse_bytes_valid PASSED  [ 94%]
tests/unit/utils_test.py::UtilsTest::test_convert_filters PASSED         [ 94%]
tests/unit/utils_test.py::UtilsTest::test_decode_json_header PASSED      [ 95%]
tests/unit/utils_test.py::SplitCommandTest::test_split_command_with_unicode PASSED [ 95%]
tests/unit/utils_test.py::PortsTest::test_build_port_bindings_with_matching_internal_port_ranges PASSED [ 95%]
tests/unit/utils_test.py::PortsTest::test_build_port_bindings_with_matching_internal_ports PASSED [ 95%]
tests/unit/utils_test.py::PortsTest::test_build_port_bindings_with_nonmatching_internal_port_ranges PASSED [ 95%]
tests/unit/utils_test.py::PortsTest::test_build_port_bindings_with_nonmatching_internal_ports PASSED [ 95%]
tests/unit/utils_test.py::PortsTest::test_build_port_bindings_with_one_port PASSED [ 96%]
tests/unit/utils_test.py::PortsTest::test_build_port_bindings_with_port_range PASSED [ 96%]
tests/unit/utils_test.py::PortsTest::test_host_only_with_colon PASSED    [ 96%]
tests/unit/utils_test.py::PortsTest::test_non_matching_length_port_ranges PASSED [ 96%]
tests/unit/utils_test.py::PortsTest::test_port_and_range_invalid PASSED  [ 96%]
tests/unit/utils_test.py::PortsTest::test_port_only_with_colon PASSED    [ 96%]
tests/unit/utils_test.py::PortsTest::test_split_port_empty_string PASSED [ 96%]
tests/unit/utils_test.py::PortsTest::test_split_port_invalid PASSED      [ 97%]
tests/unit/utils_test.py::PortsTest::test_split_port_invalid_protocol PASSED [ 97%]
tests/unit/utils_test.py::PortsTest::test_split_port_no_host_port PASSED [ 97%]
tests/unit/utils_test.py::PortsTest::test_split_port_non_string PASSED   [ 97%]
tests/unit/utils_test.py::PortsTest::test_split_port_random_port_range_with_host_port PASSED [ 97%]
tests/unit/utils_test.py::PortsTest::test_split_port_range_no_host_port PASSED [ 97%]
tests/unit/utils_test.py::PortsTest::test_split_port_range_with_host_ip_no_port PASSED [ 98%]
tests/unit/utils_test.py::PortsTest::test_split_port_range_with_host_port PASSED [ 98%]
tests/unit/utils_test.py::PortsTest::test_split_port_range_with_protocol PASSED [ 98%]
tests/unit/utils_test.py::PortsTest::test_split_port_with_host_ip PASSED [ 98%]
tests/unit/utils_test.py::PortsTest::test_split_port_with_host_ip_no_port PASSED [ 98%]
tests/unit/utils_test.py::PortsTest::test_split_port_with_host_port PASSED [ 98%]
tests/unit/utils_test.py::PortsTest::test_split_port_with_ipv6_address PASSED [ 99%]
tests/unit/utils_test.py::PortsTest::test_split_port_with_ipv6_square_brackets_address PASSED [ 99%]
tests/unit/utils_test.py::PortsTest::test_split_port_with_protocol PASSED [ 99%]
tests/unit/utils_test.py::PortsTest::test_with_no_container_port PASSED  [ 99%]
tests/unit/utils_test.py::FormatEnvironmentTest::test_format_env_binary_unicode_value PASSED [ 99%]
tests/unit/utils_test.py::FormatEnvironmentTest::test_format_env_no_value PASSED [ 99%]
tests/unit/utils_test.py::test_compare_versions PASSED                   [100%]

---------- coverage: platform linux, python 3.10.12-final-0 ----------
Name                                  Stmts   Miss Branch BrPart  Cover
-----------------------------------------------------------------------
docker/__init__.py                        6      0      0      0   100%
docker/_version.py                       18      4      2      1    75%
docker/api/__init__.py                    1      0      0      0   100%
docker/api/build.py                     137     51    108     22    59%
docker/api/client.py                    274     69     90     11    75%
docker/api/config.py                     31     18      4      0    37%
docker/api/container.py                 284     75    118     28    66%
docker/api/daemon.py                     40      4     14      4    85%
docker/api/exec_api.py                   50     12     24     10    68%
docker/api/image.py                     161     43     62     14    70%
docker/api/network.py                    90     35     48     11    51%
docker/api/plugin.py                     96     68     16      0    25%
docker/api/secret.py                     35     22      8      0    30%
docker/api/service.py                   206    180    153      0     7%
docker/api/swarm.py                     112     71     42      1    27%
docker/api/volume.py                     37      9     14      2    71%
docker/auth.py                          199     16     78     16    88%
docker/client.py                         80      8      2      0    90%
docker/constants.py                      21      0      0      0   100%
docker/context/__init__.py                2      0      0      0   100%
docker/context/api.py                    78     41     38      8    39%
docker/context/config.py                 61     33     24      3    39%
docker/context/context.py               160     96     68      6    31%
docker/credentials/__init__.py            3      0      0      0   100%
docker/credentials/constants.py           4      0      0      0   100%
docker/credentials/errors.py             11      4      2      0    54%
docker/credentials/store.py              46     32     14      0    23%
docker/credentials/utils.py               5      3      0      0    40%
docker/errors.py                        112     27     23      4    70%
docker/models/__init__.py                 0      0      0      0   100%
docker/models/configs.py                 23      4      2      0    76%
docker/models/containers.py             201     13     78     11    90%
docker/models/images.py                 145     56     56      4    53%
docker/models/networks.py                39      7     12      3    73%
docker/models/nodes.py                   16      5      2      0    61%
docker/models/plugins.py                 51     29      8      0    37%
docker/models/resource.py                43      9      6      3    76%
docker/models/secrets.py                 23      4      2      0    76%
docker/models/services.py                89     35     36      4    59%
docker/models/swarm.py                   40     21      6      0    41%
docker/models/volumes.py                 24     10      4      0    50%
docker/tls.py                            25      4     10      4    77%
docker/transport/__init__.py             10      3      0      0    70%
docker/transport/basehttpadapter.py       8      0      2      1    90%
docker/transport/npipeconn.py            53     46     11      0    11%
docker/transport/npipesocket.py         154    150     22      0     2%
docker/transport/sshconn.py             158    102     59      3    29%
docker/transport/unixconn.py             47      1      9      2    95%
docker/types/__init__.py                  6      0      0      0   100%
docker/types/base.py                      4      0      2      0   100%
docker/types/containers.py              436     78    328     43    81%
docker/types/daemon.py                   33     22     14      0    23%
docker/types/healthcheck.py              43     20      4      0    49%
docker/types/networks.py                 45     14     32     10    61%
docker/types/services.py                350    152    234     46    52%
docker/types/swarm.py                    51     45     40      0     7%
docker/utils/__init__.py                  3      0      0      0   100%
docker/utils/build.py                   155     24     74     10    83%
docker/utils/config.py                   36      1     12      1    96%
docker/utils/decorators.py               33      1     12      1    96%
docker/utils/fnmatch.py                  55     18     28      2    61%
docker/utils/json_stream.py              40      8     14      2    78%
docker/utils/ports.py                    50      3     32      2    91%
docker/utils/proxy.py                    37      1     12      0    98%
docker/utils/socket.py                   95     16     46      9    78%
docker/utils/utils.py                   285     20    183     13    91%
docker/version.py                         8      6      0      0    25%
-----------------------------------------------------------------------
TOTAL                                  5274   1849   2344    315    61%


=========================== short test summary info ============================
XFAIL tests/unit/dockertypes_test.py::MountTest::test_parse_mount_bind_windows
XFAIL tests/unit/utils_build_test.py::test_match_tag[a/a/a/a/a/a/a/a/a/a/a/a/a/a/a/a/a/a/a/a/a/a/a/a/a/a/a/a/a/a/a/a/a/a/a/a/a/a/a/a/a/a/a/a/a/a/a/a/a/a/a/a/a/a/a/a/a/a/a/a/a/a/a/a/a/a/a/a/a/a/a/a/a/a/a/a/a/a/a/a/a/a/a/a/a/a/a/a/a/a/a/a/a/a/a/a/a/a/a/a/a/a/a/a/a/a/a/a/a/a/a/a/a/a/a/a/a/a/a/a/a/a/a/a/a/a/a/a/a:tag-False]
XFAIL tests/unit/utils_build_test.py::test_match_tag[[2001:db8::1]/repo-True]
XFAIL tests/unit/utils_build_test.py::test_match_tag[[2001:db8:1:2:3:4:5:6]/repo:tag-True]
XFAIL tests/unit/utils_build_test.py::test_match_tag[[2001:db8::1]:5000/repo-True]
XFAIL tests/unit/utils_build_test.py::test_match_tag[[2001:db8::1]:5000/repo:tag-True]
XFAIL tests/unit/utils_build_test.py::test_match_tag[[2001:db8::]:5000/repo-True]
XFAIL tests/unit/utils_build_test.py::test_match_tag[[::1]:5000/repo-True]
SKIPPED [1] tests/unit/api_build_test.py:190: Windows-specific syntax
SKIPPED [1] tests/unit/client_test.py:99: Npipe Connection Pool only on Windows
SKIPPED [1] tests/unit/client_test.py:135: Npipe Connection Pool only on Windows
SKIPPED [1] tests/unit/client_test.py:207: Npipe Connection Pool only on Windows
SKIPPED [1] tests/unit/client_test.py:241: Npipe Connection Pool only on Windows
SKIPPED [1] tests/unit/context_test.py:18: Windows specific path check
SKIPPED [1] tests/unit/utils_build_test.py:229: Backslash patterns only on Windows
SKIPPED [1] tests/unit/utils_build_test.py:251: Backslash patterns only on Windows
SKIPPED [1] tests/unit/utils_build_test.py:399: root user always has access ; no chmod on Windows
SKIPPED [1] tests/unit/utils_config_test.py:54: condition: sys.platform != 'win32'
============ 607 passed, 10 skipped, 8 xfailed, 1 xpassed in 8.65s =============
docker build \
	--pull \
	-t docker-sdk-python3 \
	-f tests/Dockerfile \
	--build-arg VERSION="0.0.0.dev0" \
	.
/bin/sh: 1: docker: not found
make: *** [Makefile:40: build] Error 127
docker build \
	-t dpy-dind-certs \
	-f tests/Dockerfile-dind-certs \
	--build-arg VERSION="0.0.0.dev0" \
	.
/bin/sh: 1: docker: not found
make: *** [Makefile:58: build-dind-certs] Error 127
docker build \
	--pull \
	-t docker-dind-ssh \
	-f tests/Dockerfile-ssh-dind \
	--build-arg VERSION="0.0.0.dev0" \
	--build-arg ENGINE_VERSION=26.1 \
	--build-arg API_VERSION=1.45 \
	.
/bin/sh: 1: docker: not found
make: *** [Makefile:29: build-dind-ssh] Error 127
