ERROR: Could not open requirements file: [Errno 2] No such file or directory: 'requirements.txt'

[notice] A new release of pip is available: 24.0 -> 25.3
[notice] To update, run: pip install --upgrade pip
warning: `VIRTUAL_ENV=venv` does not match the project environment path `.venv` and will be ignored; use `--active` to target the active environment instead
Using CPython 3.12.3 interpreter at: /usr/bin/python3
Creating virtual environment at: .venv
   Building click @ file:///app
Downloading virtualenv (5.8MiB)
Downloading pyright (5.3MiB)
Downloading uv (16.6MiB)
Downloading ruff (11.0MiB)
Downloading mypy (11.8MiB)
      Built click @ file:///app
 Downloading ruff
 Downloading virtualenv
 Downloading uv
 Downloading mypy
 Downloading pyright
Installed 27 packages in 126ms
py311: venv> .venv/bin/uv venv -p cpython3.11 --allow-existing --python-preference system /app/.tox/py311
py311: uv-sync> uv sync --locked --python-preference system --no-default-groups --no-editable --reinstall-package click --group tests -p cpython3.11
py311: commands[0]> pytest -v --tb=short --basetemp=/app/.tox/py311/tmp
============================= test session starts ==============================
platform linux -- Python 3.11.14, pytest-8.3.5, pluggy-1.6.0 -- /app/.tox/py311/bin/python3
cachedir: .tox/py311/.pytest_cache
rootdir: /app
configfile: pyproject.toml
testpaths: tests
collecting ... collected 761 items

tests/test_arguments.py::test_nargs_star PASSED                          [  0%]
tests/test_arguments.py::test_argument_unbounded_nargs_cant_have_default PASSED [  0%]
tests/test_arguments.py::test_nargs_tup PASSED                           [  0%]
tests/test_arguments.py::test_nargs_tup_composite[opts0] PASSED          [  0%]
tests/test_arguments.py::test_nargs_tup_composite[opts1] PASSED          [  0%]
tests/test_arguments.py::test_nargs_tup_composite[opts2] PASSED          [  0%]
tests/test_arguments.py::test_nargs_tup_composite[opts3] PASSED          [  0%]
tests/test_arguments.py::test_nargs_err PASSED                           [  1%]
tests/test_arguments.py::test_bytes_args PASSED                          [  1%]
tests/test_arguments.py::test_file_args PASSED                           [  1%]
tests/test_arguments.py::test_path_allow_dash PASSED                     [  1%]
tests/test_arguments.py::test_file_atomics PASSED                        [  1%]
tests/test_arguments.py::test_stdout_default PASSED                      [  1%]
tests/test_arguments.py::test_nargs_envvar[2--None] PASSED               [  1%]
tests/test_arguments.py::test_nargs_envvar[2-a-Takes 2 values but 1 was given.] PASSED [  1%]
tests/test_arguments.py::test_nargs_envvar[2-a b-expect2] PASSED         [  2%]
tests/test_arguments.py::test_nargs_envvar[2-a b c-Takes 2 values but 3 were given.] PASSED [  2%]
tests/test_arguments.py::test_nargs_envvar[-1-a b c-expect4] PASSED      [  2%]
tests/test_arguments.py::test_nargs_envvar[-1--expect5] PASSED           [  2%]
tests/test_arguments.py::test_envvar_flag_value PASSED                   [  2%]
tests/test_arguments.py::test_nargs_envvar_only_if_values_empty PASSED   [  2%]
tests/test_arguments.py::test_empty_nargs PASSED                         [  2%]
tests/test_arguments.py::test_missing_arg PASSED                         [  3%]
tests/test_arguments.py::test_missing_argument_string_cast PASSED        [  3%]
tests/test_arguments.py::test_implicit_non_required PASSED               [  3%]
tests/test_arguments.py::test_deprecated_usage PASSED                    [  3%]
tests/test_arguments.py::test_deprecated_warning[True] PASSED            [  3%]
tests/test_arguments.py::test_deprecated_warning[USE B INSTEAD] PASSED   [  3%]
tests/test_arguments.py::test_deprecated_required PASSED                 [  3%]
tests/test_arguments.py::test_eat_options PASSED                         [  3%]
tests/test_arguments.py::test_nargs_star_ordering PASSED                 [  4%]
tests/test_arguments.py::test_nargs_specified_plus_star_ordering PASSED  [  4%]
tests/test_arguments.py::test_defaults_for_nargs FAILED                  [  4%]
tests/test_arguments.py::test_multiple_param_decls_not_allowed PASSED    [  4%]
tests/test_arguments.py::test_multiple_not_allowed PASSED                [  4%]
tests/test_arguments.py::test_nargs_bad_default[value0] PASSED           [  4%]
tests/test_arguments.py::test_nargs_bad_default[value1] PASSED           [  4%]
tests/test_arguments.py::test_nargs_bad_default[value2] PASSED           [  4%]
tests/test_arguments.py::test_subcommand_help PASSED                     [  5%]
tests/test_arguments.py::test_nested_subcommand_help PASSED              [  5%]
tests/test_arguments.py::test_when_argument_decorator_is_used_multiple_times_cls_is_preserved PASSED [  5%]
tests/test_arguments.py::test_duplicate_names_warning[args_one0-args_two0] PASSED [  5%]
tests/test_basic.py::test_basic_functionality PASSED                     [  5%]
tests/test_basic.py::test_repr PASSED                                    [  5%]
tests/test_basic.py::test_return_values PASSED                           [  5%]
tests/test_basic.py::test_basic_group PASSED                             [  6%]
tests/test_basic.py::test_group_commands_dict PASSED                     [  6%]
tests/test_basic.py::test_group_from_list PASSED                         [  6%]
tests/test_basic.py::test_string_option[args0-S:[no value]] PASSED       [  6%]
tests/test_basic.py::test_string_option[args1-S:[42]] PASSED             [  6%]
tests/test_basic.py::test_string_option[args2-Error: Option '--s' requires an argument.] FAILED [  6%]
tests/test_basic.py::test_string_option[args3-S:[]] PASSED               [  6%]
tests/test_basic.py::test_string_option[args4-S:[\u2603]] PASSED         [  6%]
tests/test_basic.py::test_int_option[args0-I:[84]] PASSED                [  7%]
tests/test_basic.py::test_int_option[args1-I:[46]] PASSED                [  7%]
tests/test_basic.py::test_int_option[args2-Error: Invalid value for '--i': 'x' is not a valid integer.] FAILED [  7%]
tests/test_basic.py::test_uuid_option[args0-U:[ba122011-349f-423b-873b-9d6a79c688ab]] PASSED [  7%]
tests/test_basic.py::test_uuid_option[args1-U:[821592c1-c50e-4971-9cd6-e89dc6832f86]] PASSED [  7%]
tests/test_basic.py::test_uuid_option[args2-Error: Invalid value for '--u': 'x' is not a valid UUID.] FAILED [  7%]
tests/test_basic.py::test_float_option[args0-F:[42.0]] PASSED            [  7%]
tests/test_basic.py::test_float_option[--f=23.5-F:[23.5]] PASSED         [  8%]
tests/test_basic.py::test_float_option[--f=x-Error: Invalid value for '--f': 'x' is not a valid float.] FAILED [  8%]
tests/test_basic.py::test_boolean_switch[args0-True-True] PASSED         [  8%]
tests/test_basic.py::test_boolean_switch[args0-True-False] PASSED        [  8%]
tests/test_basic.py::test_boolean_switch[args1-False-True] PASSED        [  8%]
tests/test_basic.py::test_boolean_switch[args1-False-False] PASSED       [  8%]
tests/test_basic.py::test_boolean_switch[args2-None-True] PASSED         [  8%]
tests/test_basic.py::test_boolean_switch[args2-None-False] PASSED        [  8%]
tests/test_basic.py::test_boolean_flag[args0-True-True] PASSED           [  9%]
tests/test_basic.py::test_boolean_flag[args0-True-False] PASSED          [  9%]
tests/test_basic.py::test_boolean_flag[args1-False-True] PASSED          [  9%]
tests/test_basic.py::test_boolean_flag[args1-False-False] PASSED         [  9%]
tests/test_basic.py::test_boolean_conversion[1-True] PASSED              [  9%]
tests/test_basic.py::test_boolean_conversion[true-True] PASSED           [  9%]
tests/test_basic.py::test_boolean_conversion[t-True] PASSED              [  9%]
tests/test_basic.py::test_boolean_conversion[yes-True] PASSED            [  9%]
tests/test_basic.py::test_boolean_conversion[y-True] PASSED              [ 10%]
tests/test_basic.py::test_boolean_conversion[on-True] PASSED             [ 10%]
tests/test_basic.py::test_boolean_conversion[0-False] PASSED             [ 10%]
tests/test_basic.py::test_boolean_conversion[false-False] PASSED         [ 10%]
tests/test_basic.py::test_boolean_conversion[f-False] PASSED             [ 10%]
tests/test_basic.py::test_boolean_conversion[no-False] PASSED            [ 10%]
tests/test_basic.py::test_boolean_conversion[n-False] PASSED             [ 10%]
tests/test_basic.py::test_boolean_conversion[off-False] PASSED           [ 11%]
tests/test_basic.py::test_file_option PASSED                             [ 11%]
tests/test_basic.py::test_file_lazy_mode FAILED                          [ 11%]
tests/test_basic.py::test_path_option PASSED                             [ 11%]
tests/test_basic.py::test_choice_option PASSED                           [ 11%]
tests/test_basic.py::test_choice_argument PASSED                         [ 11%]
tests/test_basic.py::test_choice_argument_enum FAILED                    [ 11%]
tests/test_basic.py::test_choice_argument_custom_type PASSED             [ 11%]
tests/test_basic.py::test_choice_argument_none FAILED                    [ 12%]
tests/test_basic.py::test_datetime_option_default PASSED                 [ 12%]
tests/test_basic.py::test_datetime_option_custom PASSED                  [ 12%]
tests/test_basic.py::test_required_option PASSED                         [ 12%]
tests/test_basic.py::test_evaluation_order PASSED                        [ 12%]
tests/test_basic.py::test_hidden_option PASSED                           [ 12%]
tests/test_basic.py::test_hidden_command PASSED                          [ 12%]
tests/test_basic.py::test_hidden_group PASSED                            [ 13%]
tests/test_basic.py::test_summary_line PASSED                            [ 13%]
tests/test_basic.py::test_help_invalid_default PASSED                    [ 13%]
tests/test_chain.py::test_basic_chaining PASSED                          [ 13%]
tests/test_chain.py::test_chaining_help[args0-COMMAND1 [ARGS]... [COMMAND2 [ARGS]...]...] PASSED [ 13%]
tests/test_chain.py::test_chaining_help[args1-ROOT HELP] PASSED          [ 13%]
tests/test_chain.py::test_chaining_help[args2-SDIST HELP] PASSED         [ 13%]
tests/test_chain.py::test_chaining_help[args3-BDIST HELP] PASSED         [ 13%]
tests/test_chain.py::test_chaining_help[args4-SDIST HELP] PASSED         [ 14%]
tests/test_chain.py::test_chaining_with_options PASSED                   [ 14%]
tests/test_chain.py::test_no_command_result_callback[False-1] PASSED     [ 14%]
tests/test_chain.py::test_no_command_result_callback[True-[]] PASSED     [ 14%]
tests/test_chain.py::test_chaining_with_arguments PASSED                 [ 14%]
tests/test_chain.py::test_pipeline[args0-foo\nbar-expect0] PASSED        [ 14%]
tests/test_chain.py::test_pipeline[args1-foo \n bar-expect1] PASSED      [ 14%]
tests/test_chain.py::test_pipeline[args2-foo \n bar-expect2] PASSED      [ 14%]
tests/test_chain.py::test_args_and_chain PASSED                          [ 15%]
tests/test_chain.py::test_group_arg_behavior PASSED                      [ 15%]
tests/test_chain.py::test_group_chaining XFAIL                           [ 15%]
tests/test_command_decorators.py::test_command_no_parens PASSED          [ 15%]
tests/test_command_decorators.py::test_custom_command_no_parens PASSED   [ 15%]
tests/test_command_decorators.py::test_group_no_parens PASSED            [ 15%]
tests/test_command_decorators.py::test_params_argument PASSED            [ 15%]
tests/test_command_decorators.py::test_generate_name[init_data] PASSED   [ 16%]
tests/test_command_decorators.py::test_generate_name[init_data_command] PASSED [ 16%]
tests/test_command_decorators.py::test_generate_name[init_data_cmd] PASSED [ 16%]
tests/test_command_decorators.py::test_generate_name[init_data_group] PASSED [ 16%]
tests/test_command_decorators.py::test_generate_name[init_data_grp] PASSED [ 16%]
tests/test_commands.py::test_other_command_invoke PASSED                 [ 16%]
tests/test_commands.py::test_other_command_forward PASSED                [ 16%]
tests/test_commands.py::test_forwarded_params_consistency PASSED         [ 16%]
tests/test_commands.py::test_auto_shorthelp PASSED                       [ 17%]
tests/test_commands.py::test_command_no_args_is_help PASSED              [ 17%]
tests/test_commands.py::test_default_maps PASSED                         [ 17%]
tests/test_commands.py::test_group_with_args[args0-2-Error: Missing command.] PASSED [ 17%]
tests/test_commands.py::test_group_with_args[args1-0-Show this message and exit.] PASSED [ 17%]
tests/test_commands.py::test_group_with_args[args2-0-obj=obj1\nmove\n] PASSED [ 17%]
tests/test_commands.py::test_group_with_args[args3-2-Show this message and exit.] PASSED [ 17%]
tests/test_commands.py::test_custom_parser PASSED                        [ 18%]
tests/test_commands.py::test_object_propagation PASSED                   [ 18%]
tests/test_commands.py::test_other_command_invoke_with_defaults PASSED   [ 18%]
tests/test_commands.py::test_invoked_subcommand PASSED                   [ 18%]
tests/test_commands.py::test_aliased_command_canonical_name PASSED       [ 18%]
tests/test_commands.py::test_group_add_command_name PASSED               [ 18%]
tests/test_commands.py::test_iter_params_for_processing[invocation_order0-declaration_order0-expected_order0] PASSED [ 18%]
tests/test_commands.py::test_iter_params_for_processing[invocation_order1-declaration_order1-expected_order1] PASSED [ 18%]
tests/test_commands.py::test_iter_params_for_processing[invocation_order2-declaration_order2-expected_order2] PASSED [ 19%]
tests/test_commands.py::test_iter_params_for_processing[invocation_order3-declaration_order3-expected_order3] PASSED [ 19%]
tests/test_commands.py::test_iter_params_for_processing[invocation_order4-declaration_order4-expected_order4] PASSED [ 19%]
tests/test_commands.py::test_iter_params_for_processing[invocation_order5-declaration_order5-expected_order5] PASSED [ 19%]
tests/test_commands.py::test_iter_params_for_processing[invocation_order6-declaration_order6-expected_order6] PASSED [ 19%]
tests/test_commands.py::test_iter_params_for_processing[invocation_order7-declaration_order7-expected_order7] PASSED [ 19%]
tests/test_commands.py::test_iter_params_for_processing[invocation_order8-declaration_order8-expected_order8] PASSED [ 19%]
tests/test_commands.py::test_iter_params_for_processing[invocation_order9-declaration_order9-expected_order9] PASSED [ 19%]
tests/test_commands.py::test_iter_params_for_processing[invocation_order10-declaration_order10-expected_order10] PASSED [ 20%]
tests/test_commands.py::test_iter_params_for_processing[invocation_order11-declaration_order11-expected_order11] PASSED [ 20%]
tests/test_commands.py::test_iter_params_for_processing[invocation_order12-declaration_order12-expected_order12] PASSED [ 20%]
tests/test_commands.py::test_iter_params_for_processing[invocation_order13-declaration_order13-expected_order13] PASSED [ 20%]
tests/test_commands.py::test_iter_params_for_processing[invocation_order14-declaration_order14-expected_order14] PASSED [ 20%]
tests/test_commands.py::test_iter_params_for_processing[invocation_order15-declaration_order15-expected_order15] PASSED [ 20%]
tests/test_commands.py::test_iter_params_for_processing[invocation_order16-declaration_order16-expected_order16] PASSED [ 20%]
tests/test_commands.py::test_iter_params_for_processing[invocation_order17-declaration_order17-expected_order17] PASSED [ 21%]
tests/test_commands.py::test_iter_params_for_processing[invocation_order18-declaration_order18-expected_order18] PASSED [ 21%]
tests/test_commands.py::test_iter_params_for_processing[invocation_order19-declaration_order19-expected_order19] PASSED [ 21%]
tests/test_commands.py::test_iter_params_for_processing[invocation_order20-declaration_order20-expected_order20] PASSED [ 21%]
tests/test_commands.py::test_iter_params_for_processing[invocation_order21-declaration_order21-expected_order21] PASSED [ 21%]
tests/test_commands.py::test_iter_params_for_processing[invocation_order22-declaration_order22-expected_order22] PASSED [ 21%]
tests/test_commands.py::test_iter_params_for_processing[invocation_order23-declaration_order23-expected_order23] PASSED [ 21%]
tests/test_commands.py::test_iter_params_for_processing[invocation_order24-declaration_order24-expected_order24] PASSED [ 21%]
tests/test_commands.py::test_iter_params_for_processing[invocation_order25-declaration_order25-expected_order25] PASSED [ 22%]
tests/test_commands.py::test_iter_params_for_processing[invocation_order26-declaration_order26-expected_order26] PASSED [ 22%]
tests/test_commands.py::test_iter_params_for_processing[invocation_order27-declaration_order27-expected_order27] PASSED [ 22%]
tests/test_commands.py::test_iter_params_for_processing[invocation_order28-declaration_order28-expected_order28] PASSED [ 22%]
tests/test_commands.py::test_iter_params_for_processing[invocation_order29-declaration_order29-expected_order29] PASSED [ 22%]
tests/test_commands.py::test_iter_params_for_processing[invocation_order30-declaration_order30-expected_order30] PASSED [ 22%]
tests/test_commands.py::test_iter_params_for_processing[invocation_order31-declaration_order31-expected_order31] PASSED [ 22%]
tests/test_commands.py::test_iter_params_for_processing[invocation_order32-declaration_order32-expected_order32] PASSED [ 22%]
tests/test_commands.py::test_iter_params_for_processing[invocation_order33-declaration_order33-expected_order33] PASSED [ 23%]
tests/test_commands.py::test_help_param_priority PASSED                  [ 23%]
tests/test_commands.py::test_unprocessed_options PASSED                  [ 23%]
tests/test_commands.py::test_deprecated_in_help_messages[True-CLI HELP] PASSED [ 23%]
tests/test_commands.py::test_deprecated_in_help_messages[True-None] PASSED [ 23%]
tests/test_commands.py::test_deprecated_in_help_messages[USE OTHER COMMAND INSTEAD-CLI HELP] PASSED [ 23%]
tests/test_commands.py::test_deprecated_in_help_messages[USE OTHER COMMAND INSTEAD-None] PASSED [ 23%]
tests/test_commands.py::test_deprecated_in_invocation[True] PASSED       [ 24%]
tests/test_commands.py::test_deprecated_in_invocation[USE OTHER COMMAND INSTEAD] PASSED [ 24%]
tests/test_commands.py::test_command_parse_args_collects_option_prefixes PASSED [ 24%]
tests/test_commands.py::test_group_parse_args_collects_base_option_prefixes PASSED [ 24%]
tests/test_commands.py::test_group_invoke_collects_used_option_prefixes PASSED [ 24%]
tests/test_commands.py::test_abort_exceptions_with_disabled_standalone_mode[EOFError] PASSED [ 24%]
tests/test_commands.py::test_abort_exceptions_with_disabled_standalone_mode[KeyboardInterrupt] PASSED [ 24%]
tests/test_compat.py::test_is_jupyter_kernel_output PASSED               [ 24%]
tests/test_context.py::test_ensure_context_objects PASSED                [ 25%]
tests/test_context.py::test_get_context_objects PASSED                   [ 25%]
tests/test_context.py::test_get_context_objects_no_ensuring PASSED       [ 25%]
tests/test_context.py::test_get_context_objects_missing PASSED           [ 25%]
tests/test_context.py::test_multi_enter PASSED                           [ 25%]
tests/test_context.py::test_global_context_object PASSED                 [ 25%]
tests/test_context.py::test_context_meta PASSED                          [ 25%]
tests/test_context.py::test_make_pass_meta_decorator PASSED              [ 26%]
tests/test_context.py::test_make_pass_meta_decorator_doc PASSED          [ 26%]
tests/test_context.py::test_context_pushing PASSED                       [ 26%]
tests/test_context.py::test_pass_obj PASSED                              [ 26%]
tests/test_context.py::test_close_before_pop PASSED                      [ 26%]
tests/test_context.py::test_close_before_exit PASSED                     [ 26%]
tests/test_context.py::test_multiple_eager_callbacks[natural_order] PASSED [ 26%]
tests/test_context.py::test_multiple_eager_callbacks[eagerness_precedence] PASSED [ 26%]
tests/test_context.py::test_no_state_leaks PASSED                        [ 27%]
tests/test_context.py::test_with_resource PASSED                         [ 27%]
tests/test_context.py::test_make_pass_decorator_args PASSED              [ 27%]
tests/test_context.py::test_propagate_show_default_setting PASSED        [ 27%]
tests/test_context.py::test_exit_not_standalone PASSED                   [ 27%]
tests/test_context.py::test_parameter_source[default] PASSED             [ 27%]
tests/test_context.py::test_parameter_source[default_map] PASSED         [ 27%]
tests/test_context.py::test_parameter_source[commandline short] PASSED   [ 27%]
tests/test_context.py::test_parameter_source[commandline long] PASSED    [ 28%]
tests/test_context.py::test_parameter_source[environment auto] PASSED    [ 28%]
tests/test_context.py::test_parameter_source[environment manual] PASSED  [ 28%]
tests/test_context.py::test_propagate_opt_prefixes PASSED                [ 28%]
tests/test_custom_classes.py::test_command_context_class PASSED          [ 28%]
tests/test_custom_classes.py::test_context_invoke_type PASSED            [ 28%]
tests/test_custom_classes.py::test_context_formatter_class PASSED        [ 28%]
tests/test_custom_classes.py::test_group_command_class PASSED            [ 29%]
tests/test_custom_classes.py::test_group_group_class PASSED              [ 29%]
tests/test_custom_classes.py::test_group_group_class_self PASSED         [ 29%]
tests/test_defaults.py::test_basic_defaults PASSED                       [ 29%]
tests/test_defaults.py::test_multiple_defaults PASSED                    [ 29%]
tests/test_defaults.py::test_nargs_plus_multiple PASSED                  [ 29%]
tests/test_defaults.py::test_multiple_flag_default PASSED                [ 29%]
tests/test_defaults.py::test_flag_default_map PASSED                     [ 29%]
tests/test_formatting.py::test_basic_functionality PASSED                [ 30%]
tests/test_formatting.py::test_wrapping_long_options_strings PASSED      [ 30%]
tests/test_formatting.py::test_wrapping_long_command_name PASSED         [ 30%]
tests/test_formatting.py::test_formatting_empty_help_lines PASSED        [ 30%]
tests/test_formatting.py::test_formatting_usage_error PASSED             [ 30%]
tests/test_formatting.py::test_formatting_usage_error_metavar_missing_arg PASSED [ 30%]
tests/test_formatting.py::test_formatting_usage_error_metavar_bad_arg PASSED [ 30%]
tests/test_formatting.py::test_formatting_usage_error_nested PASSED      [ 31%]
tests/test_formatting.py::test_formatting_usage_error_no_help PASSED     [ 31%]
tests/test_formatting.py::test_formatting_usage_custom_help PASSED       [ 31%]
tests/test_formatting.py::test_formatting_custom_type_metavar PASSED     [ 31%]
tests/test_formatting.py::test_truncating_docstring PASSED               [ 31%]
tests/test_formatting.py::test_truncating_docstring_no_help PASSED       [ 31%]
tests/test_formatting.py::test_removing_multiline_marker PASSED          [ 31%]
tests/test_formatting.py::test_global_show_default PASSED                [ 31%]
tests/test_formatting.py::test_formatting_with_options_metavar_empty PASSED [ 32%]
tests/test_formatting.py::test_help_formatter_write_text PASSED          [ 32%]
tests/test_imports.py::test_light_imports PASSED                         [ 32%]
tests/test_info_dict.py::test_parameter[Func ParamType] PASSED           [ 32%]
tests/test_info_dict.py::test_parameter[UNPROCESSED ParamType] PASSED    [ 32%]
tests/test_info_dict.py::test_parameter[STRING ParamType] PASSED         [ 32%]
tests/test_info_dict.py::test_parameter[Choice ParamType] PASSED         [ 32%]
tests/test_info_dict.py::test_parameter[DateTime ParamType] PASSED       [ 32%]
tests/test_info_dict.py::test_parameter[INT ParamType] PASSED            [ 33%]
tests/test_info_dict.py::test_parameter[IntRange ParamType] PASSED       [ 33%]
tests/test_info_dict.py::test_parameter[FLOAT ParamType] PASSED          [ 33%]
tests/test_info_dict.py::test_parameter[FloatRange ParamType] PASSED     [ 33%]
tests/test_info_dict.py::test_parameter[Bool ParamType] PASSED           [ 33%]
tests/test_info_dict.py::test_parameter[UUID ParamType] PASSED           [ 33%]
tests/test_info_dict.py::test_parameter[File ParamType] PASSED           [ 33%]
tests/test_info_dict.py::test_parameter[Path ParamType] PASSED           [ 34%]
tests/test_info_dict.py::test_parameter[Tuple ParamType] PASSED          [ 34%]
tests/test_info_dict.py::test_parameter[Option] PASSED                   [ 34%]
tests/test_info_dict.py::test_parameter[Flag Option] PASSED              [ 34%]
tests/test_info_dict.py::test_parameter[Argument] PASSED                 [ 34%]
tests/test_info_dict.py::test_command[Command] PASSED                    [ 34%]
tests/test_info_dict.py::test_command[Group] PASSED                      [ 34%]
tests/test_info_dict.py::test_command[Nested Group] PASSED               [ 34%]
tests/test_info_dict.py::test_context PASSED                             [ 35%]
tests/test_info_dict.py::test_paramtype_no_name PASSED                   [ 35%]
tests/test_normalization.py::test_option_normalization PASSED            [ 35%]
tests/test_normalization.py::test_choice_normalization PASSED            [ 35%]
tests/test_normalization.py::test_command_normalization PASSED           [ 35%]
tests/test_options.py::test_prefixes PASSED                              [ 35%]
tests/test_options.py::test_invalid_option PASSED                        [ 35%]
tests/test_options.py::test_deprecated_usage[True] PASSED                [ 36%]
tests/test_options.py::test_deprecated_usage[USE B INSTEAD] PASSED       [ 36%]
tests/test_options.py::test_deprecated_warning[True] PASSED              [ 36%]
tests/test_options.py::test_deprecated_warning[USE B INSTEAD] PASSED     [ 36%]
tests/test_options.py::test_deprecated_required PASSED                   [ 36%]
tests/test_options.py::test_deprecated_prompt PASSED                     [ 36%]
tests/test_options.py::test_invalid_nargs PASSED                         [ 36%]
tests/test_options.py::test_nargs_tup_composite_mult PASSED              [ 36%]
tests/test_options.py::test_counting FAILED                              [ 37%]
tests/test_options.py::test_unknown_options[--foo] FAILED                [ 37%]
tests/test_options.py::test_unknown_options[-f] FAILED                   [ 37%]
tests/test_options.py::test_suggest_possible_options[--cat-Did you mean --count?] PASSED [ 37%]
tests/test_options.py::test_suggest_possible_options[--bounds-(Possible options: --bound, --count)] PASSED [ 37%]
tests/test_options.py::test_suggest_possible_options[--bount-(Possible options: --bound, --count)] PASSED [ 37%]
tests/test_options.py::test_multiple_required FAILED                     [ 37%]
tests/test_options.py::test_init_good_default_list[True-1-default0] PASSED [ 37%]
tests/test_options.py::test_init_good_default_list[True-1-default1] PASSED [ 38%]
tests/test_options.py::test_init_good_default_list[False-2-default2] PASSED [ 38%]
tests/test_options.py::test_init_good_default_list[True-2-default3] PASSED [ 38%]
tests/test_options.py::test_init_good_default_list[True-2-default4] PASSED [ 38%]
tests/test_options.py::test_init_bad_default_list[True-1-1] PASSED       [ 38%]
tests/test_options.py::test_init_bad_default_list[False-2-default1] PASSED [ 38%]
tests/test_options.py::test_init_bad_default_list[True-2-default2] PASSED [ 38%]
tests/test_options.py::test_empty_envvar[MYPATH] PASSED                  [ 39%]
tests/test_options.py::test_empty_envvar[AUTO_MYPATH] PASSED             [ 39%]
tests/test_options.py::test_multiple_envvar PASSED                       [ 39%]
tests/test_options.py::test_trailing_blanks_boolean_envvar PASSED        [ 39%]
tests/test_options.py::test_multiple_default_help PASSED                 [ 39%]
tests/test_options.py::test_show_default_default_map PASSED              [ 39%]
tests/test_options.py::test_multiple_default_type PASSED                 [ 39%]
tests/test_options.py::test_multiple_default_composite_type PASSED       [ 39%]
tests/test_options.py::test_parse_multiple_default_composite_type PASSED [ 40%]
tests/test_options.py::test_dynamic_default_help_unset PASSED            [ 40%]
tests/test_options.py::test_dynamic_default_help_text PASSED             [ 40%]
tests/test_options.py::test_dynamic_default_help_special_method PASSED   [ 40%]
tests/test_options.py::test_intrange_default_help_text[type0-1<=x<=32] PASSED [ 40%]
tests/test_options.py::test_intrange_default_help_text[type1-1<x<32] PASSED [ 40%]
tests/test_options.py::test_intrange_default_help_text[type2-x>=1] PASSED [ 40%]
tests/test_options.py::test_intrange_default_help_text[type3-x<=32] PASSED [ 40%]
tests/test_options.py::test_count_default_type_help PASSED               [ 41%]
tests/test_options.py::test_file_type_help_default PASSED                [ 41%]
tests/test_options.py::test_toupper_envvar_prefix PASSED                 [ 41%]
tests/test_options.py::test_nargs_envvar PASSED                          [ 41%]
tests/test_options.py::test_show_envvar PASSED                           [ 41%]
tests/test_options.py::test_show_envvar_auto_prefix PASSED               [ 41%]
tests/test_options.py::test_show_envvar_auto_prefix_dash_in_command PASSED [ 41%]
tests/test_options.py::test_custom_validation PASSED                     [ 42%]
tests/test_options.py::test_callback_validates_prompt PASSED             [ 42%]
tests/test_options.py::test_winstyle_options PASSED                      [ 42%]
tests/test_options.py::test_legacy_options PASSED                        [ 42%]
tests/test_options.py::test_missing_option_string_cast PASSED            [ 42%]
tests/test_options.py::test_missing_required_flag PASSED                 [ 42%]
tests/test_options.py::test_missing_choice PASSED                        [ 42%]
tests/test_options.py::test_missing_envvar PASSED                        [ 42%]
tests/test_options.py::test_case_insensitive_choice PASSED               [ 43%]
tests/test_options.py::test_case_insensitive_choice_returned_exactly PASSED [ 43%]
tests/test_options.py::test_option_help_preserve_paragraphs PASSED       [ 43%]
tests/test_options.py::test_argument_custom_class PASSED                 [ 43%]
tests/test_options.py::test_option_custom_class PASSED                   [ 43%]
tests/test_options.py::test_option_custom_class_reusable PASSED          [ 43%]
tests/test_options.py::test_help_option_custom_names_and_class[name_specs0-  -h, --help  Show this message and exit.\n-True] PASSED [ 43%]
tests/test_options.py::test_help_option_custom_names_and_class[name_specs0-  -h, --help  Show this message and exit.\n-False] PASSED [ 44%]
tests/test_options.py::test_help_option_custom_names_and_class[name_specs1-  -h      Show this message and exit.\n  --help  Show this message and exit.\n-True] PASSED [ 44%]
tests/test_options.py::test_help_option_custom_names_and_class[name_specs1-  -h      Show this message and exit.\n  --help  Show this message and exit.\n-False] PASSED [ 44%]
tests/test_options.py::test_help_option_custom_names_and_class[name_specs2-  --help  Show this message and exit.\n-True] PASSED [ 44%]
tests/test_options.py::test_help_option_custom_names_and_class[name_specs2-  --help  Show this message and exit.\n-False] PASSED [ 44%]
tests/test_options.py::test_bool_flag_with_type PASSED                   [ 44%]
tests/test_options.py::test_aliases_for_flags PASSED                     [ 44%]
tests/test_options.py::test_option_names[option_args0-aggressive] PASSED [ 44%]
tests/test_options.py::test_option_names[option_args1-first] PASSED      [ 45%]
tests/test_options.py::test_option_names[option_args2-apple] PASSED      [ 45%]
tests/test_options.py::test_option_names[option_args3-cantaloupe] PASSED [ 45%]
tests/test_options.py::test_option_names[option_args4-a] PASSED          [ 45%]
tests/test_options.py::test_option_names[option_args5-c] PASSED          [ 45%]
tests/test_options.py::test_option_names[option_args6-apple] PASSED      [ 45%]
tests/test_options.py::test_option_names[option_args7-cantaloupe] PASSED [ 45%]
tests/test_options.py::test_option_names[option_args8-_from] PASSED      [ 45%]
tests/test_options.py::test_option_names[option_args9-_ret] PASSED       [ 46%]
tests/test_options.py::test_flag_duplicate_names PASSED                  [ 46%]
tests/test_options.py::test_show_default_boolean_flag_name[False-no-cache] PASSED [ 46%]
tests/test_options.py::test_show_default_boolean_flag_name[True-cache] PASSED [ 46%]
tests/test_options.py::test_show_true_default_boolean_flag_value PASSED  [ 46%]
tests/test_options.py::test_hide_false_default_boolean_flag_value[False] PASSED [ 46%]
tests/test_options.py::test_hide_false_default_boolean_flag_value[None] PASSED [ 46%]
tests/test_options.py::test_show_default_string PASSED                   [ 47%]
tests/test_options.py::test_show_default_with_empty_string PASSED        [ 47%]
tests/test_options.py::test_do_not_show_no_default PASSED                [ 47%]
tests/test_options.py::test_do_not_show_default_empty_multiple PASSED    [ 47%]
tests/test_options.py::test_show_default_precedence[None-None-extra_value0-False] PASSED [ 47%]
tests/test_options.py::test_show_default_precedence[None-False-extra_value1-False] PASSED [ 47%]
tests/test_options.py::test_show_default_precedence[None-True-extra_value2-True] PASSED [ 47%]
tests/test_options.py::test_show_default_precedence[False-None-extra_value3-False] PASSED [ 47%]
tests/test_options.py::test_show_default_precedence[False-False-extra_value4-False] PASSED [ 48%]
tests/test_options.py::test_show_default_precedence[False-True-extra_value5-True] PASSED [ 48%]
tests/test_options.py::test_show_default_precedence[True-None-extra_value6-True] PASSED [ 48%]
tests/test_options.py::test_show_default_precedence[True-False-extra_value7-False] PASSED [ 48%]
tests/test_options.py::test_show_default_precedence[True-True-extra_value8-True] PASSED [ 48%]
tests/test_options.py::test_show_default_precedence[False-one-extra_value9-True] PASSED [ 48%]
tests/test_options.py::test_option_with_optional_value[None-expect0] PASSED [ 48%]
tests/test_options.py::test_option_with_optional_value[args1-expect1] PASSED [ 49%]
tests/test_options.py::test_option_with_optional_value[args2-expect2] PASSED [ 49%]
tests/test_options.py::test_option_with_optional_value[args3-expect3] PASSED [ 49%]
tests/test_options.py::test_option_with_optional_value[args4-expect4] PASSED [ 49%]
tests/test_options.py::test_option_with_optional_value[args5-expect5] PASSED [ 49%]
tests/test_options.py::test_option_with_optional_value[args6-expect6] PASSED [ 49%]
tests/test_options.py::test_option_with_optional_value[args7-expect7] PASSED [ 49%]
tests/test_options.py::test_option_with_optional_value[args8-expect8] PASSED [ 49%]
tests/test_options.py::test_option_with_optional_value[args9-expect9] PASSED [ 50%]
tests/test_options.py::test_option_with_optional_value[args10-expect10] PASSED [ 50%]
tests/test_options.py::test_option_with_optional_value[args11-expect11] PASSED [ 50%]
tests/test_options.py::test_option_with_optional_value[args12-expect12] PASSED [ 50%]
tests/test_options.py::test_option_with_optional_value[args13-expect13] PASSED [ 50%]
tests/test_options.py::test_multiple_option_with_optional_value PASSED   [ 50%]
tests/test_options.py::test_type_from_flag_value PASSED                  [ 50%]
tests/test_options.py::test_flag_value_is_correctly_set[opts0-False-False] PASSED [ 50%]
tests/test_options.py::test_flag_value_is_correctly_set[opts1-True-True] PASSED [ 51%]
tests/test_options.py::test_flag_value_is_correctly_set[opts2-False-True] PASSED [ 51%]
tests/test_options.py::test_flag_value_is_correctly_set[opts3-True-False] PASSED [ 51%]
tests/test_options.py::test_flag_value_is_correctly_set[opts4-False-False] PASSED [ 51%]
tests/test_options.py::test_flag_value_is_correctly_set[opts5-True-True] PASSED [ 51%]
tests/test_options.py::test_flag_value_is_correctly_set[opts6-False-True] PASSED [ 51%]
tests/test_options.py::test_flag_value_is_correctly_set[opts7-True-False] PASSED [ 51%]
tests/test_options.py::test_flag_value_is_correctly_set[opts8-False-] PASSED [ 52%]
tests/test_options.py::test_flag_value_is_correctly_set[opts9-True-True] PASSED [ 52%]
tests/test_options.py::test_is_bool_flag_is_correctly_set[int option] PASSED [ 52%]
tests/test_options.py::test_is_bool_flag_is_correctly_set[bool non-flag [None]] PASSED [ 52%]
tests/test_options.py::test_is_bool_flag_is_correctly_set[bool non-flag [True]] PASSED [ 52%]
tests/test_options.py::test_is_bool_flag_is_correctly_set[bool non-flag [False]] PASSED [ 52%]
tests/test_options.py::test_is_bool_flag_is_correctly_set[non-bool flag_value] PASSED [ 52%]
tests/test_options.py::test_is_bool_flag_is_correctly_set[is_flag=True] PASSED [ 52%]
tests/test_options.py::test_is_bool_flag_is_correctly_set[secondary option [implicit flag]] PASSED [ 53%]
tests/test_options.py::test_is_bool_flag_is_correctly_set[bool flag_value] PASSED [ 53%]
tests/test_options.py::test_invalid_flag_combinations[kwargs0-'count' is not valid with 'multiple'.] PASSED [ 53%]
tests/test_options.py::test_invalid_flag_combinations[kwargs1-'count' is not valid with 'is_flag'.] PASSED [ 53%]
tests/test_options.py::test_non_flag_with_non_negatable_default PASSED   [ 53%]
tests/test_options.py::test_usage_show_choices[text choices] PASSED      [ 53%]
tests/test_options.py::test_usage_show_choices[int choices] PASSED       [ 53%]
tests/test_options.py::test_usage_show_choices[float choices] PASSED     [ 54%]
tests/test_options.py::test_usage_show_choices[bool choices] PASSED      [ 54%]
tests/test_options.py::test_usage_show_choices[text/int choices] PASSED  [ 54%]
tests/test_options.py::test_duplicate_names_warning[opts_one0-opts_two0] PASSED [ 54%]
tests/test_options.py::test_duplicate_names_warning[opts_one1-opts_two1] PASSED [ 54%]
tests/test_parser.py::test_split_arg_string[cli a b c-expect0] PASSED    [ 54%]
tests/test_parser.py::test_split_arg_string[cli 'my file-expect1] PASSED [ 54%]
tests/test_parser.py::test_split_arg_string[cli 'my file'-expect2] PASSED [ 54%]
tests/test_parser.py::test_split_arg_string[cli my\\-expect3] PASSED     [ 55%]
tests/test_parser.py::test_split_arg_string[cli my\\ file-expect4] PASSED [ 55%]
tests/test_parser.py::test_parser_default_prefixes PASSED                [ 55%]
tests/test_parser.py::test_parser_collects_prefixes PASSED               [ 55%]
tests/test_shell_completion.py::test_command PASSED                      [ 55%]
tests/test_shell_completion.py::test_group PASSED                        [ 55%]
tests/test_shell_completion.py::test_nested_group[args0--expect0] PASSED [ 55%]
tests/test_shell_completion.py::test_nested_group[args1--expect1] PASSED [ 55%]
tests/test_shell_completion.py::test_nested_group[args2--expect2] PASSED [ 56%]
tests/test_shell_completion.py::test_nested_group[args3---expect3] PASSED [ 56%]
tests/test_shell_completion.py::test_nested_group[args4--expect4] PASSED [ 56%]
tests/test_shell_completion.py::test_nested_group[args5---expect5] PASSED [ 56%]
tests/test_shell_completion.py::test_group_command_same_option PASSED    [ 56%]
tests/test_shell_completion.py::test_chained PASSED                      [ 56%]
tests/test_shell_completion.py::test_help_option PASSED                  [ 56%]
tests/test_shell_completion.py::test_argument_order PASSED               [ 57%]
tests/test_shell_completion.py::test_argument_default PASSED             [ 57%]
tests/test_shell_completion.py::test_type_choice PASSED                  [ 57%]
tests/test_shell_completion.py::test_choice_special_characters PASSED    [ 57%]
tests/test_shell_completion.py::test_choice_conflicting_prefix PASSED    [ 57%]
tests/test_shell_completion.py::test_option_count PASSED                 [ 57%]
tests/test_shell_completion.py::test_option_optional PASSED              [ 57%]
tests/test_shell_completion.py::test_path_types[type0-file] PASSED       [ 57%]
tests/test_shell_completion.py::test_path_types[type1-file] PASSED       [ 58%]
tests/test_shell_completion.py::test_path_types[type2-dir] PASSED        [ 58%]
tests/test_shell_completion.py::test_absolute_path PASSED                [ 58%]
tests/test_shell_completion.py::test_option_flag PASSED                  [ 58%]
tests/test_shell_completion.py::test_option_custom PASSED                [ 58%]
tests/test_shell_completion.py::test_option_multiple PASSED              [ 58%]
tests/test_shell_completion.py::test_option_nargs PASSED                 [ 58%]
tests/test_shell_completion.py::test_argument_nargs PASSED               [ 59%]
tests/test_shell_completion.py::test_double_dash PASSED                  [ 59%]
tests/test_shell_completion.py::test_hidden PASSED                       [ 59%]
tests/test_shell_completion.py::test_add_different_name PASSED           [ 59%]
tests/test_shell_completion.py::test_completion_item_data PASSED         [ 59%]
tests/test_shell_completion.py::test_full_source[bash] PASSED            [ 59%]
tests/test_shell_completion.py::test_full_source[zsh] PASSED             [ 59%]
tests/test_shell_completion.py::test_full_source[fish] PASSED            [ 59%]
tests/test_shell_completion.py::test_full_complete[bash-env0-plain,a\nplain,b\n] PASSED [ 60%]
tests/test_shell_completion.py::test_full_complete[bash-env1-plain,b\n] PASSED [ 60%]
tests/test_shell_completion.py::test_full_complete[zsh-env2-plain\na\n_\nplain\nb\nbee\n] PASSED [ 60%]
tests/test_shell_completion.py::test_full_complete[zsh-env3-plain\nb\nbee\n] PASSED [ 60%]
tests/test_shell_completion.py::test_full_complete[fish-env4-plain,a\nplain,b\tbee\n] PASSED [ 60%]
tests/test_shell_completion.py::test_full_complete[fish-env5-plain,b\tbee\n] PASSED [ 60%]
tests/test_shell_completion.py::test_context_settings PASSED             [ 60%]
tests/test_shell_completion.py::test_choice_case_sensitive[False-expect0] PASSED [ 60%]
tests/test_shell_completion.py::test_choice_case_sensitive[True-expect1] PASSED [ 61%]
tests/test_shell_completion.py::test_add_completion_class PASSED         [ 61%]
tests/test_shell_completion.py::test_add_completion_class_with_name PASSED [ 61%]
tests/test_shell_completion.py::test_add_completion_class_decorator PASSED [ 61%]
tests/test_shell_completion.py::test_files_closed PASSED                 [ 61%]
tests/test_termui.py::test_progressbar_strip_regression PASSED           [ 61%]
tests/test_termui.py::test_progressbar_length_hint PASSED                [ 61%]
tests/test_termui.py::test_progressbar_no_tty PASSED                     [ 62%]
tests/test_termui.py::test_progressbar_hidden_manual PASSED              [ 62%]
tests/test_termui.py::test_progressbar_time_per_iteration[avg0-0.0] PASSED [ 62%]
tests/test_termui.py::test_progressbar_time_per_iteration[avg1-2.5] PASSED [ 62%]
tests/test_termui.py::test_progressbar_eta[False-5] PASSED               [ 62%]
tests/test_termui.py::test_progressbar_eta[True-0] PASSED                [ 62%]
tests/test_termui.py::test_progressbar_format_eta[0-00:00:00] PASSED     [ 62%]
tests/test_termui.py::test_progressbar_format_eta[30-00:00:30] PASSED    [ 62%]
tests/test_termui.py::test_progressbar_format_eta[90-00:01:30] PASSED    [ 63%]
tests/test_termui.py::test_progressbar_format_eta[900-00:15:00] PASSED   [ 63%]
tests/test_termui.py::test_progressbar_format_eta[9000-02:30:00] PASSED  [ 63%]
tests/test_termui.py::test_progressbar_format_eta[99999999999-1157407d 09:46:39] PASSED [ 63%]
tests/test_termui.py::test_progressbar_format_eta[None-] PASSED          [ 63%]
tests/test_termui.py::test_progressbar_format_pos[0-5] PASSED            [ 63%]
tests/test_termui.py::test_progressbar_format_pos[-1-1] PASSED           [ 63%]
tests/test_termui.py::test_progressbar_format_pos[5-5] PASSED            [ 63%]
tests/test_termui.py::test_progressbar_format_pos[6-5] PASSED            [ 64%]
tests/test_termui.py::test_progressbar_format_pos[4-0] PASSED            [ 64%]
tests/test_termui.py::test_progressbar_format_bar[8-False-7-0-#######-] PASSED [ 64%]
tests/test_termui.py::test_progressbar_format_bar[0-True-8-0-########] PASSED [ 64%]
tests/test_termui.py::test_progressbar_format_progress_line[0-True-True-0-  [--------]  0/0    0%] PASSED [ 64%]
tests/test_termui.py::test_progressbar_format_progress_line[0-False-True-0-  [--------]  0/0] PASSED [ 64%]
tests/test_termui.py::test_progressbar_format_progress_line[0-False-False-0-  [--------]0] PASSED [ 64%]
tests/test_termui.py::test_progressbar_format_progress_line[0-False-False-0-  [--------]1] PASSED [ 65%]
tests/test_termui.py::test_progressbar_format_progress_line[8-True-True-8-  [########]  8/8  100%] PASSED [ 65%]
tests/test_termui.py::test_progressbar_format_progress_line_with_show_func[test] PASSED [ 65%]
tests/test_termui.py::test_progressbar_format_progress_line_with_show_func[None] PASSED [ 65%]
tests/test_termui.py::test_progressbar_init_exceptions PASSED            [ 65%]
tests/test_termui.py::test_progressbar_iter_outside_with_exceptions PASSED [ 65%]
tests/test_termui.py::test_progressbar_is_iterator PASSED                [ 65%]
tests/test_termui.py::test_choices_list_in_prompt PASSED                 [ 65%]
tests/test_termui.py::test_file_prompt_default_format[file_kwargs0] PASSED [ 66%]
tests/test_termui.py::test_file_prompt_default_format[file_kwargs1] PASSED [ 66%]
tests/test_termui.py::test_file_prompt_default_format[file_kwargs2] PASSED [ 66%]
tests/test_termui.py::test_secho PASSED                                  [ 66%]
tests/test_termui.py::test_secho_non_text[123-\x1b[45m123\x1b[0m] PASSED [ 66%]
tests/test_termui.py::test_secho_non_text[test-test] FAILED              [ 66%]
tests/test_termui.py::test_progressbar_yields_all_items PASSED           [ 66%]
tests/test_termui.py::test_progressbar_update PASSED                     [ 67%]
tests/test_termui.py::test_progressbar_item_show_func PASSED             [ 67%]
tests/test_termui.py::test_progressbar_update_with_item_show_func PASSED [ 67%]
tests/test_termui.py::test_progress_bar_update_min_steps PASSED          [ 67%]
tests/test_termui.py::test_getchar_windows[True-h] SKIPPED (Tests us...) [ 67%]
tests/test_termui.py::test_getchar_windows[True-H] SKIPPED (Tests us...) [ 67%]
tests/test_termui.py::test_getchar_windows[True-\xe9] SKIPPED (Tests...) [ 67%]
tests/test_termui.py::test_getchar_windows[True-\xc0] SKIPPED (Tests...) [ 67%]
tests/test_termui.py::test_getchar_windows[True- ] SKIPPED (Tests us...) [ 68%]
tests/test_termui.py::test_getchar_windows[True-\u5b57] SKIPPED (Tes...) [ 68%]
tests/test_termui.py::test_getchar_windows[True-\xe0H] SKIPPED (Test...) [ 68%]
tests/test_termui.py::test_getchar_windows[True-\xe0R] SKIPPED (Test...) [ 68%]
tests/test_termui.py::test_getchar_windows[False-h] SKIPPED (Tests u...) [ 68%]
tests/test_termui.py::test_getchar_windows[False-H] SKIPPED (Tests u...) [ 68%]
tests/test_termui.py::test_getchar_windows[False-\xe9] SKIPPED (Test...) [ 68%]
tests/test_termui.py::test_getchar_windows[False-\xc0] SKIPPED (Test...) [ 68%]
tests/test_termui.py::test_getchar_windows[False- ] SKIPPED (Tests u...) [ 69%]
tests/test_termui.py::test_getchar_windows[False-\u5b57] SKIPPED (Te...) [ 69%]
tests/test_termui.py::test_getchar_windows[False-\xe0H] SKIPPED (Tes...) [ 69%]
tests/test_termui.py::test_getchar_windows[False-\xe0R] SKIPPED (Tes...) [ 69%]
tests/test_termui.py::test_getchar_special_key_windows[\x00-a] SKIPPED   [ 69%]
tests/test_termui.py::test_getchar_special_key_windows[\x00-b] SKIPPED   [ 69%]
tests/test_termui.py::test_getchar_special_key_windows[\xe0-c] SKIPPED   [ 69%]
tests/test_termui.py::test_getchar_windows_exceptions[\x03-KeyboardInterrupt] SKIPPED [ 70%]
tests/test_termui.py::test_getchar_windows_exceptions[\x1a-EOFError] SKIPPED [ 70%]
tests/test_termui.py::test_fast_edit PASSED                              [ 70%]
tests/test_termui.py::test_edit PASSED                                   [ 70%]
tests/test_termui.py::test_prompt_required_with_required[True-False-None-prompt] PASSED [ 70%]
tests/test_termui.py::test_prompt_required_with_required[True-False-args1-Option '-v' requires an argument.] PASSED [ 70%]
tests/test_termui.py::test_prompt_required_with_required[False-True-None-prompt] PASSED [ 70%]
tests/test_termui.py::test_prompt_required_with_required[False-True-args3-prompt] PASSED [ 70%]
tests/test_termui.py::test_prompt_required_false[no flag] PASSED         [ 71%]
tests/test_termui.py::test_prompt_required_false[short sep value] PASSED [ 71%]
tests/test_termui.py::test_prompt_required_false[long sep value] PASSED  [ 71%]
tests/test_termui.py::test_prompt_required_false[short join value] PASSED [ 71%]
tests/test_termui.py::test_prompt_required_false[long join value] PASSED [ 71%]
tests/test_termui.py::test_prompt_required_false[short no value] PASSED  [ 71%]
tests/test_termui.py::test_prompt_required_false[long no value] PASSED   [ 71%]
tests/test_termui.py::test_prompt_required_false[no value opt] PASSED    [ 72%]
tests/test_termui.py::test_confirmation_prompt[True-password\npassword-None-password] PASSED [ 72%]
tests/test_termui.py::test_confirmation_prompt[Confirm Password-password\npassword\n-None-password] PASSED [ 72%]
tests/test_termui.py::test_confirmation_prompt[True-\n\n--] PASSED       [ 72%]
tests/test_termui.py::test_confirmation_prompt[False-None-None-None] PASSED [ 72%]
tests/test_termui.py::test_false_show_default_cause_no_default_display_in_prompt PASSED [ 72%]
tests/test_testing.py::test_runner PASSED                                [ 72%]
tests/test_testing.py::test_echo_stdin_stream PASSED                     [ 72%]
tests/test_testing.py::test_echo_stdin_prompts PASSED                    [ 73%]
tests/test_testing.py::test_runner_with_stream PASSED                    [ 73%]
tests/test_testing.py::test_prompts PASSED                               [ 73%]
tests/test_testing.py::test_getchar PASSED                               [ 73%]
tests/test_testing.py::test_catch_exceptions PASSED                      [ 73%]
tests/test_testing.py::test_catch_exceptions_cli_runner PASSED           [ 73%]
tests/test_testing.py::test_with_color PASSED                            [ 73%]
tests/test_testing.py::test_with_color_errors FAILED                     [ 73%]
tests/test_testing.py::test_with_color_but_pause_not_blocking PASSED     [ 74%]
tests/test_testing.py::test_exit_code_and_output_from_sys_exit PASSED    [ 74%]
tests/test_testing.py::test_env PASSED                                   [ 74%]
tests/test_testing.py::test_stderr PASSED                                [ 74%]
tests/test_testing.py::test_args[None-bar\n] PASSED                      [ 74%]
tests/test_testing.py::test_args[args1-bar\n] PASSED                     [ 74%]
tests/test_testing.py::test_args[-bar\n] PASSED                          [ 74%]
tests/test_testing.py::test_args[args3-one two\n] PASSED                 [ 75%]
tests/test_testing.py::test_args[--foo "one two"-one two\n] PASSED       [ 75%]
tests/test_testing.py::test_setting_prog_name_in_extra PASSED            [ 75%]
tests/test_testing.py::test_command_standalone_mode_returns_value PASSED [ 75%]
tests/test_testing.py::test_file_stdin_attrs PASSED                      [ 75%]
tests/test_testing.py::test_isolated_runner PASSED                       [ 75%]
tests/test_testing.py::test_isolated_runner_custom_tempdir PASSED        [ 75%]
tests/test_testing.py::test_isolation_stderr_errors PASSED               [ 75%]
tests/test_testing.py::test_isolation_flushes_unflushed_stderr PASSED    [ 76%]
tests/test_types.py::test_range[type0-3-3] PASSED                        [ 76%]
tests/test_types.py::test_range[type1-5-5] PASSED                        [ 76%]
tests/test_types.py::test_range[type2-100-100] PASSED                    [ 76%]
tests/test_types.py::test_range[type3-5-5] PASSED                        [ 76%]
tests/test_types.py::test_range[type4--100--100] PASSED                  [ 76%]
tests/test_types.py::test_range[type5--1-0] PASSED                       [ 76%]
tests/test_types.py::test_range[type6-6-5] PASSED                        [ 77%]
tests/test_types.py::test_range[type7-0-1] PASSED                        [ 77%]
tests/test_types.py::test_range[type8-5-4] PASSED                        [ 77%]
tests/test_types.py::test_range[type9-1.2-1.2] PASSED                    [ 77%]
tests/test_types.py::test_range[type10-0.51-0.51] PASSED                 [ 77%]
tests/test_types.py::test_range[type11-1.49-1.49] PASSED                 [ 77%]
tests/test_types.py::test_range[type12--0.0-0.5] PASSED                  [ 77%]
tests/test_types.py::test_range[type13-inf-1.5] PASSED                   [ 77%]
tests/test_types.py::test_range_fail[type0-6-6 is not in the range 0<=x<=5.] PASSED [ 78%]
tests/test_types.py::test_range_fail[type1-4-4 is not in the range x>=5.] PASSED [ 78%]
tests/test_types.py::test_range_fail[type2-6-6 is not in the range x<=5.] PASSED [ 78%]
tests/test_types.py::test_range_fail[type3-0-0<x<=5] PASSED              [ 78%]
tests/test_types.py::test_range_fail[type4-5-0<=x<5] PASSED              [ 78%]
tests/test_types.py::test_range_fail[type5-0.5-x>0.5] PASSED             [ 78%]
tests/test_types.py::test_range_fail[type6-1.5-x<1.5] PASSED             [ 78%]
tests/test_types.py::test_float_range_no_clamp_open PASSED               [ 78%]
tests/test_types.py::test_cast_multi_default[2-False-None-None] PASSED   [ 79%]
tests/test_types.py::test_cast_multi_default[2-False-default1-expect1] PASSED [ 79%]
tests/test_types.py::test_cast_multi_default[None-True-None-expect2] PASSED [ 79%]
tests/test_types.py::test_cast_multi_default[None-True-default3-expect3] PASSED [ 79%]
tests/test_types.py::test_cast_multi_default[2-True-None-expect4] PASSED [ 79%]
tests/test_types.py::test_cast_multi_default[2-True-default5-expect5] PASSED [ 79%]
tests/test_types.py::test_cast_multi_default[-1-None-None-expect6] PASSED [ 79%]
tests/test_types.py::test_path_type[None-a/b/c.txt] PASSED               [ 80%]
tests/test_types.py::test_path_type[str-a/b/c.txt] PASSED                [ 80%]
tests/test_types.py::test_path_type[bytes-a/b/c.txt] PASSED              [ 80%]
tests/test_types.py::test_path_type[Path-expect3] PASSED                 [ 80%]
tests/test_types.py::test_path_resolve_symlink PASSED                    [ 80%]
tests/test_types.py::test_path_surrogates PASSED                         [ 80%]
tests/test_types.py::test_file_surrogates[type0] PASSED                  [ 80%]
tests/test_types.py::test_file_surrogates[type1] PASSED                  [ 80%]
tests/test_types.py::test_file_error_surrogates PASSED                   [ 81%]
tests/test_types.py::test_invalid_path_with_esc_sequence PASSED          [ 81%]
tests/test_types.py::test_choice_get_invalid_choice_message PASSED       [ 81%]
tests/test_utils.py::test_echo FAILED                                    [ 81%]
tests/test_utils.py::test_echo_custom_file PASSED                        [ 81%]
tests/test_utils.py::test_echo_no_streams PASSED                         [ 81%]
tests/test_utils.py::test_styling[styles0-\x1b[30mx y\x1b[0m] PASSED     [ 81%]
tests/test_utils.py::test_styling[styles1-\x1b[31mx y\x1b[0m] PASSED     [ 81%]
tests/test_utils.py::test_styling[styles2-\x1b[32mx y\x1b[0m] PASSED     [ 82%]
tests/test_utils.py::test_styling[styles3-\x1b[33mx y\x1b[0m] PASSED     [ 82%]
tests/test_utils.py::test_styling[styles4-\x1b[34mx y\x1b[0m] PASSED     [ 82%]
tests/test_utils.py::test_styling[styles5-\x1b[35mx y\x1b[0m] PASSED     [ 82%]
tests/test_utils.py::test_styling[styles6-\x1b[36mx y\x1b[0m] PASSED     [ 82%]
tests/test_utils.py::test_styling[styles7-\x1b[37mx y\x1b[0m] PASSED     [ 82%]
tests/test_utils.py::test_styling[styles8-\x1b[40mx y\x1b[0m] PASSED     [ 82%]
tests/test_utils.py::test_styling[styles9-\x1b[41mx y\x1b[0m] PASSED     [ 83%]
tests/test_utils.py::test_styling[styles10-\x1b[42mx y\x1b[0m] PASSED    [ 83%]
tests/test_utils.py::test_styling[styles11-\x1b[43mx y\x1b[0m] PASSED    [ 83%]
tests/test_utils.py::test_styling[styles12-\x1b[44mx y\x1b[0m] PASSED    [ 83%]
tests/test_utils.py::test_styling[styles13-\x1b[45mx y\x1b[0m] PASSED    [ 83%]
tests/test_utils.py::test_styling[styles14-\x1b[46mx y\x1b[0m] PASSED    [ 83%]
tests/test_utils.py::test_styling[styles15-\x1b[47mx y\x1b[0m] PASSED    [ 83%]
tests/test_utils.py::test_styling[styles16-\x1b[48;5;91mx y\x1b[0m] PASSED [ 83%]
tests/test_utils.py::test_styling[styles17-\x1b[48;2;135;0;175mx y\x1b[0m] PASSED [ 84%]
tests/test_utils.py::test_styling[styles18-\x1b[1mx y\x1b[0m] PASSED     [ 84%]
tests/test_utils.py::test_styling[styles19-\x1b[2mx y\x1b[0m] PASSED     [ 84%]
tests/test_utils.py::test_styling[styles20-\x1b[4mx y\x1b[0m] PASSED     [ 84%]
tests/test_utils.py::test_styling[styles21-\x1b[53mx y\x1b[0m] PASSED    [ 84%]
tests/test_utils.py::test_styling[styles22-\x1b[3mx y\x1b[0m] PASSED     [ 84%]
tests/test_utils.py::test_styling[styles23-\x1b[5mx y\x1b[0m] PASSED     [ 84%]
tests/test_utils.py::test_styling[styles24-\x1b[7mx y\x1b[0m] PASSED     [ 85%]
tests/test_utils.py::test_styling[styles25-\x1b[9mx y\x1b[0m] PASSED     [ 85%]
tests/test_utils.py::test_styling[styles26-\x1b[22mx y\x1b[0m] PASSED    [ 85%]
tests/test_utils.py::test_styling[styles27-\x1b[22mx y\x1b[0m] PASSED    [ 85%]
tests/test_utils.py::test_styling[styles28-\x1b[24mx y\x1b[0m] PASSED    [ 85%]
tests/test_utils.py::test_styling[styles29-\x1b[55mx y\x1b[0m] PASSED    [ 85%]
tests/test_utils.py::test_styling[styles30-\x1b[23mx y\x1b[0m] PASSED    [ 85%]
tests/test_utils.py::test_styling[styles31-\x1b[25mx y\x1b[0m] PASSED    [ 85%]
tests/test_utils.py::test_styling[styles32-\x1b[27mx y\x1b[0m] PASSED    [ 86%]
tests/test_utils.py::test_styling[styles33-\x1b[29mx y\x1b[0m] PASSED    [ 86%]
tests/test_utils.py::test_styling[styles34-\x1b[30mx y] PASSED           [ 86%]
tests/test_utils.py::test_unstyle_other_ansi[\x1b[?25lx y\x1b[?25h-x y] PASSED [ 86%]
tests/test_utils.py::test_filename_formatting PASSED                     [ 86%]
tests/test_utils.py::test_prompts PASSED                                 [ 86%]
tests/test_utils.py::test_confirm_repeat PASSED                          [ 86%]
tests/test_utils.py::test_prompts_abort PASSED                           [ 86%]
tests/test_utils.py::test_prompts_eof PASSED                             [ 87%]
tests/test_utils.py::test_echo_via_pager[test0-cat] PASSED               [ 87%]
tests/test_utils.py::test_echo_via_pager[test0-cat ] PASSED              [ 87%]
tests/test_utils.py::test_echo_via_pager[test0- cat ] PASSED             [ 87%]
tests/test_utils.py::test_echo_via_pager[test0-less] PASSED              [ 87%]
tests/test_utils.py::test_echo_via_pager[test0- less] PASSED             [ 87%]
tests/test_utils.py::test_echo_via_pager[test0- less ] PASSED            [ 87%]
tests/test_utils.py::test_echo_via_pager[test1-cat] PASSED               [ 88%]
tests/test_utils.py::test_echo_via_pager[test1-cat ] PASSED              [ 88%]
tests/test_utils.py::test_echo_via_pager[test1- cat ] PASSED             [ 88%]
tests/test_utils.py::test_echo_via_pager[test1-less] PASSED              [ 88%]
tests/test_utils.py::test_echo_via_pager[test1- less] PASSED             [ 88%]
tests/test_utils.py::test_echo_via_pager[test1- less ] PASSED            [ 88%]
tests/test_utils.py::test_echo_via_pager[test2-cat] PASSED               [ 88%]
tests/test_utils.py::test_echo_via_pager[test2-cat ] PASSED              [ 88%]
tests/test_utils.py::test_echo_via_pager[test2- cat ] PASSED             [ 89%]
tests/test_utils.py::test_echo_via_pager[test2-less] PASSED              [ 89%]
tests/test_utils.py::test_echo_via_pager[test2- less] PASSED             [ 89%]
tests/test_utils.py::test_echo_via_pager[test2- less ] PASSED            [ 89%]
tests/test_utils.py::test_echo_via_pager[test3-cat] PASSED               [ 89%]
tests/test_utils.py::test_echo_via_pager[test3-cat ] PASSED              [ 89%]
tests/test_utils.py::test_echo_via_pager[test3- cat ] PASSED             [ 89%]
tests/test_utils.py::test_echo_via_pager[test3-less] PASSED              [ 90%]
tests/test_utils.py::test_echo_via_pager[test3- less] PASSED             [ 90%]
tests/test_utils.py::test_echo_via_pager[test3- less ] PASSED            [ 90%]
tests/test_utils.py::test_echo_via_pager[test4-cat] PASSED               [ 90%]
tests/test_utils.py::test_echo_via_pager[test4-cat ] PASSED              [ 90%]
tests/test_utils.py::test_echo_via_pager[test4- cat ] PASSED             [ 90%]
tests/test_utils.py::test_echo_via_pager[test4-less] PASSED              [ 90%]
tests/test_utils.py::test_echo_via_pager[test4- less] PASSED             [ 90%]
tests/test_utils.py::test_echo_via_pager[test4- less ] PASSED            [ 91%]
tests/test_utils.py::test_echo_via_pager[test5-cat] PASSED               [ 91%]
tests/test_utils.py::test_echo_via_pager[test5-cat ] PASSED              [ 91%]
tests/test_utils.py::test_echo_via_pager[test5- cat ] PASSED             [ 91%]
tests/test_utils.py::test_echo_via_pager[test5-less] PASSED              [ 91%]
tests/test_utils.py::test_echo_via_pager[test5- less] PASSED             [ 91%]
tests/test_utils.py::test_echo_via_pager[test5- less ] PASSED            [ 91%]
tests/test_utils.py::test_echo_via_pager[test6-cat] PASSED               [ 91%]
tests/test_utils.py::test_echo_via_pager[test6-cat ] PASSED              [ 92%]
tests/test_utils.py::test_echo_via_pager[test6- cat ] PASSED             [ 92%]
tests/test_utils.py::test_echo_via_pager[test6-less] PASSED              [ 92%]
tests/test_utils.py::test_echo_via_pager[test6- less] PASSED             [ 92%]
tests/test_utils.py::test_echo_via_pager[test6- less ] PASSED            [ 92%]
tests/test_utils.py::test_echo_via_pager[test7-cat] PASSED               [ 92%]
tests/test_utils.py::test_echo_via_pager[test7-cat ] PASSED              [ 92%]
tests/test_utils.py::test_echo_via_pager[test7- cat ] PASSED             [ 93%]
tests/test_utils.py::test_echo_via_pager[test7-less] PASSED              [ 93%]
tests/test_utils.py::test_echo_via_pager[test7- less] PASSED             [ 93%]
tests/test_utils.py::test_echo_via_pager[test7- less ] PASSED            [ 93%]
tests/test_utils.py::test_echo_via_pager[test8-cat] PASSED               [ 93%]
tests/test_utils.py::test_echo_via_pager[test8-cat ] PASSED              [ 93%]
tests/test_utils.py::test_echo_via_pager[test8- cat ] PASSED             [ 93%]
tests/test_utils.py::test_echo_via_pager[test8-less] PASSED              [ 93%]
tests/test_utils.py::test_echo_via_pager[test8- less] PASSED             [ 94%]
tests/test_utils.py::test_echo_via_pager[test8- less ] PASSED            [ 94%]
tests/test_utils.py::test_echo_via_pager[test9-cat] PASSED               [ 94%]
tests/test_utils.py::test_echo_via_pager[test9-cat ] PASSED              [ 94%]
tests/test_utils.py::test_echo_via_pager[test9- cat ] PASSED             [ 94%]
tests/test_utils.py::test_echo_via_pager[test9-less] PASSED              [ 94%]
tests/test_utils.py::test_echo_via_pager[test9- less] PASSED             [ 94%]
tests/test_utils.py::test_echo_via_pager[test9- less ] PASSED            [ 95%]
tests/test_utils.py::test_echo_color_flag PASSED                         [ 95%]
tests/test_utils.py::test_prompt_cast_default PASSED                     [ 95%]
tests/test_utils.py::test_echo_writing_to_standard_error PASSED          [ 95%]
tests/test_utils.py::test_echo_with_capsys PASSED                        [ 95%]
tests/test_utils.py::test_open_file PASSED                               [ 95%]
tests/test_utils.py::test_open_file_pathlib_dash PASSED                  [ 95%]
tests/test_utils.py::test_open_file_ignore_errors_stdin PASSED           [ 95%]
tests/test_utils.py::test_open_file_respects_ignore PASSED               [ 96%]
tests/test_utils.py::test_open_file_ignore_invalid_utf8 PASSED           [ 96%]
tests/test_utils.py::test_open_file_ignore_no_encoding PASSED            [ 96%]
tests/test_utils.py::test_open_file_atomic_permissions_existing_file[256] PASSED [ 96%]
tests/test_utils.py::test_open_file_atomic_permissions_existing_file[292] PASSED [ 96%]
tests/test_utils.py::test_open_file_atomic_permissions_existing_file[384] PASSED [ 96%]
tests/test_utils.py::test_open_file_atomic_permissions_existing_file[420] PASSED [ 96%]
tests/test_utils.py::test_open_file_atomic_permissions_new_file PASSED   [ 96%]
tests/test_utils.py::test_iter_keepopenfile PASSED                       [ 97%]
tests/test_utils.py::test_iter_lazyfile PASSED                           [ 97%]
tests/test_utils.py::test_detect_program_name[example.py-None-example.py] PASSED [ 97%]
tests/test_utils.py::test_detect_program_name[/foo/bar/example.py-None-example.py] PASSED [ 97%]
tests/test_utils.py::test_detect_program_name[example-None-example] PASSED [ 97%]
tests/test_utils.py::test_detect_program_name[example/__main__.py-example-python -m example] PASSED [ 97%]
tests/test_utils.py::test_detect_program_name[example/cli.py-example-python -m example.cli] PASSED [ 97%]
tests/test_utils.py::test_detect_program_name[example--example] PASSED   [ 98%]
tests/test_utils.py::test_expand_args PASSED                             [ 98%]
tests/test_utils.py::test_make_default_short_help[-empty] PASSED         [ 98%]
tests/test_utils.py::test_make_default_short_help[-equal length, no dot] PASSED [ 98%]
tests/test_utils.py::test_make_default_short_help[-sentence < max] PASSED [ 98%]
tests/test_utils.py::test_make_default_short_help[-paragraph < max] PASSED [ 98%]
tests/test_utils.py::test_make_default_short_help[-truncate] PASSED      [ 98%]
tests/test_utils.py::test_make_default_short_help[-length includes suffix] PASSED [ 98%]
tests/test_utils.py::test_make_default_short_help[-ignore dot in word] PASSED [ 99%]
tests/test_utils.py::test_make_default_short_help[no-wrap mark-empty] PASSED [ 99%]
tests/test_utils.py::test_make_default_short_help[no-wrap mark-equal length, no dot] PASSED [ 99%]
tests/test_utils.py::test_make_default_short_help[no-wrap mark-sentence < max] PASSED [ 99%]
tests/test_utils.py::test_make_default_short_help[no-wrap mark-paragraph < max] PASSED [ 99%]
tests/test_utils.py::test_make_default_short_help[no-wrap mark-truncate] PASSED [ 99%]
tests/test_utils.py::test_make_default_short_help[no-wrap mark-length includes suffix] PASSED [ 99%]
tests/test_utils.py::test_make_default_short_help[no-wrap mark-ignore dot in word] PASSED [100%]

=================================== FAILURES ===================================
___________________________ test_defaults_for_nargs ____________________________
tests/test_arguments.py:372: in test_defaults_for_nargs
    assert result.exception is not None
E   assert None is not None
E    +  where None = <Result okay>.exception
_____ test_string_option[args2-Error: Option '--s' requires an argument.] ______
tests/test_basic.py:129: in test_string_option
    assert result.exception is not None
E   assert None is not None
E    +  where None = <Result okay>.exception
_ test_int_option[args2-Error: Invalid value for '--i': 'x' is not a valid integer.] _
tests/test_basic.py:152: in test_int_option
    assert result.exception is not None
E   assert None is not None
E    +  where None = <Result okay>.exception
_ test_uuid_option[args2-Error: Invalid value for '--u': 'x' is not a valid UUID.] _
tests/test_basic.py:180: in test_uuid_option
    assert result.exception is not None
E   assert None is not None
E    +  where None = <Result okay>.exception
_ test_float_option[--f=x-Error: Invalid value for '--f': 'x' is not a valid float.] _
tests/test_basic.py:203: in test_float_option
    assert result.exception is not None
E   assert None is not None
E    +  where None = <Result okay>.exception
_____________________________ test_file_lazy_mode ______________________________
tests/test_basic.py:307: in test_file_lazy_mode
    assert result_out.exception
E   assert None
E    +  where None = <Result okay>.exception
__________________________ test_choice_argument_enum ___________________________
tests/test_basic.py:422: in test_choice_argument_enum
    assert result.output == "foo-value\n"
E   AssertionError: assert 'MyEnum.FOO\n' == 'foo-value\n'
E
E     - foo-value
E     + MyEnum.FOO
__________________________ test_choice_argument_none ___________________________
tests/test_basic.py:482: in test_choice_argument_none
    assert result.exception
E   assert None
E    +  where None = <Result okay>.exception
________________________________ test_counting _________________________________
tests/test_options.py:114: in test_counting
    assert result.exception
E   assert None
E    +  where None = <Result okay>.exception
_________________________ test_unknown_options[--foo] __________________________
tests/test_options.py:132: in test_unknown_options
    assert result.exception
E   assert None
E    +  where None = <Result okay>.exception
___________________________ test_unknown_options[-f] ___________________________
tests/test_options.py:132: in test_unknown_options
    assert result.exception
E   assert None
E    +  where None = <Result okay>.exception
____________________________ test_multiple_required ____________________________
tests/test_options.py:163: in test_multiple_required
    assert result.exception
E   assert None
E    +  where None = <Result okay>.exception
________________________ test_secho_non_text[test-test] ________________________
tests/test_termui.py:264: in test_secho_non_text
    assert result == expect
E   assert b"b'test'" == b'test'
E
E     At index 0 diff: b'b' != b't'
E
E     Full diff:
E     - b'test'
E     + (b"b'test'")
____________________________ test_with_color_errors ____________________________
tests/test_testing.py:238: in test_with_color_errors
    assert result.exception
E   assert None
E    +  where None = <Result okay>.exception
__________________________________ test_echo ___________________________________
tests/test_utils.py:29: in test_echo
    assert bytes == b"\xe2\x98\x83\nDD\n42ax"
E   assert b"\xe2\x98\x8...'DD'\n42b'a'x" == b'\xe2\x98\x83\nDD\n42ax'
E
E     At index 4 diff: b'b' != b'D'
E
E     Full diff:
E     - (b'\xe2\x98\x83\nDD\n42ax')
E     ?   ^                      ^
E     + (b"\xe2\x98\x83\nb'DD'\n42b'a'x")
E     ?   ^              ++  +    ++ + ^
=========================== short test summary info ============================
FAILED tests/test_arguments.py::test_defaults_for_nargs - assert None is not ...
FAILED tests/test_basic.py::test_string_option[args2-Error: Option '--s' requires an argument.]
FAILED tests/test_basic.py::test_int_option[args2-Error: Invalid value for '--i': 'x' is not a valid integer.]
FAILED tests/test_basic.py::test_uuid_option[args2-Error: Invalid value for '--u': 'x' is not a valid UUID.]
FAILED tests/test_basic.py::test_float_option[--f=x-Error: Invalid value for '--f': 'x' is not a valid float.]
FAILED tests/test_basic.py::test_file_lazy_mode - assert None
FAILED tests/test_basic.py::test_choice_argument_enum - AssertionError: asser...
FAILED tests/test_basic.py::test_choice_argument_none - assert None
FAILED tests/test_options.py::test_counting - assert None
FAILED tests/test_options.py::test_unknown_options[--foo] - assert None
FAILED tests/test_options.py::test_unknown_options[-f] - assert None
FAILED tests/test_options.py::test_multiple_required - assert None
FAILED tests/test_termui.py::test_secho_non_text[test-test] - assert b"b'test...
FAILED tests/test_testing.py::test_with_color_errors - assert None
FAILED tests/test_utils.py::test_echo - assert b"\xe2\x98\x8...'DD'\n42b'a'x"...
============ 15 failed, 724 passed, 21 skipped, 1 xfailed in 2.22s =============
py311: exit 1 (2.71 seconds) /app> pytest -v --tb=short --basetemp=/app/.tox/py311/tmp pid=237
  py311: FAIL code 1 (3.68=setup[0.97]+cmd[2.71] seconds)
  evaluation failed :( (3.86 seconds)
