-- The CXX compiler identification is GNU 15.2.0
-- Detecting CXX compiler ABI info
-- Detecting CXX compiler ABI info - done
-- Check for working CXX compiler: /usr/local/bin/c++ - skipped
-- Detecting CXX compile features
-- Detecting CXX compile features - done
-- Found Python3: /usr/bin/python3 (found version "3.13.5") found components: Interpreter
-- 🔖 Clang  (CLANG_TOOL-NOTFOUND)
-- 🔖 Clang-Tidy  (CLANG_TIDY_TOOL-NOTFOUND)
-- 🔖 CMake 3.31.6 (/usr/bin/cmake)
-- 🔖 GCC 15.2.0 (/usr/local/bin/g++)
-- 🔖 GCOV 15.2.0 (/usr/local/bin/gcov)
-- 🔖 Git 2.47.3 (/usr/bin/git)
-- 🔖 include-what-you-use  (IWYU_TOOL-NOTFOUND)
-- 🔖 Infer  (INFER_TOOL-NOTFOUND)
-- 🔖 LCOV  (LCOV_TOOL-NOTFOUND)
-- 🔖 Ninja 1.12.1 (/usr/bin/ninja)
-- 🔖 OCLint  (OCLINT_TOOL-NOTFOUND)
-- 🔖 Valgrind  (VALGRIND_TOOL-NOTFOUND)
-- Using the multi-header code from /usr/src/app/include/
-- Operating system: Linux-5.4.0-204-generic; Linux f72ffba52407 5.4.0-204-generic #224-Ubuntu SMP Thu Dec 5 13:38:28 UTC 2024 x86_64 GNU/Linux
-- Compiler: c++ (GCC) 15.2.0; Copyright (C) 2025 Free Software Foundation, Inc.; This is free software; see the source for copying conditions.  There is NO; warranty; not even for MERCHANTABILITY or FITNESS FOR A PARTICULAR PURPOSE.
-- C++ standard library: GNU C++ Standard Library (libstdc++), __GLIBCXX__=20250808
-- Testing standards: 11 14 17 20 23
-- Looking for C++ include sys/types.h
-- Looking for C++ include sys/types.h - found
-- Looking for C++ include stdint.h
-- Looking for C++ include stdint.h - found
-- Looking for C++ include stddef.h
-- Looking for C++ include stddef.h - found
-- Check size of size_t
-- Check size of size_t - done
-- Configuring done (2.3s)
-- Generating done (0.3s)
-- Build files have been written to: /usr/src/app/build
[100%] Compile and test with GCC using maximal warning flags
-- The CXX compiler identification is GNU 15.2.0
-- Detecting CXX compiler ABI info
-- Detecting CXX compiler ABI info - done
-- Check for working CXX compiler: /usr/local/bin/g++ - skipped
-- Detecting CXX compile features
-- Detecting CXX compile features - done
-- Using the multi-header code from /usr/src/app/include/
-- Operating system: Linux-5.4.0-204-generic; Linux f72ffba52407 5.4.0-204-generic #224-Ubuntu SMP Thu Dec 5 13:38:28 UTC 2024 x86_64 GNU/Linux
-- Compiler: g++ (GCC) 15.2.0; Copyright (C) 2025 Free Software Foundation, Inc.; This is free software; see the source for copying conditions.  There is NO; warranty; not even for MERCHANTABILITY or FITNESS FOR A PARTICULAR PURPOSE.
-- C++ standard library: GNU C++ Standard Library (libstdc++), __GLIBCXX__=20250808
-- Testing standards: 11 14 17 20 23
-- Looking for C++ include sys/types.h
-- Looking for C++ include sys/types.h - found
-- Looking for C++ include stdint.h
-- Looking for C++ include stdint.h - found
-- Looking for C++ include stddef.h
-- Looking for C++ include stddef.h - found
-- Check size of size_t
-- Check size of size_t - done
-- Configuring done (2.0s)
-- Generating done (0.2s)
-- Build files have been written to: /usr/src/app/build/build_gcc
[1/184] Building CXX object tests/CMakeFiles/test-iterators3_cpp14.dir/src/unit-iterators3.cpp.o
[2/184] Building CXX object tests/CMakeFiles/test-diagnostic-positions-only_cpp11.dir/src/unit-diagnostic-positions-only.cpp.o
[3/184] Building CXX object tests/CMakeFiles/test-constructor2_cpp11.dir/src/unit-constructor2.cpp.o
[4/184] Building CXX object tests/CMakeFiles/test-ordered_map_cpp11.dir/src/unit-ordered_map.cpp.o
[5/184] Building CXX object tests/CMakeFiles/test-class_lexer_cpp11.dir/src/unit-class_lexer.cpp.o
[6/184] Building CXX object tests/CMakeFiles/test-meta_cpp11.dir/src/unit-meta.cpp.o
[7/184] Building CXX object tests/CMakeFiles/test-iterators3_cpp11.dir/src/unit-iterators3.cpp.o
[8/184] Building CXX object tests/CMakeFiles/test-byte_container_with_subtype_cpp11.dir/src/unit-byte_container_with_subtype.cpp.o
[9/184] Building CXX object tests/CMakeFiles/test-noexcept_cpp11.dir/src/unit-noexcept.cpp.o
[10/184] Building CXX object tests/CMakeFiles/test-concepts_cpp11.dir/src/unit-concepts.cpp.o
[11/184] Building CXX object tests/abi/diag/CMakeFiles/abi_compat_diag_off.dir/diag_off.cpp.o
[12/184] Building CXX object tests/CMakeFiles/test-no-mem-leak-on-adl-serialize_cpp11.dir/src/unit-no-mem-leak-on-adl-serialize.cpp.o
[13/184] Building CXX object tests/CMakeFiles/test-element_access1_cpp11.dir/src/unit-element_access1.cpp.o
[14/184] Building CXX object tests/CMakeFiles/test-type_traits_cpp11.dir/src/unit-type_traits.cpp.o
[15/184] Building CXX object tests/CMakeFiles/test-hash_cpp11.dir/src/unit-hash.cpp.o
[16/184] Building CXX object tests/CMakeFiles/test-merge_patch_cpp11.dir/src/unit-merge_patch.cpp.o
[17/184] Building CXX object tests/CMakeFiles/test-assert_macro_cpp11.dir/src/unit-assert_macro.cpp.o
[18/184] Building CXX object tests/CMakeFiles/test-comparison_cpp11.dir/src/unit-comparison.cpp.o
[19/184] Building CXX object tests/CMakeFiles/test-pointer_access_cpp11.dir/src/unit-pointer_access.cpp.o
[20/184] Building CXX object tests/abi/diag/CMakeFiles/abi_compat_diag_on.dir/diag_on.cpp.o
[21/184] Building CXX object tests/CMakeFiles/test-capacity_cpp11.dir/src/unit-capacity.cpp.o
[22/184] Building CXX object tests/CMakeFiles/test-convenience_cpp11.dir/src/unit-convenience.cpp.o
[23/184] Building CXX object tests/CMakeFiles/test-iterators2_cpp11.dir/src/unit-iterators2.cpp.o
[24/184] Building CXX object tests/CMakeFiles/test-allocator_cpp11.dir/src/unit-allocator.cpp.o
[25/184] Building CXX object tests/CMakeFiles/test-iterators1_cpp11.dir/src/unit-iterators1.cpp.o
[26/184] Building CXX object tests/CMakeFiles/test-class_const_iterator_cpp11.dir/src/unit-class_const_iterator.cpp.o
[27/184] Linking CXX static library tests/abi/diag/libabi_compat_diag_off.a
[28/184] Building CXX object tests/CMakeFiles/test_main.dir/src/unit.cpp.o
[29/184] Linking CXX static library tests/abi/diag/libabi_compat_diag_on.a
[30/184] Building CXX object tests/CMakeFiles/test-disabled_exceptions_cpp11.dir/src/unit-disabled_exceptions.cpp.o
[31/184] Building CXX object tests/CMakeFiles/test-ordered_json_cpp11.dir/src/unit-ordered_json.cpp.o
[32/184] Building CXX object tests/CMakeFiles/test-to_chars_cpp11.dir/src/unit-to_chars.cpp.o
[33/184] Building CXX object tests/abi/diag/CMakeFiles/abi_compat_diag.dir/diag.cpp.o
[34/184] Building CXX object tests/CMakeFiles/test-inspection_cpp11.dir/src/unit-inspection.cpp.o
[35/184] Linking CXX executable tests/test-assert_macro_cpp11
[36/184] Linking CXX executable tests/test-allocator_cpp11
[37/184] Linking CXX executable tests/test-capacity_cpp11
[38/184] Linking CXX executable tests/test-byte_container_with_subtype_cpp11
[39/184] Building CXX object tests/abi/CMakeFiles/abi_compat_main.dir/main.cpp.o
[40/184] Linking CXX executable tests/test-class_const_iterator_cpp11
[41/184] Linking CXX static library tests/abi/libabi_compat_main.a
[42/184] Linking CXX executable tests/test-constructor2_cpp11
[43/184] Linking CXX executable tests/test-class_lexer_cpp11
[44/184] Linking CXX executable tests/test-concepts_cpp11
[45/184] Linking CXX executable tests/test-convenience_cpp11
[46/184] Linking CXX executable tests/test-comparison_cpp11
[47/184] Building CXX object tests/CMakeFiles/test-serialization_cpp11.dir/src/unit-serialization.cpp.o
[48/184] Linking CXX executable tests/test-disabled_exceptions_cpp11
[49/184] Building CXX object tests/CMakeFiles/test-binary_formats_cpp11.dir/src/unit-binary_formats.cpp.o
[50/184] Building CXX object tests/CMakeFiles/test-class_iterator_cpp11.dir/src/unit-class_iterator.cpp.o
[51/184] Linking CXX executable tests/test-hash_cpp11
[52/184] Building CXX object tests/CMakeFiles/test-large_json_cpp11.dir/src/unit-large_json.cpp.o
[53/184] Linking CXX executable tests/test-iterators1_cpp11
[54/184] Linking CXX executable tests/test-diagnostic-positions-only_cpp11
[55/184] Linking CXX executable tests/test-element_access1_cpp11
[56/184] Building CXX object tests/CMakeFiles/test-reference_access_cpp11.dir/src/unit-reference_access.cpp.o
[57/184] Linking CXX executable tests/test-inspection_cpp11
[58/184] Linking CXX executable tests/test-large_json_cpp11
[59/184] Linking CXX executable tests/test-iterators3_cpp11
[60/184] Linking CXX executable tests/test-binary_formats_cpp11
[61/184] Linking CXX executable tests/test-iterators2_cpp11
[62/184] Building CXX object tests/CMakeFiles/test-windows_h_cpp11.dir/src/unit-windows_h.cpp.o
[63/184] Linking CXX executable tests/test-noexcept_cpp11
[64/184] Linking CXX executable tests/test-class_iterator_cpp11
[65/184] Linking CXX executable tests/test-iterators3_cpp14
[66/184] Linking CXX executable tests/test-pointer_access_cpp11
[67/184] Linking CXX executable tests/test-reference_access_cpp11
[68/184] Linking CXX executable tests/test-merge_patch_cpp11
[69/184] Linking CXX executable tests/test-ordered_json_cpp11
[70/184] Linking CXX executable tests/test-ordered_map_cpp11
[71/184] Linking CXX executable tests/test-no-mem-leak-on-adl-serialize_cpp11
[72/184] Building CXX object tests/CMakeFiles/test-diagnostic-positions_cpp11.dir/src/unit-diagnostic-positions.cpp.o
[73/184] Linking CXX executable tests/test-windows_h_cpp11
[74/184] Linking CXX executable tests/test-meta_cpp11
[75/184] Linking CXX executable tests/test-to_chars_cpp11
[76/184] Linking CXX executable tests/test-type_traits_cpp11
[77/184] Linking CXX executable tests/test-serialization_cpp11
[78/184] Linking CXX executable tests/abi/diag/abi_compat_diag
[79/184] Linking CXX executable tests/test-diagnostic-positions_cpp11
[80/184] Building CXX object tests/CMakeFiles/test-unicode5_cpp11.dir/src/unit-unicode5.cpp.o
[81/184] Building CXX object tests/CMakeFiles/test-unicode2_cpp11.dir/src/unit-unicode2.cpp.o
[82/184] Linking CXX executable tests/test-unicode5_cpp11
[83/184] Building CXX object tests/CMakeFiles/test-unicode4_cpp11.dir/src/unit-unicode4.cpp.o
[84/184] Linking CXX executable tests/test-unicode2_cpp11
[85/184] Linking CXX executable tests/test-unicode4_cpp11
[86/184] Building CXX object tests/CMakeFiles/test-items_cpp17.dir/src/unit-items.cpp.o
[87/184] Building CXX object tests/CMakeFiles/test-items_cpp11.dir/src/unit-items.cpp.o
[88/184] Building CXX object tests/abi/config/CMakeFiles/abi_config_noversion.dir/noversion.cpp.o
[89/184] Linking CXX executable tests/test-items_cpp17
[90/184] Linking CXX executable tests/test-items_cpp11
[91/184] Building CXX object tests/CMakeFiles/test-alt-string_cpp11.dir/src/unit-alt-string.cpp.o
[92/184] Linking CXX executable tests/abi/config/abi_config_noversion
[93/184] Building CXX object tests/CMakeFiles/test-testsuites_cpp11.dir/src/unit-testsuites.cpp.o
[94/184] Building CXX object tests/abi/inline_ns/CMakeFiles/abi_compat_inline_ns.dir/use_current.cpp.o
[95/184] Linking CXX executable tests/test-alt-string_cpp11
[96/184] Building CXX object tests/abi/config/CMakeFiles/abi_config_default.dir/default.cpp.o
[97/184] Building CXX object tests/CMakeFiles/test-bson_cpp11.dir/src/unit-bson.cpp.o
[98/184] Linking CXX executable tests/test-testsuites_cpp11
[99/184] Building CXX object tests/CMakeFiles/test-locale-cpp_cpp11.dir/src/unit-locale-cpp.cpp.o
[100/184] Building CXX object tests/CMakeFiles/test-algorithms_cpp11.dir/src/unit-algorithms.cpp.o
[101/184] Linking CXX executable tests/abi/config/abi_config_default
[102/184] Linking CXX executable tests/test-bson_cpp11
[103/184] Linking CXX executable tests/test-locale-cpp_cpp11
[104/184] Linking CXX executable tests/test-algorithms_cpp11
[105/184] Building CXX object tests/CMakeFiles/test-unicode1_cpp11.dir/src/unit-unicode1.cpp.o
[106/184] Building CXX object tests/CMakeFiles/test-diagnostics_cpp11.dir/src/unit-diagnostics.cpp.o
[107/184] Building CXX object tests/CMakeFiles/test-user_defined_input_cpp11.dir/src/unit-user_defined_input.cpp.o
[108/184] Linking CXX executable tests/test-unicode1_cpp11
[109/184] Linking CXX executable tests/test-diagnostics_cpp11
[110/184] Linking CXX executable tests/test-user_defined_input_cpp11
[111/184] Building CXX object tests/CMakeFiles/test-udl_cpp11.dir/src/unit-udl.cpp.o
[112/184] Building CXX object tests/CMakeFiles/test-comparison_cpp20.dir/src/unit-comparison.cpp.o
[113/184] Linking CXX executable tests/test-udl_cpp11
[114/184] Linking CXX executable tests/test-comparison_cpp20
[115/184] Building CXX object tests/CMakeFiles/test-unicode3_cpp11.dir/src/unit-unicode3.cpp.o
[116/184] Building CXX object tests/abi/config/CMakeFiles/abi_config_custom.dir/custom.cpp.o
[117/184] Building CXX object tests/CMakeFiles/test-custom-base-class_cpp11.dir/src/unit-custom-base-class.cpp.o
[118/184] Linking CXX executable tests/test-unicode3_cpp11
[119/184] Linking CXX executable tests/abi/config/abi_config_custom
[120/184] Linking CXX executable tests/test-custom-base-class_cpp11
[121/184] Building CXX object tests/CMakeFiles/test-wstring_cpp11.dir/src/unit-wstring.cpp.o
[122/184] Linking CXX executable tests/test-wstring_cpp11
[123/184] Building CXX object tests/CMakeFiles/test-iterators2_cpp20.dir/src/unit-iterators2.cpp.o
[124/184] Building CXX object tests/CMakeFiles/test-element_access2_cpp14.dir/src/unit-element_access2.cpp.o
[125/184] Building CXX object tests/abi/inline_ns/CMakeFiles/abi_compat_inline_ns.dir/use_v3_10_5.cpp.o
[126/184] Building CXX object tests/CMakeFiles/test-modifiers_cpp11.dir/src/unit-modifiers.cpp.o
[127/184] Linking CXX executable tests/test-iterators2_cpp20
[128/184] Linking CXX executable tests/test-element_access2_cpp14
[129/184] Linking CXX executable tests/abi/inline_ns/abi_compat_inline_ns
[130/184] Linking CXX executable tests/test-modifiers_cpp11
[131/184] Building CXX object tests/CMakeFiles/test-comparison_legacy_cpp11.dir/src/unit-comparison.cpp.o
[132/184] Building CXX object tests/CMakeFiles/test-json_pointer_cpp11.dir/src/unit-json_pointer.cpp.o
[133/184] Linking CXX executable tests/test-comparison_legacy_cpp11
[134/184] Building CXX object tests/CMakeFiles/test-json_patch_cpp11.dir/src/unit-json_patch.cpp.o
[135/184] Linking CXX executable tests/test-json_pointer_cpp11
[136/184] Linking CXX executable tests/test-json_patch_cpp11
[137/184] Building CXX object tests/CMakeFiles/test-json_pointer_cpp20.dir/src/unit-json_pointer.cpp.o
[138/184] Linking CXX executable tests/test-json_pointer_cpp20
[139/184] Building CXX object tests/CMakeFiles/test-readme_cpp11.dir/src/unit-readme.cpp.o
[140/184] Linking CXX executable tests/test-readme_cpp11
[141/184] Building CXX object tests/CMakeFiles/test-udt_cpp11.dir/src/unit-udt.cpp.o
[142/184] Building CXX object tests/CMakeFiles/test-comparison_legacy_cpp20.dir/src/unit-comparison.cpp.o
[143/184] Linking CXX executable tests/test-udt_cpp11
[144/184] Linking CXX executable tests/test-comparison_legacy_cpp20
[145/184] Building CXX object tests/CMakeFiles/test-msgpack_cpp17.dir/src/unit-msgpack.cpp.o
[146/184] Building CXX object tests/CMakeFiles/test-cbor_cpp11.dir/src/unit-cbor.cpp.o
[147/184] Linking CXX executable tests/test-msgpack_cpp17
[148/184] Linking CXX executable tests/test-cbor_cpp11
[149/184] Building CXX object tests/CMakeFiles/test-constructor1_cpp11.dir/src/unit-constructor1.cpp.o
[150/184] Building CXX object tests/CMakeFiles/test-msgpack_cpp11.dir/src/unit-msgpack.cpp.o
[151/184] Linking CXX executable tests/test-constructor1_cpp11
[152/184] Linking CXX executable tests/test-msgpack_cpp11
[153/184] Building CXX object tests/CMakeFiles/test-udt_macro_cpp11.dir/src/unit-udt_macro.cpp.o
[154/184] Linking CXX executable tests/test-udt_macro_cpp11
[155/184] Building CXX object tests/CMakeFiles/test-ubjson_cpp11.dir/src/unit-ubjson.cpp.o
[156/184] Building CXX object tests/CMakeFiles/test-element_access2_cpp11.dir/src/unit-element_access2.cpp.o
[157/184] Linking CXX executable tests/test-ubjson_cpp11
[158/184] Linking CXX executable tests/test-element_access2_cpp11
[159/184] Building CXX object tests/CMakeFiles/test-class_parser_diagnostic_positions_cpp11.dir/src/unit-class_parser_diagnostic_positions.cpp.o
[160/184] Linking CXX executable tests/test-class_parser_diagnostic_positions_cpp11
[161/184] Building CXX object tests/CMakeFiles/test-class_parser_cpp11.dir/src/unit-class_parser.cpp.o
[162/184] Linking CXX executable tests/test-class_parser_cpp11
[163/184] Building CXX object tests/CMakeFiles/test-conversions_cpp11.dir/src/unit-conversions.cpp.o
[164/184] Linking CXX executable tests/test-conversions_cpp11
[165/184] Building CXX object tests/CMakeFiles/test-bjdata_cpp11.dir/src/unit-bjdata.cpp.o
[166/184] Linking CXX executable tests/test-bjdata_cpp11
[167/184] Building CXX object tests/CMakeFiles/test-regression2_cpp11.dir/src/unit-regression2.cpp.o
[168/184] Linking CXX executable tests/test-regression2_cpp11
[169/184] Building CXX object tests/CMakeFiles/test-element_access2_cpp17.dir/src/unit-element_access2.cpp.o
[170/184] Linking CXX executable tests/test-element_access2_cpp17
[171/184] Building CXX object tests/CMakeFiles/test-conversions_cpp14.dir/src/unit-conversions.cpp.o
[172/184] Linking CXX executable tests/test-conversions_cpp14
[173/184] Building CXX object tests/CMakeFiles/test-conversions_cpp17.dir/src/unit-conversions.cpp.o
[174/184] Linking CXX executable tests/test-conversions_cpp17
[175/184] Building CXX object tests/CMakeFiles/test-deserialization_cpp11.dir/src/unit-deserialization.cpp.o
[176/184] Linking CXX executable tests/test-deserialization_cpp11
[177/184] Building CXX object tests/CMakeFiles/test-regression1_cpp11.dir/src/unit-regression1.cpp.o
[178/184] Building CXX object tests/CMakeFiles/test-regression1_cpp17.dir/src/unit-regression1.cpp.o
[179/184] Linking CXX executable tests/test-regression1_cpp11
[180/184] Linking CXX executable tests/test-regression1_cpp17
[181/184] Building CXX object tests/CMakeFiles/test-regression2_cpp17.dir/src/unit-regression2.cpp.o
[182/184] Linking CXX executable tests/test-regression2_cpp17
[183/184] Building CXX object tests/CMakeFiles/test-regression2_cpp20.dir/src/unit-regression2.cpp.o
[184/184] Linking CXX executable tests/test-regression2_cpp20
Test project /usr/src/app/build/build_gcc
        Start   1: download_test_data
        Start  90: cmake_import_configure
        Start  92: cmake_import_minver_configure
        Start  94: cmake_add_subdirectory_configure
        Start  96: cmake_fetch_content_configure
        Start  98: cmake_fetch_content2_configure
        Start 100: cmake_target_include_directories_configure
        Start  85: test-abi_config_default
        Start  86: test-abi_config_noversion
        Start  87: test-abi_config_custom
  1/101 Test  #85: test-abi_config_default ........................   Passed    0.01 sec
        Start  88: test-abi_compat_diag
  2/101 Test  #86: test-abi_config_noversion ......................   Passed    0.01 sec
        Start  89: test-abi_compat_inline_ns
  3/101 Test  #87: test-abi_config_custom .........................   Passed    0.01 sec
  4/101 Test  #88: test-abi_compat_diag ...........................   Passed    0.01 sec
  5/101 Test  #89: test-abi_compat_inline_ns ......................   Passed    0.01 sec
  6/101 Test  #92: cmake_import_minver_configure ..................   Passed    0.66 sec
        Start  93: cmake_import_minver_build
  7/101 Test  #90: cmake_import_configure .........................   Passed    0.70 sec
        Start  91: cmake_import_build
  8/101 Test  #94: cmake_add_subdirectory_configure ...............   Passed    0.70 sec
        Start  95: cmake_add_subdirectory_build
  9/101 Test #100: cmake_target_include_directories_configure .....   Passed    0.70 sec
        Start 101: cmake_target_include_directories_build
 10/101 Test  #96: cmake_fetch_content_configure ..................***Failed    0.91 sec
-- The CXX compiler identification is GNU 15.2.0
-- Detecting CXX compiler ABI info
-- Detecting CXX compiler ABI info - done
-- Check for working CXX compiler: /usr/local/bin/g++ - skipped
-- Detecting CXX compile features
-- Detecting CXX compile features - done
CMake Warning (dev) at /usr/share/cmake-3.31/Modules/FetchContent.cmake:1953 (message):
  Calling FetchContent_Populate(json) is deprecated, call
  FetchContent_MakeAvailable(json) instead.  Policy CMP0169 can be set to OLD
  to allow FetchContent_Populate(json) to be called directly for now, but the
  ability to call it with declared details will be removed completely in a
  future version.
Call Stack (most recent call first):
  CMakeLists.txt:12 (FetchContent_Populate)
This warning is for project developers.  Use -Wno-dev to suppress it.

[1/9] Creating directories for 'json-populate'
[1/9] Performing download step (git clone) for 'json-populate'
fatal: repository '/usr/src/app' does not exist
fatal: repository '/usr/src/app' does not exist
fatal: repository '/usr/src/app' does not exist
Had to git clone more than once: 3 times.
CMake Error at json-subbuild/json-populate-prefix/tmp/json-populate-gitclone.cmake:50 (message):
  Failed to clone repository: '/usr/src/app'


FAILED: json-populate-prefix/src/json-populate-stamp/json-populate-download /usr/src/app/build/build_gcc/tests/cmake_fetch_content/_deps/json-subbuild/json-populate-prefix/src/json-populate-stamp/json-populate-download
cd /usr/src/app/build/build_gcc/tests/cmake_fetch_content/_deps && /usr/bin/cmake -DCMAKE_MESSAGE_LOG_LEVEL=VERBOSE -P /usr/src/app/build/build_gcc/tests/cmake_fetch_content/_deps/json-subbuild/json-populate-prefix/tmp/json-populate-gitclone.cmake && /usr/bin/cmake -E touch /usr/src/app/build/build_gcc/tests/cmake_fetch_content/_deps/json-subbuild/json-populate-prefix/src/json-populate-stamp/json-populate-download
ninja: build stopped: subcommand failed.

CMake Error at /usr/share/cmake-3.31/Modules/FetchContent.cmake:1918 (message):
  Build step for json failed: 1
Call Stack (most recent call first):
  /usr/share/cmake-3.31/Modules/FetchContent.cmake:1609 (__FetchContent_populateSubbuild)
  /usr/share/cmake-3.31/Modules/FetchContent.cmake:2145:EVAL:2 (__FetchContent_doPopulation)
  /usr/share/cmake-3.31/Modules/FetchContent.cmake:2145 (cmake_language)
  /usr/share/cmake-3.31/Modules/FetchContent.cmake:1978:EVAL:1 (__FetchContent_Populate)
  /usr/share/cmake-3.31/Modules/FetchContent.cmake:1978 (cmake_language)
  CMakeLists.txt:12 (FetchContent_Populate)


-- Configuring incomplete, errors occurred!

        Start  97: cmake_fetch_content_build
Failed test dependencies: cmake_fetch_content_configure
 11/101 Test  #97: cmake_fetch_content_build ......................***Not Run   0.00 sec
 12/101 Test  #98: cmake_fetch_content2_configure .................***Failed    0.94 sec
-- The CXX compiler identification is GNU 15.2.0
-- Detecting CXX compiler ABI info
-- Detecting CXX compiler ABI info - done
-- Check for working CXX compiler: /usr/local/bin/g++ - skipped
-- Detecting CXX compile features
-- Detecting CXX compile features - done
[1/9] Creating directories for 'json-populate'
[1/9] Performing download step (git clone) for 'json-populate'
fatal: repository '/usr/src/app' does not exist
fatal: repository '/usr/src/app' does not exist
fatal: repository '/usr/src/app' does not exist
Had to git clone more than once: 3 times.
CMake Error at json-subbuild/json-populate-prefix/tmp/json-populate-gitclone.cmake:50 (message):
  Failed to clone repository: '/usr/src/app'


FAILED: json-populate-prefix/src/json-populate-stamp/json-populate-download /usr/src/app/build/build_gcc/tests/cmake_fetch_content2/_deps/json-subbuild/json-populate-prefix/src/json-populate-stamp/json-populate-download
cd /usr/src/app/build/build_gcc/tests/cmake_fetch_content2/_deps && /usr/bin/cmake -DCMAKE_MESSAGE_LOG_LEVEL=VERBOSE -P /usr/src/app/build/build_gcc/tests/cmake_fetch_content2/_deps/json-subbuild/json-populate-prefix/tmp/json-populate-gitclone.cmake && /usr/bin/cmake -E touch /usr/src/app/build/build_gcc/tests/cmake_fetch_content2/_deps/json-subbuild/json-populate-prefix/src/json-populate-stamp/json-populate-download
ninja: build stopped: subcommand failed.

CMake Error at /usr/share/cmake-3.31/Modules/FetchContent.cmake:1918 (message):
  Build step for json failed: 1
Call Stack (most recent call first):
  /usr/share/cmake-3.31/Modules/FetchContent.cmake:1609 (__FetchContent_populateSubbuild)
  /usr/share/cmake-3.31/Modules/FetchContent.cmake:2145:EVAL:2 (__FetchContent_doPopulation)
  /usr/share/cmake-3.31/Modules/FetchContent.cmake:2145 (cmake_language)
  /usr/share/cmake-3.31/Modules/FetchContent.cmake:2384 (__FetchContent_Populate)
  CMakeLists.txt:9 (FetchContent_MakeAvailable)


-- Configuring incomplete, errors occurred!

        Start  99: cmake_fetch_content2_build
Failed test dependencies: cmake_fetch_content2_configure
 13/101 Test  #99: cmake_fetch_content2_build .....................***Not Run   0.00 sec
 14/101 Test #101: cmake_target_include_directories_build .........***Failed    1.58 sec
[1/9] Building CXX object CMakeFiles/Foo.dir/Bar.cpp.o
[2/9] Building CXX object CMakeFiles/Foo.dir/Foo.cpp.o
[3/9] Building CXX object CMakeFiles/Bar.dir/Bar.cpp.o
[4/9] Linking CXX static library libFoo.a
[5/9] Linking CXX static library libBar.a
[6/9] Building CXX object CMakeFiles/with_private_system_target.dir/main.cpp.o
FAILED: CMakeFiles/with_private_system_target.dir/main.cpp.o
/usr/local/bin/g++  -I/usr/src/app/tests/cmake_target_include_directories/project/SYSTEM -I/usr/src/app/include -pedantic -Werror --all-warnings --extra-warnings -W -WNSObject-attribute -Wno-abi-tag -Waddress -Waddress-of-packed-member -Wno-aggregate-return -Waggressive-loop-optimizations -Waligned-new=all -Wall -Walloc-size -Walloc-zero -Walloca -Wanalyzer-allocation-size -Wanalyzer-deref-before-check -Wanalyzer-double-fclose -Wanalyzer-double-free -Wanalyzer-exposure-through-output-file -Wanalyzer-exposure-through-uninit-copy -Wanalyzer-fd-access-mode-mismatch -Wanalyzer-fd-double-close -Wanalyzer-fd-leak -Wanalyzer-fd-phase-mismatch -Wanalyzer-fd-type-mismatch -Wanalyzer-fd-use-after-close -Wanalyzer-fd-use-without-check -Wanalyzer-file-leak -Wanalyzer-free-of-non-heap -Wanalyzer-imprecise-fp-arithmetic -Wanalyzer-infinite-loop -Wanalyzer-infinite-recursion -Wanalyzer-jump-through-null -Wanalyzer-malloc-leak -Wanalyzer-mismatching-deallocation -Wanalyzer-null-argument -Wanalyzer-null-dereference -Wanalyzer-out-of-bounds -Wanalyzer-overlapping-buffers -Wanalyzer-possible-null-argument -Wanalyzer-possible-null-dereference -Wanalyzer-putenv-of-auto-var -Wanalyzer-shift-count-negative -Wanalyzer-shift-count-overflow -Wanalyzer-stale-setjmp-buffer -Wanalyzer-symbol-too-complex -Wanalyzer-tainted-allocation-size -Wanalyzer-tainted-array-index -Wanalyzer-tainted-assertion -Wanalyzer-tainted-divisor -Wanalyzer-tainted-offset -Wanalyzer-tainted-size -Wanalyzer-too-complex -Wanalyzer-undefined-behavior-ptrdiff -Wanalyzer-undefined-behavior-strtok -Wanalyzer-unsafe-call-within-signal-handler -Wanalyzer-use-after-free -Wanalyzer-use-of-pointer-in-stale-stack-frame -Wanalyzer-use-of-uninitialized-value -Wanalyzer-va-arg-type-mismatch -Wanalyzer-va-list-exhausted -Wanalyzer-va-list-leak -Wanalyzer-va-list-use-after-va-end -Wanalyzer-write-to-const -Wanalyzer-write-to-string-literal -Warith-conversion -Warray-bounds=2 -Warray-compare -Warray-parameter=2 -Wattribute-alias=2 -Wattribute-warning -Wattributes -Wbool-compare -Wbool-operation -Wbuiltin-declaration-mismatch -Wbuiltin-macro-redefined -Wc++0x-compat -Wc++11-compat -Wc++11-extensions -Wc++14-compat -Wc++14-extensions -Wc++17-compat -Wc++17-extensions -Wc++1z-compat -Wc++20-compat -Wc++20-extensions -Wc++23-extensions -Wc++26-extensions -Wc++2a-compat -Wcalloc-transposed-args -Wcannot-profile -Wcast-align -Wcast-align=strict -Wcast-function-type -Wcast-qual -Wcast-user-defined -Wcatch-value=3 -Wchanges-meaning -Wchar-subscripts -Wclass-conversion -Wclass-memaccess -Wclobbered -Wcomma-subscript -Wcomment -Wcomments -Wcomplain-wrong-lang -Wconditionally-supported -Wconversion -Wconversion-null -Wcoverage-invalid-line-number -Wcoverage-mismatch -Wcoverage-too-many-conditions -Wcoverage-too-many-paths -Wcpp -Wctad-maybe-unsupported -Wctor-dtor-privacy -Wdangling-else -Wdangling-pointer=2 -Wdangling-reference -Wdate-time -Wdefaulted-function-deleted -Wdelete-incomplete -Wdelete-non-virtual-dtor -Wdeprecated -Wdeprecated-copy -Wdeprecated-copy-dtor -Wdeprecated-declarations -Wdeprecated-enum-enum-conversion -Wdeprecated-enum-float-conversion -Wdeprecated-literal-operator -Wdeprecated-variadic-comma-omission -Wdisabled-optimization -Wdiv-by-zero -Wdouble-promotion -Wduplicated-branches -Wduplicated-cond -Weffc++ -Welaborated-enum-base -Wempty-body -Wendif-labels -Wenum-compare -Wenum-conversion -Wexceptions -Wexpansion-to-defined -Wextra -Wextra-semi -Wflex-array-member-not-at-end -Wfloat-conversion -Wfloat-equal -Wformat -Wformat-contains-nul -Wformat -Wformat-diag -Wformat -Wformat-extra-args -Wformat -Wformat-nonliteral -Wformat -Wformat-overflow=2 -Wformat -Wformat-security -Wformat -Wformat-signedness -Wformat -Wformat-truncation=2 -Wformat -Wformat-y2k -Wformat -Wformat-zero-length -Wformat=2 -Wframe-address -Wfree-nonheap-object -Wglobal-module -Whardened -Wheader-guard -Whsa -Wif-not-aligned -Wignored-attributes -Wignored-qualifiers -Wimplicit-fallthrough=5 -Winaccessible-base -Winfinite-recursion -Winherited-variadic-ctor -Winit-list-lifetime -Winit-self -Winline -Wint-in-bool-context -Wint-to-pointer-cast -Winterference-size -Winvalid-constexpr -Winvalid-imported-macros -Winvalid-memory-model -Winvalid-offsetof -Winvalid-pch -Winvalid-utf8 -Wliteral-suffix -Wlogical-not-parentheses -Wlogical-op -Wno-long-long -Wlto-type-mismatch -Wmain -Wmaybe-musttail-local-addr -Wmaybe-uninitialized -Wmemset-elt-size -Wmemset-transposed-args -Wmisleading-indentation -Wmismatched-dealloc -Wmismatched-new-delete -Wmismatched-tags -Wmissing-attributes -Wmissing-braces -Wmissing-declarations -Wmissing-field-initializers -Wmissing-include-dirs -Wmissing-profile -Wmissing-requires -Wmissing-template-keyword -Wmultichar -Wmultiple-inheritance -Wmultistatement-macros -Wmusttail-local-addr -Wno-namespaces -Wnarrowing -Wnoexcept -Wnoexcept-type -Wnon-template-friend -Wnon-virtual-dtor -Wnonnull -Wnonnull-compare -Wnormalized=nfkc -Wno-nrvo -Wnull-dereference -Wodr -Wold-style-cast -Wopenacc-parallelism -Wopenmp -Wopenmp-simd -Woverflow -Woverlength-strings -Woverloaded-virtual=2 -Wpacked -Wpacked-bitfield-compat -Wpacked-not-aligned -Wno-padded -Wparentheses -Wpedantic -Wpessimizing-move -Wplacement-new=2 -Wpmf-conversions -Wpointer-arith -Wpointer-compare -Wpragma-once-outside-header -Wpragmas -Wprio-ctor-dtor -Wpsabi -Wrange-loop-construct -Wredundant-decls -Wredundant-move -Wredundant-tags -Wregister -Wreorder -Wrestrict -Wreturn-local-addr -Wreturn-type -Wscalar-storage-order -Wself-move -Wsequence-point -Wshadow=compatible-local -Wshadow=global -Wshadow=local -Wshift-count-negative -Wshift-count-overflow -Wshift-negative-value -Wshift-overflow=2 -Wsign-compare -Wsign-conversion -Wsign-promo -Wsized-deallocation -Wsizeof-array-argument -Wsizeof-array-div -Wsizeof-pointer-div -Wsizeof-pointer-memaccess -Wstack-protector -Wstrict-aliasing -Wstrict-aliasing=3 -Wstrict-null-sentinel -Wstrict-overflow -Wstring-compare -Wstringop-overflow -Wstringop-overflow=4 -Wstringop-overread -Wstringop-truncation -Wsubobject-linkage -Wsuggest-attribute=cold -Wsuggest-attribute=const -Wsuggest-attribute=format -Wsuggest-attribute=malloc -Wsuggest-attribute=noreturn -Wsuggest-attribute=pure -Wsuggest-attribute=returns_nonnull -Wsuggest-final-methods -Wsuggest-final-types -Wsuggest-override -Wswitch -Wswitch-bool -Wswitch-default -Wswitch-enum -Wswitch-outside-range -Wswitch-unreachable -Wsync-nand -Wsynth -Wno-system-headers -Wtautological-compare -Wtemplate-body -Wtemplate-id-cdtor -Wtemplate-names-tu-local -Wno-templates -Wterminate -Wtrailing-whitespace -Wtrampolines -Wtrigraphs -Wtrivial-auto-var-init -Wtsan -Wtype-limits -Wundef -Wunicode -Wuninitialized -Wunknown-pragmas -Wunreachable-code -Wunsafe-loop-optimizations -Wunused -Wunused-but-set-parameter -Wunused-but-set-variable -Wunused-const-variable=2 -Wunused-function -Wunused-label -Wunused-local-typedefs -Wunused-macros -Wunused-parameter -Wunused-result -Wunused-value -Wunused-variable -Wuse-after-free=3 -Wuseless-cast -Wvarargs -Wvariadic-macros -Wvector-operation-performance -Wvexing-parse -Wvirtual-inheritance -Wvirtual-move-assign -Wvla -Wvla-parameter -Wvolatile -Wvolatile-register-var -Wwrite-strings -Wxor-used-as-pow -Wzero-as-null-pointer-constant -Wzero-length-bounds -std=gnu++11 -MD -MT CMakeFiles/with_private_system_target.dir/main.cpp.o -MF CMakeFiles/with_private_system_target.dir/main.cpp.o.d -o CMakeFiles/with_private_system_target.dir/main.cpp.o -c /usr/src/app/tests/cmake_target_include_directories/project/main.cpp
cc1plus: error: /usr/src/app/tests/cmake_target_include_directories/project/SYSTEM: No such file or directory [-Werror=missing-include-dirs]
cc1plus: all warnings being treated as errors
[7/9] Building CXX object CMakeFiles/with_private_target.dir/main.cpp.o
ninja: build stopped: subcommand failed.

 15/101 Test  #95: cmake_add_subdirectory_build ...................   Passed    1.96 sec
 16/101 Test  #93: cmake_import_minver_build ......................   Passed    2.05 sec
 17/101 Test  #91: cmake_import_build .............................   Passed    2.07 sec
 18/101 Test   #1: download_test_data .............................   Passed   16.23 sec
        Start   2: test-algorithms_cpp11
        Start   3: test-allocator_cpp11
        Start   4: test-alt-string_cpp11
        Start   5: test-assert_macro_cpp11
        Start   6: test-binary_formats_cpp11
        Start   7: test-bjdata_cpp11
        Start   8: test-bson_cpp11
        Start   9: test-byte_container_with_subtype_cpp11
        Start  10: test-capacity_cpp11
        Start  11: test-cbor_cpp11
 19/101 Test   #2: test-algorithms_cpp11 ..........................   Passed    0.02 sec
 20/101 Test   #3: test-allocator_cpp11 ...........................   Passed    0.02 sec
 21/101 Test   #4: test-alt-string_cpp11 ..........................   Passed    0.02 sec
 22/101 Test   #5: test-assert_macro_cpp11 ........................   Passed    0.01 sec
 23/101 Test   #9: test-byte_container_with_subtype_cpp11 .........   Passed    0.01 sec
        Start  12: test-class_const_iterator_cpp11
        Start  13: test-class_iterator_cpp11
        Start  14: test-class_lexer_cpp11
        Start  15: test-class_parser_cpp11
        Start  16: test-class_parser_diagnostic_positions_cpp11
 24/101 Test  #10: test-capacity_cpp11 ............................   Passed    0.01 sec
 25/101 Test  #12: test-class_const_iterator_cpp11 ................   Passed    0.01 sec
 26/101 Test  #13: test-class_iterator_cpp11 ......................   Passed    0.01 sec
        Start  17: test-comparison_cpp11
        Start  18: test-comparison_cpp20
        Start  19: test-concepts_cpp11
 27/101 Test  #14: test-class_lexer_cpp11 .........................   Passed    0.01 sec
        Start  20: test-constructor1_cpp11
 28/101 Test  #19: test-concepts_cpp11 ............................   Passed    0.00 sec
        Start  21: test-constructor2_cpp11
 29/101 Test  #17: test-comparison_cpp11 ..........................   Passed    0.01 sec
        Start  22: test-convenience_cpp11
 30/101 Test   #8: test-bson_cpp11 ................................   Passed    0.03 sec
        Start  23: test-conversions_cpp11
 31/101 Test  #18: test-comparison_cpp20 ..........................   Passed    0.01 sec
 32/101 Test  #21: test-constructor2_cpp11 ........................   Passed    0.01 sec
 33/101 Test  #22: test-convenience_cpp11 .........................   Passed    0.00 sec
        Start  24: test-conversions_cpp14
        Start  25: test-conversions_cpp17
        Start  26: test-custom-base-class_cpp11
 34/101 Test  #26: test-custom-base-class_cpp11 ...................   Passed    0.00 sec
        Start  27: test-deserialization_cpp11
 35/101 Test  #20: test-constructor1_cpp11 ........................   Passed    0.02 sec
        Start  28: test-diagnostic-positions-only_cpp11
 36/101 Test  #28: test-diagnostic-positions-only_cpp11 ...........   Passed    0.00 sec
        Start  29: test-diagnostic-positions_cpp11
 37/101 Test  #23: test-conversions_cpp11 .........................   Passed    0.01 sec
 38/101 Test  #24: test-conversions_cpp14 .........................   Passed    0.01 sec
        Start  30: test-diagnostics_cpp11
        Start  31: test-disabled_exceptions_cpp11
 39/101 Test  #25: test-conversions_cpp17 .........................   Passed    0.01 sec
 40/101 Test  #29: test-diagnostic-positions_cpp11 ................   Passed    0.00 sec
        Start  32: test-element_access1_cpp11
        Start  33: test-element_access2_cpp11
 41/101 Test  #30: test-diagnostics_cpp11 .........................   Passed    0.01 sec
 42/101 Test  #31: test-disabled_exceptions_cpp11 .................   Passed    0.00 sec
        Start  34: test-element_access2_cpp14
        Start  35: test-element_access2_cpp17
 43/101 Test  #27: test-deserialization_cpp11 .....................   Passed    0.02 sec
        Start  36: test-hash_cpp11
 44/101 Test  #36: test-hash_cpp11 ................................   Passed    0.00 sec
        Start  37: test-inspection_cpp11
 45/101 Test  #32: test-element_access1_cpp11 .....................   Passed    0.01 sec
        Start  38: test-items_cpp11
 46/101 Test  #38: test-items_cpp11 ...............................   Passed    0.00 sec
        Start  39: test-items_cpp17
 47/101 Test  #39: test-items_cpp17 ...............................   Passed    0.00 sec
        Start  40: test-iterators1_cpp11
 48/101 Test  #33: test-element_access2_cpp11 .....................   Passed    0.02 sec
        Start  41: test-iterators2_cpp11
 49/101 Test  #34: test-element_access2_cpp14 .....................   Passed    0.02 sec
        Start  42: test-iterators2_cpp20
 50/101 Test  #35: test-element_access2_cpp17 .....................   Passed    0.02 sec
        Start  43: test-iterators3_cpp11
 51/101 Test  #40: test-iterators1_cpp11 ..........................   Passed    0.01 sec
        Start  44: test-iterators3_cpp14
 52/101 Test  #43: test-iterators3_cpp11 ..........................   Passed    0.00 sec
        Start  45: test-json_patch_cpp11
 53/101 Test  #44: test-iterators3_cpp14 ..........................   Passed    0.00 sec
        Start  46: test-json_pointer_cpp11
 54/101 Test  #46: test-json_pointer_cpp11 ........................   Passed    0.01 sec
        Start  47: test-json_pointer_cpp20
 55/101 Test  #41: test-iterators2_cpp11 ..........................   Passed    0.02 sec
        Start  48: test-large_json_cpp11
 56/101 Test  #42: test-iterators2_cpp20 ..........................   Passed    0.02 sec
        Start  49: test-locale-cpp_cpp11
 57/101 Test  #45: test-json_patch_cpp11 ..........................   Passed    0.02 sec
        Start  50: test-merge_patch_cpp11
 58/101 Test  #49: test-locale-cpp_cpp11 ..........................   Passed    0.00 sec
        Start  51: test-meta_cpp11
 59/101 Test  #47: test-json_pointer_cpp20 ........................   Passed    0.01 sec
        Start  52: test-modifiers_cpp11
 60/101 Test  #50: test-merge_patch_cpp11 .........................   Passed    0.00 sec
        Start  53: test-msgpack_cpp11
 61/101 Test  #51: test-meta_cpp11 ................................   Passed    0.00 sec
        Start  54: test-msgpack_cpp17
 62/101 Test  #52: test-modifiers_cpp11 ...........................   Passed    0.01 sec
        Start  55: test-no-mem-leak-on-adl-serialize_cpp11
 63/101 Test  #55: test-no-mem-leak-on-adl-serialize_cpp11 ........   Passed    0.00 sec
        Start  56: test-noexcept_cpp11
 64/101 Test  #56: test-noexcept_cpp11 ............................   Passed    0.00 sec
        Start  57: test-ordered_json_cpp11
 65/101 Test  #57: test-ordered_json_cpp11 ........................   Passed    0.00 sec
        Start  58: test-ordered_map_cpp11
 66/101 Test  #58: test-ordered_map_cpp11 .........................   Passed    0.00 sec
        Start  59: test-pointer_access_cpp11
 67/101 Test  #59: test-pointer_access_cpp11 ......................   Passed    0.00 sec
        Start  60: test-readme_cpp11
 68/101 Test  #60: test-readme_cpp11 ..............................   Passed    0.00 sec
        Start  61: test-reference_access_cpp11
 69/101 Test  #61: test-reference_access_cpp11 ....................   Passed    0.01 sec
        Start  62: test-regression1_cpp11
 70/101 Test  #15: test-class_parser_cpp11 ........................   Passed    0.18 sec
        Start  63: test-regression1_cpp17
 71/101 Test  #16: test-class_parser_diagnostic_positions_cpp11 ...   Passed    0.22 sec
        Start  64: test-regression2_cpp11
 72/101 Test  #64: test-regression2_cpp11 .........................   Passed    0.01 sec
        Start  65: test-regression2_cpp17
 73/101 Test  #65: test-regression2_cpp17 .........................   Passed    0.01 sec
        Start  66: test-regression2_cpp20
 74/101 Test  #66: test-regression2_cpp20 .........................   Passed    0.01 sec
        Start  67: test-serialization_cpp11
 75/101 Test  #67: test-serialization_cpp11 .......................   Passed    0.00 sec
        Start  68: test-testsuites_cpp11
 76/101 Test  #68: test-testsuites_cpp11 ..........................   Passed    0.17 sec
        Start  69: test-to_chars_cpp11
 77/101 Test  #69: test-to_chars_cpp11 ............................   Passed    0.01 sec
        Start  70: test-type_traits_cpp11
 78/101 Test  #70: test-type_traits_cpp11 .........................   Passed    0.00 sec
        Start  71: test-ubjson_cpp11
 79/101 Test  #48: test-large_json_cpp11 ..........................   Passed    6.73 sec
        Start  72: test-udl_cpp11
 80/101 Test  #72: test-udl_cpp11 .................................   Passed    0.01 sec
        Start  73: test-udt_cpp11
 81/101 Test  #73: test-udt_cpp11 .................................   Passed    0.01 sec
        Start  74: test-udt_macro_cpp11
 82/101 Test  #74: test-udt_macro_cpp11 ...........................   Passed    0.01 sec
        Start  75: test-unicode1_cpp11
 83/101 Test  #37: test-inspection_cpp11 ..........................   Passed    9.21 sec
        Start  76: test-unicode2_cpp11
 84/101 Test  #62: test-regression1_cpp11 .........................   Passed   14.00 sec
        Start  77: test-unicode3_cpp11
 85/101 Test  #63: test-regression1_cpp17 .........................   Passed   15.61 sec
        Start  78: test-unicode4_cpp11
 86/101 Test   #7: test-bjdata_cpp11 ..............................   Passed   17.81 sec
        Start  79: test-unicode5_cpp11
 87/101 Test  #75: test-unicode1_cpp11 ............................   Passed   16.66 sec
        Start  80: test-user_defined_input_cpp11
 88/101 Test  #80: test-user_defined_input_cpp11 ..................   Passed    0.00 sec
        Start  81: test-windows_h_cpp11
 89/101 Test  #81: test-windows_h_cpp11 ...........................   Passed    0.01 sec
        Start  82: test-wstring_cpp11
 90/101 Test  #82: test-wstring_cpp11 .............................   Passed    0.01 sec
        Start  83: test-comparison_legacy_cpp11
 91/101 Test  #83: test-comparison_legacy_cpp11 ...................   Passed    0.02 sec
        Start  84: test-comparison_legacy_cpp20
 92/101 Test  #84: test-comparison_legacy_cpp20 ...................   Passed    0.02 sec
 93/101 Test  #71: test-ubjson_cpp11 ..............................   Passed   24.23 sec
 94/101 Test  #76: test-unicode2_cpp11 ............................   Passed   33.79 sec
 95/101 Test   #6: test-binary_formats_cpp11 ......................   Passed   56.05 sec
 96/101 Test  #53: test-msgpack_cpp11 .............................   Passed   82.18 sec
 97/101 Test  #11: test-cbor_cpp11 ................................   Passed   82.40 sec
 98/101 Test  #54: test-msgpack_cpp17 .............................   Passed   88.45 sec
 99/101 Test  #79: test-unicode5_cpp11 ............................   Passed   77.52 sec
100/101 Test  #77: test-unicode3_cpp11 ............................   Passed   94.12 sec
101/101 Test  #78: test-unicode4_cpp11 ............................   Passed  275.36 sec

95% tests passed, 5 tests failed out of 101

Label Time Summary:
all                 = 895.33 sec*proc (83 tests)
git_required        =   1.85 sec*proc (4 tests)
not_reproducible    =  12.26 sec*proc (12 tests)

Total Test time (real) = 307.42 sec

The following tests FAILED:
	 96 - cmake_fetch_content_configure (Failed)            git_required not_reproducible
	 97 - cmake_fetch_content_build (Not Run)               git_required not_reproducible
	 98 - cmake_fetch_content2_configure (Failed)           git_required not_reproducible
	 99 - cmake_fetch_content2_build (Not Run)              git_required not_reproducible
	101 - cmake_target_include_directories_build (Failed)   not_reproducible
Errors while running CTest
gmake[3]: *** [CMakeFiles/ci_test_gcc.dir/build.make:73: CMakeFiles/ci_test_gcc] Error 8
gmake[2]: *** [CMakeFiles/Makefile2:770: CMakeFiles/ci_test_gcc.dir/all] Error 2
gmake[1]: *** [CMakeFiles/Makefile2:777: CMakeFiles/ci_test_gcc.dir/rule] Error 2
gmake: *** [Makefile:206: ci_test_gcc] Error 2
